Product Code,Product Label,"UAE export to india Value in 2022, USD thousands","nnual growth in value uae export to india between 2018-2022, %, p.a","Share in United Arab Emirates's exports, %",Equivalent ad valorem tariff faced by United Arab Emirates,Quantity exported from uae to india in 2022 ,Quantity unit ,Unit value (USD/unit) ,Number of non-tariff requirements faced by United Arab Emirates ,"india import from world Value in 2022, USD thousand ","Annual growth in value of india import from world between 2018-2022, %, p.a. ","Share in world imports, % ",Quantity exported from india to world in 2022 ,Quantity unit ,Unit value (USD/unit) ,"UAE texport to world Value in 2022, USD thousand ","Annual growthof uae export to world in value between 2018-2022, %, p.a. ","Share in world exports, % ",Quantity exported from uae to world in 2022 ,Quantity unit ,Unit value (USD/unit) ,"Estimation of untapped potential trade, USD thousand"
10121,Pure-bred breeding horses, , , ,30, , , ,9,"1,992", ,0,45,Tons,"44,267","3,300",-12,0,0,Tons, ,
10129,Live horses (excl. pure-bred for breeding), , , ,30, , , ,24,"1,230",-18,0,47,Tons,"26,170",878,-35,0,0,Tons, ,
10229,Live cattle (excl. pure-bred for breeding), , , , , , , ,,0, ,0, , , ,"5,602", ,0,0, , ,
10391,"Live pure-bred swine, weighing < 50 kg (excl. pure-bred for breeding)", , ,0,30, , , ,9,325,205,0,148, ,"2,196", , , ,0, , ,
10410,Live sheep, , , ,30, , , ,20,0, ,0, ,Tons, ,339, ,0,0,Tons, ,
10420,Live goats, , ,0,30, , , ,10,0, ,0, ,Units, , , , ,0,Units, ,
10511,"Live fowls of the species Gallus domesticus, weighing <= 185 g (excl. turkeys and guinea fowls)", , , ,30, , , ,5,"3,552",0,0,"57,191",Tons,62,16,-25,0,20,Tons,"53,000",3
10594,"Live fowls of the species Gallus domesticus, weighing > 185", , , ,30, , , ,5,0, ,0, ,Tons, ,28,-28,0,0,Tons, ,
10611,Live primates, , ,0,30, , , ,9,2, ,0,0, , , , , ,0, , ,
10612,"Live whales, dolphins and porpoises (mammals of the order Cetacea); manatees and dugongs (mammals . . .", , , , , , , ,,0, ,0, , , ,1, ,0, , , ,
10613,Live camels and other camelids [Camelidae], , , , , , , ,,0, ,0, , , ,"12,287",345,8,0, , ,
10614,Live rabbits and hares, , , , , , , ,,0, ,0, , , ,1,78,0,0, , ,
10619,"Live mammals (excl. primates, whales, dolphins and porpoises, manatees and dugongs, seals, . . .", , , ,30, , , ,9,"2,165",7,1,"49,523",Tons,44,259,1,0,0,Tons, ,
10620,"Live reptiles ""e.g. snakes, turtles, alligators, caymans, iguanas, gavials and lizards""", , , , , , , ,,0, ,0, , , ,19,163,0,0, , ,
10631,Live birds of prey, , , , , , , ,,0, ,0, , , ,609,11,2,0, , ,
10632,"Live psittaciformes ""incl. parrots, parrakeets, macaws and cockatoos""", , , , , , , ,,0, ,0, , , ,206,139,1,0, , ,
10639,"Live birds (excl. birds of prey, psittaciformes, parrots, parrakeets, macaws, cockatoos, ostriches . . .", , , ,30, , , ,8,269, ,1,724, ,372,437,-28,1,0, , ,
10649,Live insects (excl. bees), , ,0,30, , , ,32,4,-41,0,574, ,7, , , ,0, , ,
10690,"Live animals (excl. mammals, reptiles, birds, insects, fish, crustaceans, molluscs and other . . .",3,18,25,30,8,Tons,375,8,"1,306",5,1,"11,380",Tons,115,12,-25,0,0,Tons, ,
20110,"Carcases or half-carcases of bovine animals, fresh or chilled", , , ,30, , , ,54,0, ,0, ,Tons, ,17,0,0,"38,415",Tons,"4,511",
20120,"Fresh or chilled bovine cuts, with bone in (excl. carcases and 1/2 carcases)", , , ,30, , , ,58,0, ,0, ,Tons, ,34,-39,0,"2,290",Tons,"9,909",
20130,"Fresh or chilled bovine meat, boneless", , , ,30, , , ,59,0, ,0, ,Tons, ,242,-25,0,"29,140",Tons,"8,822",
20220,"Frozen bovine cuts, with bone in (excl. carcases and half-carcases)", , , ,30, , , ,58,0, ,0, ,Tons, ,38,-39,0,"2,042",Tons,"7,135",
20230,"Frozen, boneless meat of bovine animals", , , ,30, , , ,59,0, ,0, ,Tons, ,"3,944",3,0,"101,593",Tons,"3,858",
20312,"Fresh or chilled hams, shoulders and cuts thereof of swine, with bone in", , , ,30, , , ,48,0, ,0, ,Tons, ,1, ,0,22,Tons,"2,227",
20319,"Fresh or chilled meat of swine (excl. carcases and half-carcases, and hams, shoulders and cuts . . .", , , ,30, , , ,48,455,7,0,50, ,"9,100",9, ,0,188, ,"7,277",
20321,Frozen carcases and half-carcases of swine, , ,0,30, , , ,44,200,11,0,69,Tons,"2,899", , , ,90,Tons,"3,267",
20322,"Frozen hams, shoulders and cuts thereof of swine, with bone in", , , ,30, , , ,48,609,24,0,147,Tons,"4,143",21,-17,0,"1,731",Tons,"1,776",-
20329,"Frozen meat of swine (excl. carcases and half-carcases, and hams, shoulders and cuts thereof, . . .", , , ,30, , , ,48,"1,933",3,0,430, ,"4,495",114,-40,0,"13,507", ,"2,512",-
20410,Fresh or chilled lamb carcases and half-carcases, , ,0,30, , , ,53,0, ,0, ,Tons, , , , ,"13,817",Tons,"6,571",
20421,Fresh or chilled sheep carcases and half-carcases (excl. lambs), , ,0,30, , , ,53,0, ,0, ,Tons, , , , ,"8,771",Tons,"6,960",
20430,Frozen lamb carcases and half-carcases, , ,0,30, , , ,53,33,-15,0,8,Tons,"4,125", , , ,"2,057",Tons,"5,785",
20441,Frozen sheep carcases and half-carcases (excl. lambs), , ,0,30, , , ,53,0, ,0, ,Tons, , , , ,985,Tons,"4,470",
20442,"Frozen cuts of sheep, with bone in (excl. carcases and half-carcases)", , , ,30, , , ,57,"1,174",-13,0,96,Tons,"12,229",30,-45,0,"6,131",Tons,"6,259",1
20443,Frozen boneless cuts of sheep, , , ,30, , , ,57,165,-33,0,25,Tons,"6,600",17,-52,0,"2,493",Tons,"8,081",-
20610,Fresh or chilled edible offal of bovine animals, , , ,30, , , ,49,0, ,0, ,Tons, ,87, ,0,134,Tons,"4,500",
20622,Frozen edible bovine livers, , , ,30, , , ,49,0, ,0, ,Tons, ,96,26,0,"1,767",Tons,"1,339",
20629,Frozen edible bovine offal (excl. tongues and livers), , , ,30, , , ,49,0, ,0, ,Tons, ,"3,829", ,0,"3,983",Tons,"1,993",
20649,"Edible offal of swine, frozen (excl. livers)", , , , , , , ,,0, ,0, , , ,338, ,0,"2,768", ,"1,238",
20712,"Frozen fowls of the species Gallus domesticus, not cut in pieces", , , ,30, , , ,45,57,116,0,28,Tons,"2,036",176,-18,0,"277,686",Tons,"1,869",-
20714,Frozen cuts and edible offal of fowls of the species Gallus domesticus, , , ,100, , , ,45,0, ,0, ,Tons, ,"5,052",-7,0,"265,336",Tons,"2,103",1
20725,"Frozen turkeys of the species domesticus, not cut into pieces",69, ,76,30,10, ,"6,900",45,181,12,0,32, ,"5,656",91,-6,0,391, ,"2,703",-
20726,Fresh or chilled cuts and edible offal of turkeys of the species domesticus, , , , , , , ,,0, ,0, , , ,6, ,0,47, ,"4,468",
20727,Frozen cuts and edible offal of turkeys of the species domesticus, , , ,30, , , ,45,22,22,0,4, ,"5,500",261,-6,0,"2,351", ,"2,595",-
20742,"Frozen domestic ducks, not cut in pieces", , , ,30, , , ,45,439,0,0,114, ,"3,851",3,-60,0,"1,140", ,"2,847",
20745,Frozen cuts and edible offal of domestic ducks, , , ,30, , , ,45,71,-20,0,7, ,"10,143",11,-42,0,292, ,"4,688",
20753,"Fatty livers of domestic geese, fresh or chilled", , , , , , , ,,0, ,0, , , ,1, ,0, , , ,
20890,"Fresh, chilled or frozen meat and edible offal of pigeons, game, reindeer and other animals . . .", , , , , , , ,,0, ,0, , , ,92,15,0,41, ,"12,902",
21012,"Bellies ""streaky"" and cuts thereof of swine, salted, in brine, dried or smoked", , , , , , , ,,0, ,0, , , ,8, ,0,289, ,"4,920",
21020,"Meat of bovine animals, salted, in brine, dried or smoked", , , , , , , ,,0, ,0, , , ,"8,338",205,3,158, ,"12,500",
21099,"Meat and edible offal, salted, in brine, dried or smoked, and edible flours and meals of meat . . .", , , ,30, , , ,53,0, ,0, ,Tons, ,117,-15,0,388,Tons,"2,804",
30111,Live ornamental freshwater fish, , , ,30, , , ,13,564,13,0,20,Tons,"28,200",15, ,0,0,Tons, ,
30119,Live ornamental fish (excl. freshwater), , , ,30, , , ,13,"1,102",44,2,74,Tons,"14,892",2,-42,0,0,Tons, ,
30199,"Live fish (excl. ornamental fish, trout [Salmo trutta, Oncorhynchus mykiss, Oncorhynchus clarki, . . .", , , ,30, , , ,51,16,-67,0,1,Tons,"16,000",9, ,0,0,Tons, ,
30211,"Fresh or chilled trout ""Salmo trutta, Oncorhynchus mykiss, Oncorhynchus clarki, Oncorhynchus . . .", , , ,30, , , ,44,5,-2,0,0,Tons, ,2,94,0,163,Tons,"10,712",
30213,"Fresh or chilled Pacific salmon ""Oncorhynchus nerka, Oncorhynchus gorbuscha, Oncorhynchus keta, . . .", , , , , , , ,,0, ,0, , , ,15,-25,0,1, ,"20,000",
30214,"Fresh or chilled Atlantic salmon ""Salmo salar"" and Danube salmon ""Hucho hucho""", , , ,30, , , ,44,"2,625",1,0,230, ,"11,413",51,8,0,"7,261", ,"8,951",
30219,"Fresh or chilled salmonidae (excl. trout ""Salmo trutta, Oncorhynchus mykiss, Oncorhynchus clarki, . . .", , , ,30, , , ,44,0, ,0, ,Tons, ,200,2,0,159,Tons,"4,686",
30221,"Fresh or chilled lesser or Greenland halibut ""Reinhardtius hippoglossoides, Atlantic halibut . . .", , , , , , , ,,0, ,0, , , ,4,26,0,2, ,"20,500",
30223,"Fresh or chilled sole ""Solea spp.""", , ,0,30, , , ,44,0, ,0, ,Tons, , , , ,28,Tons,"18,036",
30229,"Fresh or chilled flat fish ""Pleuronectidae, Bothidae, Cynoglossidae, Soleidae, Scophthalmidae . . .", , ,0,30, , , ,44,0, ,0, ,Tons, , , , ,98,Tons,"7,102",
30231,"Fresh or chilled albacore or longfinned tunas ""Thunnus alalunga""", , , , , , , ,,0, ,0, , , ,2,-21,0,2, ,"24,500",
30232,"Fresh or chilled yellowfin tunas ""Thunnus albacares""", , , ,30, , , ,44,0, ,0, ,Tons, ,2,-50,0,159,Tons,"5,176",
30239,"Fresh or chilled tunas of the genus ""Thunnus"" (excl. Thunnus alalunga, Thunnus albacares, Thunnus . . .", , , ,30, , , ,44,0, ,0, ,Tons, ,5,-24,0,3,Tons,"5,333",
30242,"Fresh or chilled anchovies ""Engraulis spp.""", , ,0,30, , , ,44,0, ,0, ,Tons, , , , ,181,Tons,"4,028",
30243,"Fresh or chilled sardines ""Sardina pilchardus, Sardinops spp."", sardinella ""Sardinella spp."", . . .", , , ,30, , , ,44,0, ,0, ,Tons, ,1, ,0,0,Tons, ,
30244,"Fresh or chilled mackerel ""Scomber scombrus, Scomber australasicus, Scomber japonicus""", , , ,30, , , ,44,0, ,0, ,Tons, ,4,-24,0,7,Tons,"5,857",
30246,"Fresh or chilled cobia ""Rachycentron canadum""", , ,0,30, , , ,44,0, ,0, ,Tons, , , , ,0,Tons, ,
30249,"Fresh or chilled Indian mackerels ""Rastrelliger spp."", seerfishes ""Scomberomorus spp."", jacks, . . .", , , ,30, , , ,188,0, ,0, ,Tons, ,3,-5,0,174,Tons,"6,678",
30251,"Fresh or chilled cod ""Gadus morhua, Gadus ogac, Gadus macrocephalus""", , ,0,30, , , ,44,3,-30,0,0,Tons, , , , ,17,Tons,"12,941",
30252,"Fresh or chilled haddock ""Melanogrammus aeglefinus""", , ,0,30, , , ,44,2, ,0,0, , , , , ,1, ,"12,000",
30255,"Fresh or chilled Alaska pollack ""Theragra chalcogramma""", , , , , , , ,,0, ,0, , , ,11, ,0, , , ,
30259,"Fresh or chilled fish of the families Bregmacerotidae, Euclichthyidae, Gadidae, Macrouridae, . . .", , ,0,30, , , ,44,0, ,0, ,Tons, , , , ,20,Tons,"8,600",
30271,"Fresh or chilled tilapia ""Oreochromis spp.""", , ,0,30, , , ,44,90, ,0,36,Tons,"2,500", , , ,"1,269",Tons,"5,980",
30272,"Fresh or chilled catfish ""Pangasius spp., Silurus spp., Clarias spp., Ictalurus spp.""", , ,0,30, , , ,44,"18,996", ,69,"7,443",Tons,"2,552", , , ,0,Tons, ,
30273,"Fresh or chilled carp ""Cyprinus spp., Carassius spp., Ctenopharyngodon idellus, Hypophthalmichthys . . .", , ,0,30, , , ,188,"7,118", ,17,"2,736",Tons,"2,602", , , ,198,Tons,"2,399",
30274,"Fresh or chilled eels ""Anguilla spp.""", , ,0,30, , , ,47,1, ,0,0,Tons, , , , ,0,Tons, ,
30279,"Fresh or chilled, Nile perch ""Lates niloticus"" and snakeheads ""Channa spp.""", , , ,30, , , ,44,"4,561",-22,9,"1,761",Tons,"2,590",30,37,0,72,Tons,"16,639",
30281,Fresh or chilled dogfish and other sharks, , , , , , , ,,0, ,0, , , ,1, ,0,0, , ,
30284,"Fresh or chilled sea bass ""Dicentrarchus spp.""", , , ,30, , , ,44,0, ,0, ,Tons, ,15, ,0,"2,337",Tons,"7,185",
30285,"Fresh or chilled sea bream ""Sparidae""", , ,0,30, , , ,44,2, ,0,0,Tons, , , , ,"1,870",Tons,"4,941",
30289,"Fresh or chilled fish, n.e.s.", , , ,30, , , ,188,"15,262",15,1,"1,924",Tons,"7,932",56,-16,0,"1,826",Tons,"5,321",
30299,"Fresh or chilled fish fins, heads, tails, maws and other edible fish offal (excl. livers, roes, . . .", , , , , , , ,,0, ,0, , , ,1,-48,0,4, ,"1,750",
30312,"Frozen Pacific salmon (excl. sockeye salmon ""red salmon"")", , , ,30, , , ,44,1,-81,0,0, , ,163,7,0,0, , ,
30313,"Frozen, Atlantic salmon ""Salmo salar"" and Danube salmon ""Hucho hucho""",39, ,14,30,7, ,"5,571",44,62,-44,0,8, ,"7,750",274,52,0,"2,758", ,"7,992",1
30319,"Frozen salmonidae (excl. trout and Pacific, Atlantic and Danube salmon)", , , ,30, , , ,44,110,-28,0,22,Tons,"5,000",778,-8,1,64,Tons,"5,391",
30323,"Frozen tilapia ""Oreochromis spp.""",29, ,9,30,24,Tons,"1,208",44,29, ,0,24,Tons,"1,208",316,272,0,"2,307",Tons,"1,206",
30324,"Frozen catfish ""Pangasius spp., Silurus spp., Clarias spp., Ictalurus spp.""", , , ,30, , , ,44,206, ,0,242,Tons,851,2, ,0,"1,030",Tons,"1,561",
30325,"Frozen carp ""Cyprinus spp., Carassius spp., Ctenopharyngodon idellus, Hypophthalmichthys spp., . . .", , ,0,30, , , ,517,215,-26,0,96,Tons,"2,240", , , ,"3,820",Tons,"1,495",
30326,"Frozen eels ""Anguilla spp.""", , ,0, , , , ,,29,38,0,24,Tons,"1,208", , , , ,Tons, ,
30329,"Frozen, Nile perch (Lates niloticus) and snakeheads (Channa spp.)", , , ,30, , , ,44,34,22,0,4,Tons,"8,500",10,-45,0,62,Tons,"3,161",
30331,"Frozen lesser or Greenland halibut ""Reinhardtius hippoglossoides"", Atlantic halibut ""Hippoglossus . . .", , , ,30, , , ,44,4, ,0,0, , ,8, ,0,0, , ,
30333,"Frozen sole ""Solea spp.""", , , ,30, , , ,44,262, ,0,157,Tons,"1,669",80, ,0,7,Tons,"6,000",
30339,"Frozen flat fish ""Pleuronectidae, Bothidae, Cynoglossidae, Soleidae, Scophthalmidae and Citharidae"" . . .", , , ,30, , , ,44,56, ,0,55,Tons,"1,018",1,69,0,386,Tons,"2,119",
30341,"Frozen albacore or longfinned tunas ""Thunnus alalunga""", , , , , , , ,,0, ,0, , , ,16,21,0, , , ,
30342,"Frozen yellowfin tunas ""Thunnus albacares""", , , ,30, , , ,44,447,-8,0,211,Tons,"2,118",90,33,0,1,Tons,"22,000",
30343,"Frozen skipjack or stripe-bellied bonito ""Euthynnus -Katsuwonus- pelamis""", , , ,30, , , ,44,52, ,0,30,Tons,"1,733",13, ,0,313,Tons,"1,300",
30344,"Frozen bigeye tunas ""Thunnus obesus""", , ,0, , , , ,,4, ,0,0, , , , , , , , ,
30345,"Frozen Atlantic and Pacific bluefin tuna (Thunnus thynnus, Thunnus orientalis)", , ,0,30, , , ,44,16, ,0,0, , , , , ,23, ,"8,435",
30349,"Frozen tunas of the genus ""Thunnus"" (excl. Thunnus alalunga, Thunnus albacares, Thunnus obesus, . . .", , , ,30, , , ,44,178, ,0,96,Tons,"1,854",42,-40,0,446,Tons,"2,726",
30351,"Frozen herrings ""Clupea harengus, Clupea pallasii""", , , ,30, , , ,44,7, ,0,7, ,"1,000",51,-47,0,47, ,"1,255",
30353,"Frozen sardines ""Sardina pilchardus, Sardinops spp."", sardinella ""Sardinella spp."", brisling . . .", , , ,30, , , ,44,654,34,0,"1,032",Tons,634,497,43,0,485,Tons,"1,767",-
30354,"Frozen mackerel ""Scomber scombrus, Scomber australasicus, Scomber japonicus""", , , ,30, , , ,44,0, ,0, ,Tons, ,186,18,0,748,Tons,"2,040",-
30355,"Frozen jack and horse mackerel ""Trachurus spp.""", , , ,30, , , ,44,0, ,0, ,Tons, ,588,132,0,157,Tons,"1,510",
30356,"Frozen cobia ""Rachycentron canadum""", , ,0, , , , ,,14, ,5,16,Tons,875, , , , ,Tons, ,
30357,"Frozen swordfish ""Xiphias gladius""", , ,0, , , , ,,170, ,0,33,Tons,"5,152", , , , ,Tons, ,
30359,"Frozen anchovies ""Engraulis spp."", Indian mackerels ""Rastrelliger spp."", seerfishes ""Scomberomorus . . .", , , ,30, , , ,517,0, ,0, ,Tons, ,"1,601",198,0,"1,144",Tons,"3,847",
30363,"Frozen cod ""Gadus morhua, Gadus ogac, Gadus macrocephalus""", , , ,30, , , ,44,322,-8,0,9,Tons,"35,778",2,-42,0,263,Tons,"4,871",
30364,"Frozen haddock ""Melanogrammus aeglefinus""", , , , , , , ,,0, ,0, , , ,29, ,0, , , ,
30365,"Frozen coalfish ""Pollachius virens""", , , , , , , ,,0, ,0, , , ,10, ,0, , , ,
30366,"Frozen hake ""Merluccius spp., Urophycis spp.""", , , , , , , ,,0, ,0, , , ,14, ,0,144, ,"1,250",
30368,"Frozen blue whiting ""Micromesistius poutassou, Micromesistius australis""", , , , , , , ,,0, ,0, , , ,125,3,0,472, ,888,
30369,"Frozen fish of the families Bregmacerotidae, Euclichthyidae, Gadidae, Macrouridae, Melanonidae, . . .", , , ,30, , , ,44,"6,339",50,2,"6,911",Tons,917,223,11,0,98,Tons,"1,184",
30381,Frozen dogfish and other sharks,41, ,100,30,52, ,788,94,809,53,1,463, ,"1,747",41, ,0, , , ,
30382,"Frozen rays and skates ""Rajidae""",40, ,32,30,135,Tons,296,47,40, ,0,135,Tons,296,126,484,0,15,Tons,"2,200",
30383,"Frozen toothfish ""Dissostichus spp.""", , , ,30, , , ,44,655, ,0,18, ,"36,389",7, ,0,83, ,"11,217",
30384,"Frozen sea bass ""Dicentrarchus spp.""", , , ,30, , , ,44,38,-50,0,1,Tons,"38,000",152,17,0,40,Tons,"13,200",5
30389,"Frozen fish, n.e.s.", , , ,30, , , ,517,"24,105",40,1,"4,900",Tons,"4,919","5,400",2,0,"19,234",Tons,"1,525",
30391,"Frozen fish livers, roes and milt", , ,0,30, , , ,94,8,-7,0,0,Tons, , , , ,48,Tons,"4,542",
30399,"Frozen fish fins, heads, tails, maws and other edible fish offal (excl. livers, roes, milt . . .", , , ,30, , , ,517,6, ,0,1,Tons,"6,000",79,-24,0,1,Tons,"29,000",
30431,"Fresh or chilled fillets of tilapia ""Oreochromis spp.""", , , ,30, , , ,44,0, ,0, ,Tons, ,33,78,0,41,Tons,"7,390",
30432,"Fresh or chilled fillets of catfish ""Pangasius spp., Silurus spp., Clarias spp., Ictalurus . . .", , , ,30, , , ,44,126, ,0,35,Tons,"3,600",1,4,0,2,Tons,"5,000",
30433,"Fresh or chilled fillets of Nile perch ""Lates niloticus""", , , ,30, , , ,44,78,-22,0,11, ,"7,091",22,-8,0,55, ,"5,327",
30439,"Fresh or chilled fillets of carp ""Cyprinus spp., Carassius spp., Ctenopharyngodon idellus, . . .", , , ,30, , , ,220,0, ,0, ,Tons, ,30,156,0,1,Tons,"5,000",
30441,"Fresh or chilled fillets of Pacific salmon ""Oncorhynchus nerka, Oncorhynchus gorbuscha, Oncorhynchus . . .", , , ,30, , , ,44,345,68,0,20, ,"17,250",5,-44,0,170, ,"12,747",
30442,"Fresh or chilled fillets of trout ""Salmo trutta, Oncorhynchus mykiss, Oncorhynchus clarki, . . .", , , , , , , ,,0, ,0, , , ,66, ,0,11, ,"10,182",
30445,"Fresh or chilled fillets of swordfish ""Xiphias gladius""", , , ,30, , , ,44,0, ,0, ,Tons, ,3,195,0, ,Tons, ,
30446,"Fresh or chilled fillets of toothfish ""Dissostichus spp.""", , , , , , , ,,0, ,0, , , ,22,85,0, , , ,
30447,Fresh or chilled fillets of dogfish and other sharks, , , , , , , ,,0, ,0, , , ,4,215,0, , , ,
30449,"Fresh or chilled fillets of fish, n.e.s.", , , ,30, , , ,220,18,-64,0,1,Tons,"18,000",238,-8,0,76,Tons,"26,118",
30452,"Fresh or chilled meat, whether or not minced, of salmonidae (excl. fillets)", , , , , , , ,,0, ,0, , , ,19, ,0,1, ,"12,000",
30454,"Fresh or chilled meat, whether or not minced, of swordfish ""Xiphias gladius"" (excl. fillets)", , , ,30, , , ,44,0, ,0, ,Tons, ,2, ,0, ,Tons, ,
30459,"Fresh or chilled fish meat, whether or not minced (excl. all fillets, tilapias, catfish, carp, . . .", , , ,30, , , ,235,190,-24,0,79,Tons,"2,405",17,-2,0,1,Tons,"56,000",
30461,"Frozen fillets of tilapia ""Oreochromis spp.""", , , ,30, , , ,44,0, ,0, ,Tons, ,13,71,0,15,Tons,"2,467",
30462,"Frozen fillets of catfish ""Pangasius spp., Silurus spp., Clarias spp., Ictalurus spp.""", , , ,30, , , ,44,"21,622",-2,1,"10,840",Tons,"1,995",851,43,0,71,Tons,"1,141",
30463,"Frozen fillets of Nile perch ""Lates niloticus""", , , , , , , ,,0, ,0, , , ,140,10,0,640, ,"6,164",
30469,"Frozen fillets of carp ""Cyprinus spp., Carassius spp., Ctenopharyngodon idellus, Hypophthalmichthys . . .", , ,0,30, , , ,188,0, ,0, ,Tons, , , , ,425,Tons,"2,033",
30471,"Frozen fillets of cod ""Gadus morhua, Gadus ogac, Gadus macrocephalus""", , , ,30, , , ,44,25,-32,0,1,Tons,"25,000","1,079",68,0,66,Tons,"10,121",
30472,"Frozen fillets of haddock ""Melanogrammus aeglefinus""", , , , , , , ,,0, ,0, , , ,2, ,0,1, ,"11,000",
30473,"Frozen fillets of coalfish ""Pollachius virens""", , , , , , , ,,0, ,0, , , ,7, ,0,0, , ,
30474,"Frozen fillets of hake ""Merluccius spp., Urophycis spp.""", , , , , , , ,,0, ,0, , , ,7, ,0,3, ,"4,333",
30475,"Frozen fillets of Alaska pollack ""Theragra chalcogramma""", , , , , , , ,,0, ,0, , , ,1, ,0,96, ,"3,219",
30479,"Frozen fillets of fish of the families Bregmacerotidae, Euclichthyidae, Gadidae, Macrouridae, . . .", , , ,30, , , ,44,105,188,0,3,Tons,"35,000",111,366,0,5,Tons,"5,400",
30481,"Frozen fillets of Pacific salmon ""Oncorhynchus nerka, Oncorhynchus gorbuscha, Oncorhynchus . . .", , , ,30, , , ,44,"3,053",15,0,208, ,"14,678",474,7,0,499, ,"13,116",
30482,"Frozen fillets of trout ""Salmo trutta, Oncorhynchus mykiss, Oncorhynchus clarki, Oncorhynchus . . .", , , , , , , ,,0, ,0, , , ,16,25,0,5, ,"8,800",
30483,"Frozen fillets of flat fish ""Pleuronectidae, Bothidae, Cynoglossidae, Soleidae, Scophthalmidae . . .", , , ,30, , , ,44,6, ,0,0, , ,65,293,0,59, ,"7,780",
30484,"Frozen fillets of swordfish ""Xiphias gladius""", , , ,30, , , ,44,0, ,0, ,Tons, ,5, ,0, ,Tons, ,
30487,"Frozen fillets of tuna ""of the genus Thunnus"", skipjack or stripe-bellied bonito ""Euthynnus . . .", , , ,30, , , ,44,371,72,0,23,Tons,"16,130",97,15,0,160,Tons,"13,656",
30489,"Frozen fish fillets, n.e.s.", , , ,30, , , ,188,112,-6,0,7,Tons,"16,000","1,597",12,0,441,Tons,"8,422",
30493,"Frozen meat, whether or not minced, of tilapia ""Oreochromis spp."", catfish ""Pangasius spp., . . .", , ,0,30, , , ,47,"1,008",-5,2,618,Tons,"1,631", , , ,0,Tons, ,
30494,"Frozen meat, whether or not minced, of Alaska pollack ""Theragra chalcogramma"" (excl. fillets)", , ,0, , , , ,,400,-5,0,87, ,"4,598", , , , , , ,
30499,Frozen fish meat n.e.s. (excl. fillets), , , ,30, , , ,44,"9,489",60,0,"2,035",Tons,"4,663",774,-22,0,338,Tons,"2,769",
30510,"Flours, meals and pellets of fish, fit for human consumption", , , ,30, , , ,47,0, ,0, ,Tons, ,31,45,0,8,Tons,"2,750",
30539,"Fish fillets, dried, salted or in brine, but not smoked (excl. tilapia, catfish, carp, eels, . . .", , , ,30, , , ,48,0, ,0, ,Tons, ,39,0,0,2,Tons,"12,500",
30541,"Smoked Pacific salmon ""Oncorhynchus nerka, Oncorhynchus gorbuscha, Oncorhynchus keta, Oncorhynchus . . .",31, ,12,30,4, ,"7,750",44,"1,224",1,0,59, ,"20,746",260,11,0,54, ,"20,759",
30543,"Smoked trout ""Salmo trutta, Oncorhynchus mykiss, Oncorhynchus clarki, Oncorhynchus aguabonita, . . .", , , , , , , ,,0, ,0, , , ,3,29,0,2, ,"15,500",
30549,"Smoked fish, incl. fillets (excl. offal, Pacific salmon, Atlantic salmon, Danube salmon, herring, . . .", , , ,30, , , ,47,0, ,0, ,Tons, ,243,-14,0,12,Tons,"10,833",
30551,"Dried cod ""Gadus morhua, Gadus ogac, Gadus macrocephalus"", even salted, not smoked (excl. fillets . . .", , , , , , , ,,0, ,0, , , ,1,124,0,0, , ,
30552,"Dried tilapia ""Oreochromis spp."", catfish ""Pangasius spp., Silurus spp., Clarias spp., Ictalurus . . .", , , , , , , ,,0, ,0, , , ,239,-11,4, , , ,
30553,"Dried fish of the families Bregmacerotidae, Euclichthyidae, Gadidae, Macrouridae, Melanonidae, . . .", , , ,30, , , ,192,0, ,0, ,Tons, ,5,91,0,0,Tons, ,
30554,"Dried herrings ""Clupea harengus, Clupea pallasii"", anchovies ""Engraulis spp."", sardines ""Sardina . . .", , , ,30, , , ,192,0, ,0, ,Tons, ,"22,518",5,21,7,Tons,"9,286",
30559,"Fish, dried, even salted but not smoked, n.e.s. (excl. fillets and offal)", , , ,30, , , ,192,"1,309",-21,0,612,Tons,"2,139",256,-47,0,0,Tons, ,
30563,"Anchovies ""Engraulis spp."", salted or in brine only (excl. fillets and offal)", , ,0,30, , , ,44,2, ,0,2,Tons,"1,000", , , ,1,Tons,"9,000",
30569,"Fish, salted or in brine only (excl. fillets, offal, herring, cod, anchovies, tilapia, catfish, . . .", , , ,30, , , ,188,0, ,0, ,Tons, ,3,-23,0,89,Tons,"2,045",
30571,"Shark fins, smoked, dried, salted or in brine", , , , , , , ,,0, ,0, , , ,562,-38,0, , , ,
30572,"Fish heads, tails and maws, smoked, dried, salted or in brine", , , ,30, , , ,48,0, ,0, ,Tons, ,"1,581",-34,0,1,Tons,"200,000",
30579,"Fish fins and other edible fish offal, smoked, dried, salted or in brine (excl. heads, tails, . . .", , , ,30, , , ,39,0, ,0, ,Tons, ,201,-27,0, ,Tons, ,
30611,"Frozen rock lobster and other sea crawfish ""Palinurus spp."", ""Panulirus spp."" and ""Jasus spp."", . . .", , , ,30, , , ,44,264, ,0,13,Tons,"20,308","15,837",27,2,100,Tons,"17,270",
30612,"Frozen lobsters ""Homarus spp."", even smoked, whether in shell or not, incl. lobsters in shell, . . .", , , ,30, , , ,88,164,3,0,48,Tons,"3,417","8,819",18,1,152,Tons,"26,776",-
30614,"Frozen crabs, even smoked, whether in shell or not, incl. crabs in shell, cooked by steaming . . .", , , ,30, , , ,44,"1,003",105,0,164,Tons,"6,116",356,-14,0,464,Tons,"14,412",-
30616,"Frozen cold-water shrimps and prawns ""Pandalus spp., Crangon crangon"", even smoked, whether . . .", , , ,30, , , ,88,"8,092",-6,1,26,Tons,"311,231","4,969",20,0,150,Tons,"5,040",
30617,"Frozen shrimps and prawns, even smoked, whether in shell or not, incl. shrimps and prawns in . . .", , , ,30, , , ,132,"28,641",4,0,"4,285",Tons,"6,684","138,616",-2,1,"28,005",Tons,"6,464",
30619,"Frozen crustaceans, even smoked, fit for human consumption, whether in shell or not, incl. . . .", , , ,30, , , ,44,791, ,0,198,Tons,"3,995",648,-2,1,91,Tons,"7,242",
30631,"Rock lobster and other sea crawfish ""Palinurus spp., Panulirus spp. and Jasus spp."", whether . . .", , ,0,30, , , ,45,0, ,0, ,Tons, , , , ,47,Tons,"35,340",
30632,"Lobsters ""Homarus spp."", whether in shell or not, live, fresh or chilled", , , ,30, , , ,45,297, ,0,1,Tons,"297,000",70,-27,0,293,Tons,"24,362",
30633,"Crabs, whether in shell or not, live, fresh or chilled", , , ,30, , , ,45,0, ,0, ,Tons, ,10,-29,0,147,Tons,"23,082",
30634,"Norway lobsters ""Nephrops norvegicus"", whether in shell or not, live, fresh or chilled", , ,0,30, , , ,45,0, ,0, ,Tons, , , , ,10,Tons,"23,900",
30635,"Cold-water shrimps and prawns ""Pandalus spp., Crangon crangon"", whether in shell or not, live, . . .", , , ,30, , , ,45,0, ,0, ,Tons, ,1,-28,0,162,Tons,"10,722",
30636,"Shrimps and prawns, whether in shell or not, live, fresh or chilled (excl. cold-water shrimps . . .", , , ,30, , , ,90,"13,797", ,4,41,Tons,"336,512",229,9,0,"1,981",Tons,"6,488",
30639,"Crustaceans, fit for human consumption, whether in shell or not, live, fresh or chilled (excl. . . .", , , ,30, , , ,45,910, ,1,1,Tons,"910,000",23,87,0,22,Tons,"6,955",
