293420,"Heterocyclic compounds containing in the structure a benzothiazole ring-system, whether or . . .", , ,0,8, , , ,2,"34,164",9,4,"5,395",No quantity,"6,333", , , ,604,No quantity,"9,101",
293430,"Heterocyclic compounds containing in the structure a phenothiazine ring-system, whether or . . .", , , ,8, , , ,2,"4,871",24,4,109,Tons,"44,688",1,-70,0,0,Tons, ,
293491,"Aminorex ""INN"", brotizolam ""INN"", clotiazepam ""INN"", cloxazolam ""INN"", dextromoramide ""INN"", . . .", , ,0,8, , , ,4,13,-58,0,0,Tons, , , , ,0,Tons, ,
293499,"Nucleic acids and their salts, whether or not chemically defined; heterocyclic compounds (excl. . . .",5,234,0,8,0,Tons, ,6,"972,640",29,3,"21,480",Tons,"45,281","2,007",110,0,"1,272",Tons,"38,868",
293510,N-Methylperfluorooctane sulphonamide, , ,0,8, , , ,30,21,-67,0,0,Tons, , , , ,0,Tons, ,
293540,N-(2-Hydroxyethyl)-N-methylperfluorooctane sulphonamide, , ,0, , , , ,,3, ,0,0, , , , , , , , ,
293550,"Perfluorooctane sulphonamides (excl. N-Methylperfluorooctane sulphonamide, N-Ethylperfluorooctane . . .", , , ,8, , , ,30,30,-40,1,0, , ,19, ,1, , , ,
293590,Sulphonamides (excl. perfluorooctane sulphonamides), , , ,8, , , ,30,"69,322",11,1,"1,964",Tons,"35,296",207,15,0,165,Tons,"50,085",
293621,"Vitamins A and their derivatives, used primarily as vitamins", , ,0,8, , , ,2,"21,547",13,2,300,Tons,"71,823", , , ,119,Tons,"61,798",-
293622,"Vitamin B1 and its derivatives, used primarily as vitamins", , , ,8, , , ,4,"20,114",-7,6,846,Tons,"23,775",2, ,0,88,Tons,"31,057",
293623,"Vitamin B2 and its derivatives, used primarily as vitamins", , ,0,8, , , ,4,"7,455",-9,3,210,Tons,"35,500", , , ,19,Tons,"27,105",
293624,"D-Pantothenic or DL-pantothenic acid ""Vitamin B3 or B5"" and their derivatives, used primarily . . .", , , ,8, , , ,2,"8,530",-2,1,435,Tons,"19,609",1,15,0,94,Tons,"16,330",
293625,"Vitamin B6 and its derivatives, used primarily as vitamins", , ,0,8, , , ,2,"8,656",-8,3,402,Tons,"21,532", , , ,38,Tons,"21,289",
293626,"Vitamin B12 and its derivatives, used primarily as vitamins",126,77,98,8,0,Tons, ,4,"35,598",-10,11,33,Tons,"1,078,727",129,77,0,118,Tons,"5,424",-
293627,"Vitamin C and its derivatives, used primarily as vitamins",486, ,96,8,158,Tons,"3,076",2,"38,103",36,3,"7,547",Tons,"5,049",507,66,0,942,Tons,"5,941",32
293628,"Vitamin E and its derivatives, used primarily as vitamins", , , ,8, , , ,2,"27,442",14,1,"1,372",Tons,"20,001",1,-73,0,256,Tons,"12,777",
293629,"Vitamins and their derivatives, used primarily as vitamins, unmixed (excl. vitamins A, B1, . . .", , , ,8, , , ,18,"30,009",-2,2,614,Tons,"48,875",188,2,0,654,Tons,"23,977",154
293690,"Provitamins and mixtures of vitamins, of provitamins or of concentrates, whether or not in . . .", , , ,8, , , ,2,"1,163",-34,0,23,Tons,"50,565",126,-40,0,684,Tons,"25,668",79
293711,"Somatropin, its derivatives and structural analogues, used primarily as hormones", , ,0, , , , ,,1,-75,0,0,Tons, , , , , ,Tons, ,
293712,"Insulin and its salts, used primarily as hormones",19,-43,1,8,0,Tons, ,2,"31,406",-2,1,2,Tons,"15,703,000","3,480",62,0,0,Tons, ,-
293719,"Polypeptide hormones, protein hormones and glycoprotein hormones, their derivatives and structural . . .", , ,0,8, , , ,2,"46,893",41,0,10,Tons,"4,689,300", , , ,72,Tons,"31,889",
293721,"Cortisone, hydrocortisone, prednisone ""dehydrocortisone"" and prednisolone ""dehydrohydrocortisone""", , ,0,8, , , ,2,"36,969",-6,14,72,Tons,"513,458", , , ,1,Tons,"823,000",
293722,Halogenated derivatives of corticosteroidal hormones, , , ,8, , , ,2,"28,707",26,1,14,Tons,"2,050,500",203,19,0,2,Tons,"1,034,000",17
293723,Oestrogens and progestogens, , , ,8, , , ,2,"45,244",0,5,93,Tons,"486,495",6,380,0,6,Tons,"264,667",
293729,"Steroidal hormones, their derivatives and structural analogues, used primarily as hormones . . .", , , ,8, , , ,2,"97,152",7,4,386,Tons,"251,689",2,-60,0,2,Tons,"1,691,500",
293750,"Prostaglandins, thromboxanes and leukotrienes, their derivatives and structural analogues, . . .", , ,0,8, , , ,2,"5,205",30,2,3,No quantity,"1,735,000", , , ,0,No quantity, ,
293790,"Hormones, natural or reproduced by synthesis; derivatives and structural analogues thereof, . . .", , ,0,8, , , ,8,"66,988",-6,7,161,Tons,"416,075", , , ,0,Tons, ,
293810,"Rutoside ""rutin"" and its derivatives", , ,0, , , , ,,"6,870",12,4,90,Tons,"76,333", , , , ,Tons, ,
293890,"Glycosides, natural or reproduced by synthesis, and their salts, ethers, esters and other derivatives . . .", , ,0,8, , , ,12,"65,330",-1,4,"2,378",Tons,"27,473", , , ,79,Tons,"25,532",
293911,"Concentrates of poppy straw; buprenorphine ""INN"", codeine, dihydrocodeine ""INN"", ethylmorphine, . . .", , ,0,8, , , ,4,"20,880",11,7,45,Tons,"464,000", , , ,0,Tons, ,
293919,"Alkaloids of opium and their derivatives, and salts thereof (excl. concentrates of poppy straw; . . .", , ,0,8, , , ,3,"16,097",6,9,36,Tons,"447,139", , , ,0,Tons, ,
293920,Alkaloids of cinchona and their derivatives; salts thereof, , ,0,8, , , ,30,"2,705",-7,5,35,Tons,"77,286", , , ,19,Tons,"29,316",
293930,Caffeine and its salts, , ,0,8, , , ,2,"23,090",29,3,"2,071",Tons,"11,149", , , ,162,Tons,"18,716",
293941,Ephedrine and its salts, , ,0,8, , , ,18,9,-49,0,0,Tons, , , , ,1,Tons,"81,000",
293942,"Pseudoephedrine ""INN"" and its salts", , ,0, , , , ,,78,16,0,1,Tons,"78,000", , , , ,Tons, ,
293949,"Alkaloids of ephedra and their derivatives; salts thereof (excl. ephedrine, pseudoephedrine . . .", , ,0, , , , ,,545,-15,11,24,Tons,"22,708", , , , ,Tons, ,
293959,"Theophylline and aminophylline ""theophylline-ethylenediamine"" and their derivatives, and salts . . .", , , ,8, , , ,6,"1,370",-4,2,70,Tons,"19,571",18, ,0,20,Tons,"31,600",
293961,"Ergometrine ""INN"" and its salts", , ,0, , , , ,,125,-5,13,0, , , , , , , , ,
293962,"Ergotamine ""INN"" and its salts", , ,0, , , , ,,"1,057",33,15,0,Tons, , , , , ,Tons, ,
293963,Lysergic acid and its salts, , ,0, , , , ,,25, ,1,0, , , , , , , , ,
293969,"Alkaloids of rye ergot and their derivatives; salts thereof (excl. lysergic acid, ergotamine . . .", , ,0,8, , , ,5,"3,922",2,5,2,No quantity,"1,961,000", , , ,0,No quantity, ,
293971,"Cocaine, ecgonine, levometamfetamine, metamfetamine ""INN"", metamfetamine racemate, and salts, . . .", , ,0, , , , ,,87, ,6,0,Tons, , , , , ,Tons, ,
293979,"Vegetal alkaloids, natural or reproduced by synthesis, and their salts, ethers, esters and . . .", , , ,8, , , ,5,"3,417",3,0,9,Tons,"379,667",614,42,0,5,Tons,"497,000",
293980,"Non-vegetal alkaloids, natural or reproduced by synthesis, and their salts, ethers, esters . . .", , , ,8, , , ,80,"4,660",1,8,5,Tons,"932,000",2,-29,0,2,Tons,"142,000",
294000,"Sugars, chemically pure (excl. sucrose, lactose, maltose, glucose and fructose); sugar ethers, . . .",19,151,50,8,0,Tons, ,2,"55,956",29,4,"11,382",Tons,"4,916",38,125,0,479,Tons,"4,023",50
294110,Penicillins and their derivatives with a penicillanic acid structure; salts thereof,71, ,100,8,3,Tons,"23,667",60,"626,157",-1,31,"14,961",Tons,"41,853",71,-3,0,295,Tons,"37,661",127
294120,Streptomycins and their derivatives; salts thereof, , ,0,8, , , ,4,"7,360",-9,11,216,Tons,"34,074", , , ,3,Tons,"32,667",
294130,Tetracyclines and their derivatives; salts thereof, , ,0,8, , , ,6,"51,978",-2,6,931,Tons,"55,830", , , ,117,Tons,"44,222",
294140,Chloramphenicol and its derivatives; salts thereof, , ,0,8, , , ,2,"7,014",22,3,103,No quantity,"68,097", , , ,55,No quantity,"62,945",
294150,Erythromycin and its derivatives; salts thereof, , ,0,8, , , ,2,"121,257",-4,27,"1,423",Tons,"85,212", , , ,30,Tons,"90,767",511
294190,"Antibiotics (excl. penicillins and their derivatives with a penicillanic acid structure, salts . . .",281,105,19,8,2,Tons,"140,500",110,"774,866",11,10,"7,288",Tons,"106,321","1,515",29,0,536,Tons,"84,451","3,060"
294200,"Separate chemically defined organic compounds, n.e.s.",2,-56,1,8,0,Tons, ,54,"418,153",0,26,"11,194",Tons,"37,355",259,14,0,"1,216",Tons,"32,675","3,939"
300120,"Extracts of glands or other organs or of their secretions, for organo-therapeutic uses", , , ,10, , , ,60,"1,473",-16,1,1,Tons,"1,473,000",2,-67,0,7,Tons,"67,000",
300190,"Dried glands and other organs for organo-therapeutic uses, whether or not powdered; heparin . . .", , , ,10, , , ,45,"109,140",27,2,32,Tons,"3,410,625",27,-6,0,9,Tons,"1,453,889",
300211,Malaria diagnostic test kits, , , ,10, , , ,176,"2,924",-27,2,94,Tons,"31,106",7,43,0,38,Tons,"25,421",
300212,Antisera and other blood fractions, , , ,10, , , ,176,"208,589",14,1,"1,392",Tons,"149,848",159,4,0,123,Tons,"371,927",
300213,"Immunological products, unmixed, not put up in measured doses or in forms or packings for retail . . .", , , ,10, , , ,176,"12,796",14,0,8,No quantity,"1,599,500",243,69,0,99,No quantity,"59,384",
300214,"Immunological products, mixed, not put up in measured doses or in forms or packings for retail . . .", , , ,10, , , ,176,"2,222",69,0,1,Tons,"2,222,000","1,400",67,0,290,Tons,"59,752",
300215,"Immunological products, put up in measured doses or in forms or packings for retail sale (excl. . . .", , , ,10, , , ,176,"345,559",29,0,240,Tons,"1,439,829","5,902",18,0,"2,423",Tons,"269,984",
300219,"Immunological products, n.e.s. (code possibly empty, preceding subheadings seem exhaustive)", , , , , , , ,,0, ,0, , , ,8,-8,0, , , ,
300220,Vaccines for human medicine, , , ,10, , , ,308,"263,616",-2,0,225,Tons,"1,171,627","38,024",266,0,346,Tons,"423,113",
300230,Vaccines for veterinary medicine, , , ,10, , , ,20,"45,101",16,1,506,Tons,"89,132",107,-15,0,128,Tons,"74,695",415
300290,"Human blood; animal blood prepared for therapeutic, prophylactic or diagnostic uses",1, ,0,10,0,Tons, ,165,"257,661",19,2,"1,156",Tons,"222,890","1,467",46,0,206,Tons,"667,296",
300310,"Medicaments containing penicillins or derivatives thereof with a penicillanic acid structure, . . .", , ,0,10, , , ,12,20,-59,0,0,Tons, , , , ,65,Tons,"59,877",-
300320,"Medicaments containing antibiotics, not in measured doses or put up for retail sale (excl. . . .", , , ,10, , , ,12,"10,604",10,1,20,Tons,"530,200",7,-82,0,685,Tons,"11,940",27
300331,"Medicaments containing insulin, not in measured doses or put up for retail sale", , , ,10, , , ,12,"3,159", ,22,3,Tons,"1,053,000",41, ,0,0,Tons, ,
300339,"Medicaments containing hormones or steroids used as hormones, not containing antibiotics, not . . .", , , ,10, , , ,15,"81,680",52,9,237,Tons,"344,641",25,-26,0,47,Tons,"14,021",19
300349,"Medicaments containing alkaloids or derivatives thereof, not containing hormones, steroids . . .", , ,0,10, , , ,18,0, ,0, ,Tons, , , , ,350,Tons,"24,137",
300390,Medicaments consisting of two or more constituents mixed together for therapeutic or prophylactic . . ., , , ,10, , , ,252,"71,036",10,1,"6,661",Tons,"10,664","7,490",-1,0,0,Tons, ,
300410,"Medicaments containing penicillins or derivatives thereof with a penicillanic acid structure, . . .",2, ,0,10,0,Tons, ,96,"4,508",-34,0,51,Tons,"88,392","1,656",-22,0,0,Tons, ,136
300420,"Medicaments containing antibiotics, put up in measured doses ""incl. those for transdermal administration"" . . .", , , ,10, , , ,348,"46,310",9,0,396,Tons,"116,944","10,803",1,0,0,Tons, ,707
300431,"Medicaments containing insulin but not antibiotics, put up in measured doses ""incl. those for . . .", , , ,10, , , ,24,"207,275",3,3,"1,501",Tons,"138,091",150,-48,0,61,Tons,"637,574","1,567"
300432,"Medicaments containing corticosteroid hormones, their derivatives or structural analogues but . . .", , , ,10, , , ,12,"4,996",-1,0,30,Tons,"166,533","1,395",-7,0,408,Tons,"211,711",21
300439,"Medicaments containing hormones or steroids used as hormones but not antibiotics, put up in . . .",10, ,0,10,0,Tons, ,120,"49,944",-5,0,289,Tons,"172,817","2,628",-20,0,625,Tons,"126,870",202
300441,"Medicaments containing ephedrine or its salts, not containing hormones, steroids used as hormones . . .", , , ,10, , , ,120,0, ,0, ,Tons, ,4,-48,0,3,Tons,"39,667",
300442,"Medicaments containing pseudoephedrine ""INN"" or its salts, not containing hormones, steroids . . .", , , ,10, , , ,120,0, ,0, ,Tons, ,1,-71,0,183,Tons,"14,393",
300443,"Medicaments containing norephedrine or its salts, not containing hormones, steroids used as . . .", , ,0, , , , ,,1, ,0,0,Tons, , , , , ,Tons, ,
300449,"Medicaments containing alkaloids or derivatives thereof, not containing hormones, steroids . . .",13, ,0,10,0,Tons, ,120,"9,313",78,0,11,Tons,"846,636","2,602",-43,0,598,Tons,"77,592",
300450,"Medicaments containing provitamins, vitamins, incl. natural concentrates and derivatives thereof . . .",66, ,1,10,128,Tons,516,132,"7,913",7,0,177,Tons,"44,706","6,547",25,0,0,Tons, ,185
300460,"Medicaments containing any of the following antimalarial active principles: artemisinin ""INN"" . . .", , , ,10, , , ,"1,050",1,-58,0,0,Tons, ,"1,492",53,0,21,Tons,"52,286",
300490,"Medicaments consisting of mixed or unmixed products for therapeutic or prophylactic purposes, . . .",868,91,1,10,2,Tons,"434,000","1,050","803,315",5,0,"9,584",Tons,"83,818","114,511",9,0,0,Tons, ,
300510,"Adhesive dressings and other articles having an adhesive layer, impregnated or covered with . . .",20, ,4,10,0,Tons, ,51,"23,158",16,0,"1,480",Tons,"15,647",498,-22,0,"1,403",Tons,"24,066",62
300590,"Wadding, gauze, bandages and the like, e.g. dressings, adhesive plasters, poultices, impregnated . . .",52,105,2,10,2,Tons,"26,000",136,"24,370",8,0,"2,313",Tons,"10,536","3,177",31,0,0,Tons, ,70
300610,"Sterile surgical catgut, similar sterile suture materials, incl. sterile absorbable surgical . . .",9, ,1,10,0,Tons, ,12,"15,050",8,0,43,Tons,"350,000","1,093",14,0,70,Tons,"246,986",14
300620,Reagents for determining blood groups or blood factors, , , ,10, , , ,18,"6,829",2,1,89,Tons,"76,730",76,194,0,0,Tons, ,5
300630,Opacifying preparations for x-ray examinations; diagnostic reagents for administration to patients, , , ,10, , , ,20,"61,310",8,2,"1,081",Tons,"56,716",17,58,0,0,Tons, ,44
300640,Dental cements and other dental fillings; bone reconstruction cements,9,-21,19,10,0,Tons, ,10,"42,664",6,1,790,Tons,"54,005",48,-28,0,189,Tons,"157,767",82
300650,First-aid boxes and kits,9,125,7,10,0,Tons, ,6,184,3,0,2,Tons,"92,000",130,7,0,432,Tons,"11,333",-
300660,"Chemical contraceptive preparations based on hormones, prostaglandins, thromboxanes, leukotrienes, . . .",1, ,1,0,0,Tons, ,30,"8,711",9,0,105,Tons,"82,962",160,-14,0,33,Tons,"127,727",14
300670,Gel preparations designed to be used in human or veterinary medicine as a lubricant for parts . . ., , , ,10, , , ,20,"3,406",4,0,209,Tons,"16,297",6,-39,0,0,Tons, ,17
300691,Appliances identifiable for ostomy use, , ,0,10, , , ,10,"8,193",14,0,234,Tons,"35,013", , , ,23,Tons,"68,000",
300692,Waste pharmaceuticals, , , ,10, , , ,22,700,231,2,2,Tons,"350,000",55,138,0,0,Tons, ,
310100,"Animal or vegetable fertilisers, whether or not mixed together or chemically treated; fertilisers . . .", , , ,8, , , ,44,"48,847",16,4,"15,102",Tons,"3,234",355,4,0,"9,541",Tons,356,98
310210,"Urea, whether or not in aqueous solution (excl. that in tablets or similar forms, or in packages . . .","568,594",42,49,5,"803,707",Tons,707,10,"7,065,109",41,18,0,Tons, ,"1,156,825",19,3,0,Tons, ,-
310221,"Ammonium sulphate (excl. that in tablets or similar forms, or in packages with a gross weight . . .","5,707",215,72,5,"22,552",Tons,253,10,"121,530",67,2,"393,421",Tons,309,"7,896",111,0,"5,157",Tons,372,-
310229,Double salts and mixtures of ammonium sulphate and ammonium nitrate (excl. goods of this chapter . . .,365, ,1,8,499,Tons,731,30,"4,756",31,1,"8,742",Tons,544,"33,652",76,5,44,Tons,523,
310230,"Ammonium nitrate, whether or not in aqueous solution (excl. that in tablets or similar forms, . . .", , , ,8, , , ,15,"178,062",26,4,"221,321",Tons,805,654,-46,0,"24,704",Tons,804,
310240,Mixtures of ammonium nitrate with calcium carbonate or other inorganic non-fertilising substances . . ., , ,0, , , , ,,"60,561", ,1,"107,991", ,561, , , , , , ,
310250,"Sodium nitrate (excl. that in tablets or similar forms, or in packages with a gross weight . . .",758, ,100,0,698,Tons,"1,086",10,"2,072",59,1,"2,187",Tons,947,758, ,0,"67,076",Tons,465,
310260,Double salts and mixtures of calcium nitrate and ammonium nitrate (excl. those in tablets or . . .,608,-29,94,8,901,Tons,675,15,"50,609",16,5,"85,425",Tons,592,645,-26,0,"1,647",Tons,486,-
310280,Mixtures of urea and ammonium nitrate in aqueous or ammoniacal solution (excl. those in packages . . .,132, ,3,8,131,Tons,"1,008",15,150,50,0,157,Tons,955,"3,904", ,0, ,Tons, ,
310290,Mineral or chemical nitrogen fertilisers (excl. urea; ammonium sulphate; ammonium nitrate; . . .,219, ,37,8,409,Tons,535,20,"6,009",32,0,"6,249",Tons,962,586,-17,0,272,Tons,923,-
310319,"Superphosphates (excl. such products containing by weight => 35 % of diphosphorus pentaoxide, . . .", , ,0,8, , , ,10,348, ,0,136,Tons,"2,559", , , ,338,Tons,320,
310420,"Potassium chloride for use as fertiliser (excl. that in tablets or similar forms, or in packages . . .","2,058",67,20,8,"3,310",Tons,622,21,"1,521,642",3,5,"2,694,902",Tons,565,"10,110",-16,0,0,Tons, ,"1,351"
310430,"Potassium sulphate (excl. that in tablets or similar forms, or in packages with a gross weight . . .","1,591",10,61,5,"1,857",Tons,857,10,"51,511",21,3,"54,779",Tons,940,"2,621",23,0,"3,330",Tons,807,-
310490,"Carnallite, sylvite and other crude natural potassium salts, potassium magnesium sulphate and . . .", , , ,8, , , ,10,"41,596",-9,3,"140,440",Tons,296,"48,648",160,3,0,Tons, ,20
310510,"Mineral or chemical fertilisers of animal or vegetable origin, in tablets or similar forms, . . .", , , ,8, , , ,10,859,17,0,203,Tons,"4,232","2,453",98,0,334,Tons,"7,042",4
310520,"Mineral or chemical fertilisers containing the three fertilising elements nitrogen, phosphorus . . .","8,202",-2,18,5,"6,678",Tons,"1,228",10,"912,021",46,8,"1,257,580",Tons,725,"46,536",-3,1,"4,227",Tons,"1,224",-
310530,"Diammonium hydrogenorthophosphate ""diammonium phosphate"" (excl. that in tablets or similar . . .","3,572",-45,73,5,"4,215",Tons,847,10,"5,974,907",20,48,"6,779,304",Tons,881,"4,905",-42,0,970,Tons,571,"2,898"
310540,"Ammonium dihydrogenorthophosphate ""monoammonium phosphate"", whether or not mixed with diammonium . . .","2,284",-8,60,5,"1,725",Tons,"1,324",10,"406,550",43,4,"446,457",Tons,911,"3,808",-13,0,"12,691",Tons,"1,107",-
310551,Mineral or chemical fertilisers containing nitrates and phosphates (excl. ammonium dihydrogenorthophosphate . . .,11, ,55,5,6,Tons,"1,833",10,"80,282",29,12,"118,518",Tons,677,20,-57,0,121,Tons,620,142
310559,Mineral or chemical fertilisers containing the two fertilising elements nitrogen (excl. nitrate) . . ., , , ,5, , , ,10,"593,790",152,9,"866,038",Tons,686,"2,567",-5,0,"9,080",Tons,476,-
310560,Mineral or chemical fertilisers containing the two fertilising elements phosphorus and potassium . . .,"1,018",-33,49,5,487,Tons,"2,090",10,"68,479",22,9,"33,806",Tons,"2,026","2,089",-25,0,82,Tons,"3,110",-
310590,Mineral or chemical fertilisers containing the two fertilising elements nitrogen and potassium . . .,"2,072",-3,8,5,"1,550",Tons,"1,337",20,"70,083",17,2,"46,916",Tons,"1,494","25,789",32,1,"2,920",Tons,"2,904",-
320110,Quebracho extract, , ,0,8, , , ,2,"4,986",3,6,"2,142",Tons,"2,328", , , ,19,Tons,"1,474",
320120,Wattle extract, , ,0,3, , , ,2,"22,366",-8,21,"12,541",Tons,"1,783", , , ,237,Tons,"1,456",
320190,Tanning extracts of vegetable origin (excl. quebracho extract and wattle extract); tannins . . ., , , ,6, , , ,20,"53,277",-1,28,"19,248",Tons,"2,768",6,303,0,81,Tons,"1,840",
320210,Synthetic organic tanning substances, , , ,8, , , ,2,"13,950",-4,4,"7,628",Tons,"1,829",5,104,0,955,Tons,"1,556",6
320290,"Inorganic tanning substances; tanning preparations, whether or not containing natural tanning . . .", , , ,8, , , ,8,"6,811",-15,2,"3,284",Tons,"2,074",11,-27,0,733,Tons,"1,409",37
320300,"Colouring matter of vegetable or animal origin, incl. dye extracts (excl. animal black), whether . . .",1, ,1,8,0,Tons, ,65,"14,847",3,1,"1,831",Tons,"8,109",82,-9,0,"1,358",Tons,"2,571",50
320411,Synthetic organic disperse dyes; preparations based on synthetic organic disperse dyes of a . . ., , , ,8, , , ,52,"24,799",-3,2,"2,302",Tons,"10,773",752,37,0,"2,291",Tons,"4,887",14
320412,"Synthetic organic acid dyes, whether or not metallised, and synthetic organic mordant dyes; . . .",1,18,1,8,0,Tons, ,94,"8,801",-2,1,339,Tons,"25,962",72,-21,0,278,Tons,"8,680",13
320413,Basic synthetic organic dyes; preparations based on basic synthetic organic dyes of a kind . . ., , , ,8, , , ,54,"7,559",-5,2,391,Tons,"19,332",29,6,0,233,Tons,"6,352",81
320414,Direct synthetic organic dyes; preparations based on direct synthetic organic dyes of a kind . . ., , , ,8, , , ,40,834,-8,0,140,Tons,"5,957",36, ,0,"1,293",Tons,"1,974",3
320415,"Synthetic organic vat dyes, incl. those usable in that state as pigments; preparations based . . .",66, ,58,8,2,Tons,"33,000",84,"85,100",-4,13,"12,839",Tons,"6,628",114,47,0,201,Tons,"12,836",658
320416,Synthetic organic reactive dyes; preparations based on synthetic organic reactive dyes of a . . ., , , ,8, , , ,18,"29,449",-4,2,"2,865",Tons,"10,279",708,220,0,"3,585",Tons,"4,661",301
320417,Synthetic organic pigments; preparations based on synthetic organic pigments of a kind used . . .,102,-23,2,8,17,Tons,"6,000",169,"85,781",2,2,"6,786",Tons,"12,641","5,226",8,0,"6,583",Tons,"7,678",936
320419,Synthetic organic colouring matter and preparations of the kind used for colouring any materials . . .,"1,141",86,58,8,84,Tons,"13,583",128,"57,696",7,2,"8,311",Tons,"6,942","1,958",37,0,"4,256",Tons,"5,604",227
320420,"Synthetic organic products of a kind used as fluorescent brightening agents, whether or not . . .", , , ,8, , , ,4,"20,090",-6,3,"1,440",Tons,"13,951",199,-6,0,"1,602",Tons,"3,202",57
320490,"Synthetic organic products of a kind used as luminophores, whether or not chemically defined", , , ,8, , , ,2,"8,558",3,1,816,Tons,"10,488",213,-9,0,314,Tons,"6,290",26
320500,Colour lakes (other than Chinese or Japanese lacquer and paints); preparations based on colour . . ., , , ,8, , , ,2,"3,941",7,1,111,Tons,"35,505",51,50,0,104,Tons,"11,260",8
320611,Pigments and preparations based on titanium dioxide of a kind used for colouring any material . . .,877,-33,31,10,292,Tons,"3,003",4,"1,057,072",14,9,"322,327",Tons,"3,280","2,789",-16,0,"65,125",Tons,"2,781","3,518"
320619,Pigments and preparations based on titanium dioxide of a kind used for colouring any material . . .,857,5,24,10,255,Tons,"3,361",2,"32,141",-12,2,"7,121",Tons,"4,514","3,627",13,0,"3,828",Tons,"3,125",509
320620,Pigments and preparations of a kind used for colouring any material or used as ingredients . . ., , , ,8, , , ,2,"1,391",-10,1,309,Tons,"4,502",44,-23,0,"2,098",Tons,"3,887",38
320641,Ultramarine and preparations based thereon of a kind used for colouring any material or produce . . ., , , ,8, , , ,2,"2,799",8,2,603,Tons,"4,642",6,72,0,453,Tons,"3,587",9
320642,Lithopone and other pigments and preparations based on zinc sulphide of a kind used for colouring . . ., , ,0,8, , , ,2,"1,574",-16,4,799,Tons,"1,970", , , ,67,Tons,"1,045",
320649,"Inorganic or mineral colouring matter, n.e.s.; preparations based on inorganic or mineral colouring . . .","2,970",-19,10,8,"1,252",Tons,"2,372",10,"70,020",2,2,"10,266",Tons,"6,821","28,646",-7,1,"8,559",Tons,"4,223",-
320650,"Inorganic products of a kind used as luminophores, whether or not chemically defined", , , ,8, , , ,2,"11,647",1,5,439,Tons,"26,531",38,2,0,52,Tons,"2,731",
320710,"Prepared pigments, prepared opacifiers, prepared colours and similar preparations of a kind . . .",154,-40,46,8,5,Tons,"30,800",10,"135,602",6,12,"26,404",Tons,"5,136",337,-31,0,"3,555",Tons,"4,957","1,243"
320720,"Vitrifiable enamels and glazes, engobes ""slips"" and similar preparations of the kind used in . . .",1,-14,0,8,0,Tons, ,4,"14,046",37,1,"3,093",Tons,"4,541",407,10,0,"9,886",Tons,918,6
320730,"Liquid lustres and similar preparations of the kind used in the ceramic, enamelling or glass . . .", , , ,8, , , ,2,"19,022",-4,2,"1,399",Tons,"13,597",193,-40,0,15,Tons,"757,200",168
320740,"Glass frit and other glass in the form of powder, granules or flakes",198,56,47,5,602,Tons,329,2,"23,932",7,2,"15,602",Tons,"1,534",420,93,0,"26,012",Tons,972,155
320810,"Paints and varnishes, incl. enamels and lacquers, based on polyesters, dispersed or dissolved . . .","6,139",9,69,10,"1,005",Tons,"6,108",12,"53,084",6,2,"11,538",Tons,"4,601","8,938",12,0,0,Tons, ,-
320820,"Paints and varnishes, incl. enamels and lacquers, based on acrylic or vinyl polymers, dispersed . . .",360,0,4,10,118,Tons,"3,051",12,"75,185",8,2,"12,598",Tons,"5,968","8,152",27,0,0,Tons, ,642
320890,"Paints and varnishes based, incl. enamels and lacquers, on synthetic polymers or chemically . . .","2,628",-5,4,10,401,Tons,"6,554",30,"156,614",7,2,"25,981",Tons,"6,028","70,211",5,1,0,Tons, ,"9,238"
320910,"Paints and varnishes, incl. enamels and lacquers, based on acrylic or vinyl polymers, dispersed . . .",674,24,18,10,287,Tons,"2,348",6,"24,259",12,1,"7,043",Tons,"3,444","3,836",9,0,0,Tons, ,-
320990,"Paints and varnishes, incl. enamels and lacquers, based on synthetic or chemically modified . . .","2,018",25,19,10,686,Tons,"2,942",9,"44,525",4,1,"12,729",Tons,"3,498","10,568",10,0,0,Tons, ,464
321000,"Paints and varnishes, incl. enamels, lacquers and distempers (excl. those based on synthetic . . .",6,-32,1,10,24,Tons,250,14,"13,924",-6,1,"2,235",Tons,"6,230","1,101",-14,0,0,Tons, ,"1,442"
321100,Prepared driers,109,-10,1,10,27,Tons,"4,037",2,"5,165",24,2,651,Tons,"7,934","9,235",-1,4,464,Tons,"5,006",440
