840490,Parts of auxiliary plant of heading 8402 or 8403 and condensers for steam or other vapour power . . ., , , ,10, , , ,13,"3,126",-31,0,401,Tons,"7,796","2,133",174,0,0,Tons, ,81
840510,"Producer gas or water gas generators, with or without their purifiers; acetylene gas generators . . .",3,71,1,8,0,Tons, ,6,"29,455",14,5,553,Tons,"53,264",267,-32,0,0,Tons, ,222
840590,Parts of producer gas or water gas generators and acetylene gas generators or similar water . . .,3,8,7,8,0,Tons, ,13,"3,221",7,1,46,Tons,"70,022",43,-31,0,8,Tons,"75,625",-
840610,Steam and other vapour turbines for marine propulsion, , , ,8, , , ,2,194,33,2,39,Units,"4,974",54, ,1,0,Units, ,26
840681,"Steam and other vapour turbines, of an output > 40 MW (excl. those for marine propulsion)", , , ,10, , , ,2,0, ,0, ,Tons, ,3,25,0,0,Tons, ,
840682,"Steam and other vapour turbines, of an output <= 40 MW (excl. those for marine propulsion)",47, ,7,10,1,Tons,"47,000",2,"5,692",-22,1,29,Tons,"196,276",679,593,0,0,Tons, ,
840690,"Parts of steam and other vapour turbines, n.e.s.",58,-45,5,10,6,Tons,"9,667",2,"89,837",3,4,"2,273",Tons,"39,524","1,219",-37,0,393,Tons,"70,473","2,115"
840710,"Spark-ignition reciprocating or rotary internal combustion piston engine, for aircraft", , , ,8, , , ,3,"92,747",-26,5,132,Units,"702,629","3,972",-8,0,0,Units, ,-
840721,Spark-ignition outboard motors for marine propulsion,40,-26,4,5,1,Tons,"40,000",2,"14,809",7,0,453,Tons,"32,691","1,088",-14,0,0,Tons, ,35
840729,"Spark-ignition reciprocating or rotary engines, for marine propulsion (excl. outboard motors)", , , ,8, , , ,2,160,-1,0,6,Tons,"26,667",193,-2,0,0,Tons, ,-
840731,"Spark-ignition reciprocating piston engine, of a kind used for the propulsion of vehicles of . . .", , , ,8, , , ,4,0, ,0, ,Units, ,175,5,0,0,Units, ,
840732,"Spark-ignition reciprocating piston engine, of a kind used for the propulsion of vehicles of . . .", , , ,8, , , ,4,"1,438",9,0,109,Units,"13,193",252,21,0,0,Units, ,1
840733,"Spark-ignition reciprocating piston engine, of a kind used for vehicles of chapter 87, of a . . .", , , ,8, , , ,6,"9,000",17,0,462,Tons,"19,481",427,15,0,0,Tons, ,46
840734,"Spark-ignition reciprocating piston engine, of a kind used for vehicles of chapter 87, of a . . .", , , ,8, , , ,4,"387,584",-6,1,"19,968",Tons,"19,410","31,508",22,0,0,Tons, ,"1,060"
840790,Spark-ignition reciprocating or rotary internal combustion piston engine (excl. those for aircraft . . .,32,25,1,8,2,Tons,"16,000",6,"20,522",10,1,"1,572",Tons,"13,055","2,347",1,0,0,Tons, ,90
840810,"Compression-ignition internal combustion piston engine ""diesel or semi-diesel engine"", for . . .",169,70,28,8,6,Tons,"28,167",8,"37,712",22,1,"1,314",Tons,"28,700",613,-4,0,0,Tons, ,99
840820,"Compression-ignition internal combustion piston engine ""diesel or semi-diesel engine"", for . . .", , , ,8, , , ,4,"241,875",4,1,"13,679",Tons,"17,682","18,252",1,0,0,Tons, ,339
840890,"Compression-ignition internal combustion piston engine ""diesel or semi-diesel engine"" (excl. . . .","1,471",17,12,8,92,Tons,"15,989",4,"244,364",11,2,"15,242",Tons,"16,032","11,798",32,0,0,Tons, ,763
840910,"Parts suitable for use solely or principally with internal combustion piston engine for aircraft, . . .",1, ,0,8,0,Tons, ,13,"1,515",-41,0,4,Tons,"378,750",490,-23,0,96,Tons,"770,250",-
840991,Parts suitable for use solely or principally with spark-ignition internal combustion piston . . .,180,-8,1,8,13,Tons,"13,846",130,"463,354",4,1,"24,521",Tons,"18,896","12,389",-15,0,0,Tons, ,"8,662"
840999,Parts suitable for use solely or principally with compression-ignition internal combustion . . .,"1,882",9,10,8,29,Tons,"64,897",130,"1,008,710",7,3,"86,084",Tons,"11,718","19,765",2,0,0,Tons, ,"10,434"
841011,"Hydraulic turbines and water wheels, of a power <= 1.000 kW (excl. hydraulic power engines . . .", , , ,10, , , ,2,0, ,0, ,Units, ,4,-15,0,0,Units, ,
841013,"Hydraulic turbines and water wheels, of a power > 10.000 kW (excl. hydraulic power engines . . .", , , ,10, , , ,6,292,219,0,8,Units,"36,500",6,-74,0,0,Units, ,
841090,Parts of hydraulic turbines and water wheels incl. regulators,68,162,52,10,0,Tons, ,13,"3,963",-17,1,236,Tons,"16,792",131,16,0,206,Tons,"19,597",45
841111,Turbojets of a thrust <= 25 kN, , , ,8, , , ,2,"8,137",-34,1,6,Tons,"1,356,167",645, ,0,0,Tons, ,8
841112,Turbojets of a thrust > 25 kN,"24,482",-12,44,8,15,Tons,"1,632,133",2,"3,106,590",-2,4,"1,959",Tons,"1,585,804","56,278",-29,0,0,Tons, ,-
841121,Turbopropellers of a power <= 1.100 kW,4, ,1,8,0,Tons, ,2,"27,736",41,2,19,Tons,"1,459,789",286,449,0,0,Tons, ,69
841122,Turbopropellers of a power > 1.100 kW, , , ,8, , , ,2,"12,640",-30,1,6,Tons,"2,106,667","2,272",24,0,0,Tons, ,332
841181,Gas turbines of a power <= 5.000 kW (excl. turbojets and turbopropellers), , , ,10, , , ,2,"55,536",-1,2,258,No quantity,"215,256","2,585",-24,0,0,No quantity, ,973
841182,Gas turbines of a power > 5.000 kW (excl. turbojets and turbopropellers), , , ,10, , , ,12,"58,728",1,1,0,No quantity, ,"2,237",-46,0,0,No quantity, ,573
841191,"Parts of turbojets or turbopropellers, n.e.s.",156,-17,1,8,0,Tons, ,13,"145,963",8,0,114,Tons,"1,280,377","25,548",-9,0,0,Tons, ,-
841199,"Parts of gas turbines, n.e.s.",600,4,1,10,4,Tons,"150,000",13,"161,966",0,1,666,Tons,"243,192","43,825",34,0,0,Tons, ,962
841210,Reaction engines other than turbojets,4,-14,25,8,1,Units,"4,000",2,807,7,0,"2,618",Units,308,16,-43,0,0,Units, ,7
841221,"Hydraulic power engines and motors, linear acting ""cylinders""",223,19,3,8,87,Tons,"2,563",2,"78,335",21,1,"297,256",Tons,264,"7,094",41,0,0,Tons, ,249
841229,"Hydraulic power engines and motors (excl. hydraulic turbines and water wheels of heading 8410, . . .","1,398",24,22,8,58,Tons,"24,103",4,"178,290",2,3,"7,339",Tons,"24,294","6,234",2,0,0,Tons, ,808
841231,"Pneumatic power engines and motors, linear-acting, ""cylinders""",40,-18,8,8,1,Tons,"40,000",2,"31,635",21,1,778,Tons,"40,662",483,11,0,0,Tons, ,-
841239,Pneumatic power engines and motors (excl. linear acting),"1,015",89,55,8,124,Tons,"8,185",2,"31,938",-8,3,"420,267",Tons,76,"1,845",58,0,0,Tons, ,181
841280,"Engines and motors (excl. steam turbines, internal combustion piston engine, hydraulic turbines, . . .",108,34,12,10,568,Units,190,10,"14,388",0,2,"75,857",Units,190,883,-17,0,0,Units, ,358
841290,"Parts of non-electrical engines and motors, n.e.s.","2,516",19,12,8,53,Tons,"47,472",52,"140,723",9,1,"12,806",Tons,"10,989","20,838",-5,0,0,Tons, ,"2,939"
841311,"Pumps fitted or designed to be fitted with a measuring device, for dispensing fuel or lubricants, . . .",9,-3,3,8,0,Tons, ,39,"17,524",-11,2,826,Tons,"21,215",295,6,0,0,Tons, ,221
841319,"Pumps for liquids, fitted or designed to be fitted with a measuring device (excl. pumps for . . .",429,52,7,9,"50,745",Units,8,26,"20,650",14,1,"842,640",Units,25,"6,389",9,0,0,Units, ,623
841320,Hand pumps for liquids (excl. those of subheading 8413.11 and 8413.19),18,6,1,10,1,Tons,"18,000",2,"5,907",18,0,335,Tons,"17,633","2,038",30,0,0,Tons, ,11
841330,"Fuel, lubricating or cooling medium pumps for internal combustion piston engine",781,27,3,8,21,Tons,"37,190",52,"314,935",15,2,"8,551",Tons,"36,830","23,595",34,0,0,Tons, ,"4,043"
841340,Concrete pumps,16, ,1,8,1,Tons,"16,000",13,"6,317",25,1,457,Tons,"13,823","1,273",6,0,0,Tons, ,97
841350,"Reciprocating positive displacement pumps for liquids, power-driven (excl. those of subheading . . .","3,982",9,54,8,89,Tons,"44,742",52,"152,146",19,2,"3,386",Tons,"44,934","7,406",9,0,0,Tons, ,-
841360,"Rotary positive displacement pumps for liquids, power-driven (excl. those of subheading 8413.11 . . .",356,28,16,8,10,Tons,"35,600",39,"149,159",2,2,"4,309",Tons,"34,616","2,242",3,0,0,Tons, ,583
841370,"Centrifugal pumps, power-driven (excl. those of subheading 8413.11 and 8413.19, fuel, lubricating . . .","1,367",-6,5,8,76,Tons,"17,987",117,"230,644",7,1,"12,783",Tons,"18,043","26,922",14,0,0,Tons, ,"2,053"
841381,"Pumps for liquids, power-driven (excl. those of subheading 8413.11 and 8413.19, fuel, lubricating . . .","1,424",4,12,8,53,Units,"26,868",52,"112,974",-9,2,"4,203",Units,"26,879","11,797",0,0,0,Units, ,"3,397"
841382,Liquid elevators (excl. pumps),1,-6,0,8,0,Tons, ,13,"1,287",9,0,71,Tons,"18,127",734,-17,0,0,Tons, ,20
841391,"Parts of pumps for liquids, n.e.s.","5,731",6,36,8,323,Tons,"17,743",65,"330,616",0,2,"15,244",Tons,"21,688","16,039",9,0,0,Tons, ,"2,811"
841392,"Parts of liquid elevators, n.e.s.",52,58,15,8,1,Tons,"52,000",13,"3,543",17,2,230,Tons,"15,404",343,45,0,25,Tons,"64,760",51
841410,Vacuum pumps,542,145,9,8,13,Tons,"41,692",13,"86,915",15,1,"2,091",Tons,"41,566","5,894",49,0,0,Tons, ,125
841420,Hand-operated or foot-operated air pumps,5,-37,5,9,0,Tons, ,6,"20,600",12,4,"1,935",Tons,"10,646",100,-9,0,0,Tons, ,80
841430,Compressors for refrigerating equipment,310,116,18,8,23,Tons,"13,478",13,"327,009",6,2,"24,336",Tons,"13,437","1,762",-6,0,0,Tons, ,"3,674"
841440,Air compressors mounted on a wheeled chassis for towing,"2,925",66,69,8,284,Tons,"10,299",52,"92,588",2,9,"8,978",Tons,"10,313","4,252",33,0,0,Tons, ,95
841451,"Table, floor, wall, window, ceiling or roof fans, with a self-contained electric motor of an . . .",32,-51,1,9,3,Tons,"10,667",65,"57,878",-14,1,"4,804",Tons,"12,048","2,175",5,0,0,Tons, ,"1,456"
841459,"Fans (excl. table, floor, wall, window, ceiling or roof fans, with a self-contained electric . . .",302,24,1,8,13,Tons,"23,231",52,"299,456",11,2,"12,772",Tons,"23,446","48,426",17,0,0,Tons, ,"1,539"
841460,"Hoods incorporating a fan, whether or not fitted with filters, having a maximum horizontal . . .",7, ,0,8,1,Tons,"7,000",13,"78,642",12,3,"7,784",Tons,"10,103","3,518",-4,0,0,Tons, ,997
841480,"Air pumps, air or other gas compressors and ventilating or recycling hoods incorporating a . . .",365,26,5,8,16,Tons,"22,813",65,"859,170",7,4,"36,518",Tons,"23,527","6,746",6,0,0,Tons, ,"2,649"
841490,"Parts of: air or vacuum pumps, air or other gas compressors, fans and ventilating or recycling . . .",584,-16,4,8,14,Tons,"41,714",91,"569,392",9,5,"47,537",Tons,"11,978","15,700",25,0,0,Tons, ,"4,145"
841510,"Air conditioning machines designed to be fixed to a window, wall, ceiling or floor, self-contained . . .",295,-39,4,10,24,Tons,"12,292",42,"222,644",-25,1,"18,100",Tons,"12,301","7,747",4,0,0,Tons, ,"53,887"
841520,"Air conditioning machines of a kind used for persons, in motor vehicles",24,-37,10,10,1,Tons,"24,000",40,"8,208",-7,0,323,Tons,"25,412",237,-10,0,0,Tons, ,-
841581,Air conditioning machines incorporating a refrigerating unit and a valve for reversal of the . . .,234, ,6,10,15,Tons,"15,600",42,"24,058",9,1,"1,565",Tons,"15,373","3,637",40,0,0,Tons, ,"1,303"
841582,Air conditioning machines incorporating a refrigerating unit but without a valve for reversal . . .,729,126,3,10,44,Tons,"16,568",42,"102,694",3,2,"6,249",Tons,"16,434","26,503",42,0,0,Tons, ,"2,667"
841583,"Air conditioning machines comprising a motor-driven fan, not incorporating a refrigerating . . .",8,-18,0,10,0,Tons, ,42,"62,375",-9,2,"4,013",Tons,"15,543","8,717",38,0,0,Tons, ,"2,970"
841590,"Parts of air conditioning machines, comprising a motor-driven fan and elements for changing . . .",826,17,2,10,67,Tons,"12,328",20,"450,281",3,2,"30,500",Tons,"14,763","45,971",40,0,0,Tons, ,"2,827"
841610,Furnace burners for liquid fuel, , , ,8, , , ,13,"3,519",-12,2,212,Tons,"16,599",24,-56,0,0,Tons, ,19
841620,"Furnace burners for pulverised solid fuel or gas, incl. combination burners",8,-41,0,8,4,Tons,"2,000",13,"19,779",-4,2,683,Tons,"28,959","3,546",25,0,0,Tons, ,185
841630,"Mechanical stokers, incl. their mechanical grates, mechanical ash dischargers and similar appliances . . .", , , ,8, , , ,13,289,10,0,26,Tons,"11,115",2,-63,0,0,Tons, ,5
841690,"Parts of furnace burners such as mechanical stokers, incl. their mechanical grates, mechanical . . .",12,-25,1,8,2,No quantity,"6,000",13,"23,734",2,2,972,No quantity,"24,418","1,973",-25,0,429,No quantity,"18,660",138
841710,"Industrial or laboratory furnaces and ovens, non-electric, for the roasting, melting or other . . .", , , ,8, , , ,13,"37,576",-6,4,"2,665",Tons,"14,100",331,-45,0,0,Tons, ,200
841720,"Bakery ovens, incl. biscuit ovens, non-electric",8,-15,1,8,1,Tons,"8,000",14,"15,320",9,4,"1,112",Tons,"13,777",778,35,0,0,Tons, ,43
841780,"Industrial or laboratory furnaces and ovens, non-electric, incl. incinerators (excl. those . . .",65,4,12,8,4,Tons,"16,250",26,"50,707",-2,3,"3,408",Tons,"14,879",543,-6,0,0,Tons, ,232
841790,"Parts of industrial or laboratory furnaces, non-electric, incl. incinerators, n.e.s.",44,-14,14,8,2,Tons,"22,000",13,"63,753",-1,3,"9,985",Tons,"6,385",304,-26,0,"6,272",Tons,"6,486",186
841810,"Combined refrigerator-freezers, with separate external doors or drawers, or combinations thereof",5,-32,0,9,1,Tons,"5,000",42,"234,591",13,2,"45,970",Tons,"5,103","1,372",12,0,0,Tons, ,"11,756"
841821,"Household refrigerators, compression-type", , , ,10, , , ,21,"115,219",55,3,"23,142",Tons,"4,979",793,3,0,0,Tons, ,"14,830"
841829,"Household refrigerators, absorption-type", , , ,10, , , ,21,"5,669",-27,1,682,Tons,"8,312","1,626",-1,0,0,Tons, ,612
841830,"Freezers of the chest type, of a capacity <= 800 l", , , ,9, , , ,40,"27,277",-16,1,"5,571",Tons,"4,896","1,014",2,0,0,Tons, ,681
841840,"Freezers of the upright type, of a capacity <= 900 l",10,-28,2,8,2,Tons,"5,000",40,"12,331",-2,0,"2,310",Tons,"5,338",436,-4,0,0,Tons, ,225
841850,"Furniture ""chests, cabinets, display counters, show-cases and the like"" for storage and display, . . .",201,-7,3,8,22,Tons,"9,136",20,"52,955",11,0,"5,731",Tons,"9,240","5,855",-3,0,0,Tons, ,547
841861,Heat pumps (excl. air conditioning machines of heading 8415),6, ,0,8,0,No quantity, ,20,"13,955",12,0,0,No quantity, ,"3,025",7,0,0,No quantity, ,-
841869,Refrigerating or freezing equipment (excl. refrigerating and freezing furniture),779,-7,10,8,2,No quantity,"389,500",120,"164,731",0,1,"1,177",No quantity,"139,958","7,796",-4,0,0,No quantity, ,"1,034"
841891,Furniture designed to receive refrigerating or freezing equipment, , , ,8, , , ,9,"2,828",11,1,161,Tons,"17,565",848,11,0,0,Tons, ,45
841899,"Parts of refrigerating or freezing equipment and heat pumps, n.e.s.",658,10,3,8,57,Tons,"11,544",20,"91,454",4,1,"10,748",Tons,"8,509","23,416",26,0,"7,610",Tons,"10,871","2,013"
841911,Instantaneous gas water heaters (excl. boilers or water heaters for central heating), , , ,9, , , ,4,"5,088",-27,0,384,Tons,"13,250",32,-20,0,0,Tons, ,23
841919,"Instantaneous or storage water heaters, non-electric (excl. instantaneous gas water heaters, . . .",9,-55,3,10,1,Tons,"9,000",4,"5,744",-10,0,893,Tons,"6,432",348,11,0,0,Tons, ,14
841920,"Medical, surgical or laboratory sterilizers",24,-23,2,8,0,Tons, ,26,"28,979",-4,2,469,Tons,"61,789","1,223",9,0,0,Tons, ,"1,622"
841931,Dryers for agricultural products, , , ,8, , , ,13,"2,412",-40,1,259,Tons,"9,313",2, ,0,0,Tons, ,23
841932,"Dryers for wood, paper pulp, paper or paperboard", , , ,8, , , ,13,805,-41,0,69,Tons,"11,667",1, ,0,0,Tons, ,
841939,"Dryers (excl. lyophilisation apparatus, freeze drying units, spray dryers, dryers for agricultural . . .","2,555",316,89,8,100,Tons,"25,550",13,"138,783",31,6,"100,937",Tons,"1,375","2,865",61,0,0,Tons, ,146
841940,Distilling or rectifying plant,64,38,1,8,1,Tons,"64,000",39,"36,158",11,3,771,Tons,"46,898","5,140",-4,0,0,Tons, ,-
841950,Heat-exchange units (excl. those used with boilers),428,24,1,8,21,Tons,"20,381",8,"203,335",9,2,"10,003",Tons,"20,327","44,803",9,0,0,Tons, ,"5,714"
841960,Machinery for liquefying air or other gases,275,22,1,8,8,Tons,"34,375",2,"41,947",6,2,"1,238",Tons,"33,883","41,712",67,3,0,Tons, ,"2,058"
841981,"Machinery, plant and equipment for making hot drinks or for cooking or heating food (excl. . . .",325,-9,21,10,9,Tons,"36,111",39,"67,837",7,1,"1,819",Tons,"37,294","1,583",-2,0,0,Tons, ,-
841989,"Machinery, plant or laboratory equipment, whether or not electrically heated, for the treatment . . .","1,986",10,15,8,51,Tons,"38,941",117,"270,168",7,3,"6,937",Tons,"38,946","12,894",-2,0,0,Tons, ,
841990,"Parts of machinery, plant and laboratory equipment, whether or not electrically heated, for . . .","11,433",134,19,9,133,Tons,"85,962",26,"190,594",7,2,"27,049",Tons,"7,046","60,419",101,1,0,Tons, ,
842010,Calendering or other rolling machines (other than for metals or glass), , , ,8, , , ,13,"35,727",8,3,"1,833",Tons,"19,491",146,22,0,0,Tons, ,9
842091,Cylinders for calendering or other rolling machines (other than for metals or glass),54,66,34,8,1,Tons,"54,000",13,"3,761",10,1,192,Tons,"19,589",160,-2,0,0,Tons, ,-
842099,"Parts for calendering or rolling machines, n.e.s. (other than for metals or glass and excl. . . .", , , ,8, , , ,13,"9,504",3,4,574,Tons,"16,557",155,79,0,23,Tons,"85,609",46
842111,Centrifugal cream separators,1,-20,0,8,0,Tons, ,13,"4,183",-15,6,126,Tons,"33,198",580,30,1,0,Tons, ,53
842112,Centrifugal clothes-dryers, , , ,8, , , ,13,191,-2,0,0,Tons, ,289,67,1,0,Tons, ,1
842119,"Centrifuges, incl. centrifugal dryers (excl. isotope separators, cream separators and clothes . . .",132,-14,10,8,3,Tons,"44,000",104,"62,432",10,3,"1,280",Tons,"48,775","1,301",-6,0,0,Tons, ,
842121,Machinery and apparatus for filtering or purifying water,"4,069",4,10,8,180,Tons,"22,606",39,"150,294",11,1,"6,666",Tons,"22,546","39,039",6,0,0,Tons, ,-
842122,Machinery and apparatus for filtering or purifying beverages (excl.water),65,14,34,8,1,Tons,"65,000",13,"3,207",-8,1,49,Tons,"65,449",193,-45,0,0,Tons, ,-
842123,Oil or petrol-filters for internal combustion engines,"5,853",131,48,8,306,Tons,"19,127",13,"104,135",12,1,"5,446",Tons,"19,121","12,204",19,0,0,Tons, ,"1,487"
842129,Machinery and apparatus for filtering or purifying liquids (excl. such machinery and apparatus . . .,"1,050",-29,5,8,"28,901",Tons,36,13,"255,061",15,2,"57,347,009",Tons,4,"22,050",2,0,0,Tons, ,"1,177"
842131,Intake air filters for internal combustion engines,66,-12,1,8,4,Tons,"16,500",2,"30,368",6,1,"1,851",Tons,"16,406","6,122",4,0,0,Tons, ,583
842139,Machinery and apparatus for filtering or purifying gases (excl. isotope separators and intake . . .,634,-15,2,8,20,Tons,"31,700",39,"365,531",7,1,"10,706",Tons,"34,143","32,986",29,0,0,Tons, ,"5,066"
842191,"Parts of centrifuges, incl. centrifugal dryers, n.e.s.",15,0,9,8,0,Tons, ,13,"15,588",-1,1,133,Tons,"117,203",173,-23,0,0,Tons, ,
842199,"Parts of machinery and apparatus for filtering or purifying liquids or gases, n.e.s.","3,503",-11,17,10,59,Tons,"59,373",13,"496,399",11,2,"52,466",Tons,"9,461","20,887",-10,0,0,Tons, ,"3,983"
842211,Dishwashing machines of the household type,1,-4,0,10,0,Tons, ,13,"29,245",36,0,"4,361",Tons,"6,706",373,118,0,0,Tons, ,"8,690"
842219,Dishwashing machines (excl. those of the household type), , , ,8, , , ,13,"12,804",-6,1,516,Tons,"24,814",197,-3,0,0,Tons, ,33
842220,Machinery for cleaning or drying bottles or other containers (excl. dishwashing machines),191,164,26,8,3,Tons,"63,667",13,"15,758",14,2,269,Tons,"58,580",729,108,0,0,Tons, ,45
842230,"Machinery for filling, closing, sealing or labelling bottles, cans, boxes, bags or other containers; . . .",541,-18,4,5,17,Tons,"31,824",13,"291,822",2,3,"5,502",Tons,"53,039","13,059",-4,0,0,Tons, ,703
842240,"Packing or wrapping machinery, incl. heat-shrink wrapping machinery (excl. machinery for filling, . . .",187,2,5,5,17,Tons,"11,000",13,"120,063",-3,1,"6,046",Tons,"19,858","3,742",-13,0,0,Tons, ,"1,705"
842290,"Parts of dishwashing machines, packing or wrapping machinery and other machinery and apparatus . . .",67,-42,4,8,2,Tons,"33,500",39,"90,678",5,1,"1,149",Tons,"78,919","1,847",-13,0,0,Tons, ,-
842310,"Personal weighing machines, incl. baby scales; household scales", , , ,10, , , ,14,"17,242",14,2,"2,004",Tons,"8,604",176,-8,0,0,Tons, ,131
842320,Scales for continuous weighing of goods on conveyors, , , ,8, , , ,14,"2,514",-14,1,33,Tons,"76,182",13,-40,0,0,Tons, ,-
842330,Constant weight scales and scales for discharging a pre-determined weight of material into . . .,5,-55,8,8,0,Tons, ,14,"13,840",-10,2,218,Tons,"63,486",65,-32,0,0,Tons, ,169
842381,Weighing machinery having a maximum weighing capacity <= 30 kg (excl. balances of a sensitivity . . .,38,248,21,8,1,Tons,"38,000",28,"6,612",10,1,110,Tons,"60,109",184,-4,0,0,Tons, ,13
842382,Weighing machinery of a maximum weighing capacity > 30 kg but <= 5.000 kg (excl. personal weighing . . .,1,92,2,8,1,Units,"1,000",28,"1,832",5,0,"294,247",Units,6,56,-5,0,0,Units, ,11
842389,Weighing machinery of a maximum weighing capacity > 5.000 kg,4,39,1,8,32,No quantity,125,14,"4,506",-22,2,"251,671",No quantity,18,357,1,0,0,No quantity, ,47
842390,"Weighing machine weights of all kinds; parts of weighing machinery, n.e.s.",17,-31,6,9,0,Tons, ,30,"31,635",0,3,519,Tons,"60,954",298,10,0,0,Tons, ,169
842410,"Fire extinguishers, whether or not charged",36,-14,1,8,"47,932",Units,1,13,"11,298",16,1,"1,996,803",Units,6,"5,955",-2,0,0,Units, ,398
842420,"Spray guns and similar appliances (other than electrical machines, appliances and other devices . . .",171,36,13,8,6,Tons,"28,500",13,"31,478",12,1,"1,086",Tons,"28,985","1,283",-5,0,0,Tons, ,53
842430,"Steam or sand blasting machines and similar jet projecting machines, incl. water cleaning appliances . . .",41,-30,2,8,3,Tons,"13,667",13,"16,689",-4,0,"1,354",Tons,"12,326","1,667",-1,0,0,Tons, ,-
842441,"Agricultural or horticultural sprayers, portable", , , ,8, , , ,13,"23,396",21,4,"2,903",Tons,"8,059",334,-25,0,0,Tons, ,
842449,Agricultural or horticultural sprayers (excl. portable),59,-21,2,8,4,Tons,"14,750",13,"23,996",-3,2,"1,687",Tons,"14,224","2,470",-6,0,0,Tons, ,
842482,"Agricultural or horticultural mechanical appliances, whether or not hand-operated, for projecting . . .",4,-10,0,8,0,Tons, ,13,"45,827",-2,2,"4,234",Tons,"10,824","49,961",39,2,0,Tons, ,
842489,"Mechanical appliances, whether or not hand-operated, for projecting, dispersing or spraying . . .","1,191",35,28,8,43,Tons,"27,698",39,"175,030",-1,3,"6,309",Tons,"27,743","4,190",-2,0,0,Tons, ,
842490,"Parts of fire extinguishers, spray guns and similar appliances, steam or sand blasting machines . . .",150,-4,1,8,7,Tons,"21,429",13,"115,013",-3,2,"10,557",Tons,"10,894","13,951",25,0,"11,165",Tons,"8,667",
842511,"Pulley tackle and hoists, powered by electric motor (other than skip hoists or hoists of a . . .",129,21,24,8,7,Tons,"18,429",26,"22,159",5,2,"1,205",Tons,"18,389",528,1,0,0,Tons, ,101
842519,"Pulley tackle and hoists (other than skip hoists or hoists of a kind used for raising vehicles), . . .",33,119,9,8,21,Units,"1,571",4,"7,932",-11,1,"158,874",Units,50,379,1,0,0,Units, ,-
842531,Winches and capstans powered by electric motor,24,31,1,8,2,Tons,"12,000",13,"4,417",0,0,320,Tons,"13,803","2,831",-45,0,0,Tons, ,
842539,"Winches and capstans, non-powered by electric motor",125,127,13,8,10,Tons,"12,500",2,"7,520",-5,1,579,Tons,"12,988",960,14,0,0,Tons, ,
842541,Built-in jacking systems of a type used in garages, , , ,8, , , ,13,545,-26,0,130,Tons,"4,192",44,-31,0,0,Tons, ,4
842542,"Jacks and hoists, hydraulic (excl. built-in jacking systems used in garages)",13,-29,0,8,2,Tons,"6,500",13,"12,224",10,1,"1,823",Tons,"6,705","2,838",6,0,0,Tons, ,41
842549,"Jacks and hoists of a kind used for raising vehicles, not hydraulic","1,540",10,49,8,"3,479",Units,443,13,"21,671",-3,2,"482,392",Units,45,"3,116",-7,0,0,Units, ,-
842611,Overhead travelling cranes on fixed support, , , ,8, , , ,13,"40,603",47,4,"5,833",Tons,"6,961",922,6,0,0,Tons, ,385
842612,Mobile lifting frames on tyres and straddle carriers, , , ,8, , , ,13,"5,679",18,1,754,Tons,"7,532","1,489",8,0,0,Tons, ,98
842619,"Overhead travelling cranes, transporter cranes, gantry cranes, bridge cranes and mobile lifting . . .",612, ,55,8,79,Tons,"7,747",13,"179,104",-4,7,"23,274",Tons,"7,695","1,120",-40,0,0,Tons, ,259
842620,Tower cranes,122,-45,1,8,37,Tons,"3,297",13,"27,511",-10,2,"8,365",Tons,"3,289","8,882",-12,1,0,Tons, ,-
842630,Portal or pedestal jib cranes, , , ,8, , , ,13,"4,571",-32,1,441,Tons,"10,365",134,-9,0,0,Tons, ,21
842641,"Mobile cranes and works trucks fitted with a crane, self-propelled, on tyres (excl. wheel-mounted . . .","15,800",43,87,8,"2,659",Tons,"5,942",13,"183,712",28,7,"30,918",Tons,"5,942","18,198",27,1,0,Tons, ,-
842649,"Mobile cranes and works trucks fitted with a crane, self-propelled (excl. those on tyres and . . .","1,083",-32,22,8,126,Tons,"8,595",13,"249,938",45,11,"29,126",Tons,"8,581","4,822",-7,0,0,Tons, ,"1,281"
842691,Cranes designed for mounting on road vehicles, , , ,8, , , ,13,"5,463",4,0,459,Tons,"11,902",319,20,0,0,Tons, ,40
842699,"Ships' derricks; cranes, incl. cable cranes (excl. overhead travelling cranes, transporter . . .",73,-45,12,8,6,Tons,"12,167",26,"6,929",-15,1,562,Tons,"12,329",621,16,0,0,Tons, ,87
842710,"Self-propelled trucks fitted with lifting or handling equipment, powered by an electric motor",39,-1,5,8,6,Tons,"6,500",13,"73,565",8,1,"10,765",Tons,"6,834",863,27,0,0,Tons, ,49
842720,"Self-propelled trucks fitted with lifting or handling equipment, non-powered by an electric . . .",72,-3,2,8,13,Tons,"5,538",13,"13,317",-1,0,"2,413",Tons,"5,519","3,329",13,0,0,Tons, ,82
842790,"Works trucks fitted with lifting or handling equipment, not self-propelled",272,30,19,8,68,Tons,"4,000",13,"66,822",-7,4,"16,749",Tons,"3,990","1,417",5,0,0,Tons, ,286
842810,Lifts and skip hoists,"1,251",-1,22,8,179,Tons,"6,989",39,"106,190",-10,2,"15,215",Tons,"6,979","5,561",-1,0,0,Tons, ,-
842820,Pneumatic elevators and conveyors,12,-64,1,8,14,Tons,857,39,"57,869",-15,5,"158,981",Tons,364,"1,217",-16,0,0,Tons, ,226
