551521,"Woven fabrics containing predominantly, but < 85% acrylic or modacrylic staple fibres by weight, . . .",,,0,22,,,,,161,8,0,27,Tons,"5,963",,,,5,Tons,"28,800",
551522,"Woven fabrics containing predominantly, but < 85% acrylic or modacrylic staple fibres by weight, . . .",,,0,22,,,,,9,9,0,0,,,,,,0,,,
551529,"Woven fabrics containing predominantly, but < 85% acrylic or modacrylic staple fibres by weight, . . .",,,0,22,,,,,276,-2,0,19,Tons,"14,526",,,,8,Tons,"30,250",
551591,"Woven fabrics containing predominantly, but < 85% synthetic staple fibres, mixed principally . . .",,,,22,,,,,464,71,1,7,Tons,"66,286",2,-66,0,4,Tons,"42,500",
551599,"Woven fabrics containing predominantly, but < 85% synthetic staple fibres, other than those . . .",,,,22,,,,,318,-7,0,30,Tons,"10,600","1,382",-21,1,260,Tons,"40,492",1
551611,"Woven fabrics containing >= 85% artificial staple fibres by weight, unbleached or bleached",,,,22,,,,,72,-26,0,25,,"2,880",1,-35,0,365,,"5,449",-
551612,"Woven fabrics containing >= 85% artificial staple fibres by weight, dyed",,,,22,,,,,"3,795",-10,1,576,Tons,"6,589",45,35,0,"2,384",Tons,"7,194",40
551613,"Woven fabrics containing >= 85% artificial staple fibres by weight, made of yarn of different . . .",,,,22,,,,,31,-41,0,4,Tons,"7,750",52,-17,0,19,Tons,"12,579",-
551614,"Woven fabrics containing >= 85% artificial staple fibres by weight, printed",,,,22,,,,,"8,008",14,1,"1,199",Tons,"6,679",77,275,0,"9,160",Tons,"6,789",152
551621,"Woven fabrics containing predominantly, but < 85% artificial staple fibres, mixed principally . . .",,,0,22,,,,,350,29,1,114,,"3,070",,,,9,,"11,556",
551622,"Woven fabrics containing predominantly, but < 85% artificial staple fibres, mixed principally . . .",,,0,22,,,,,"2,316",-23,1,288,Tons,"8,042",,,,"2,114",Tons,"5,794",42
551623,"Woven fabrics containing predominantly, but < 85% artificial staple fibres, mixed principally . . .",,,0,22,,,,,57,-25,0,8,Tons,"7,125",,,,27,Tons,"18,296",
551624,"Woven fabrics containing predominantly, but < 85% artificial staple fibres by weight, mixed . . .",,,0,22,,,,,"1,263",69,2,161,Tons,"7,845",,,,264,Tons,"8,462",6
551631,"Woven fabrics containing predominantly, but < 85% artificial staple fibres by weight, mixed . . .",,,0,22,,,,,47,-19,1,7,,"6,714",,,,0,,,
551632,"Woven fabrics containing predominantly, but < 85% artificial staple fibres by weight, mixed . . .",,,0,22,,,,,3,-23,0,0,,,,,,43,,"28,000",
551633,"Woven fabrics containing predominantly, but < 85% artificial staple fibres by weight, mixed . . .",,,,,,,,,0,,0,,,,2,-21,0,0,,,
551634,"Woven fabrics containing predominantly, but < 85% artificial staple fibres by weight, mixed . . .",,,0,22,,,,,2,-62,0,0,,,,,,0,,,
551642,"Woven fabrics containing predominantly, but < 85% artificial staple fibres by weight, mixed . . .",,,,22,,,,,10,-43,0,1,Tons,"10,000",114,4,0,8,Tons,"18,875",
551643,"Woven fabrics containing predominantly, but < 85% artificial staple fibres by weight, mixed . . .",,,,22,,,,,76,4,0,6,Tons,"12,667",159,8,0,20,Tons,"21,300",
551644,"Woven fabrics containing predominantly, but < 85% artificial staple fibres by weight, mixed . . .",,,,22,,,,,5,-26,0,0,Tons,,19,,0,0,Tons,,
551691,"Woven fabrics containing predominantly, but < 85% artificial staple fibres by weight, other . . .",,,,22,,,,,147,242,0,45,Tons,"3,267",20,33,0,3,Tons,"47,667",
551692,"Woven fabrics containing predominantly, but < 85% artificial staple fibres by weight, other . . .",1,95,0,22,0,Tons,,,836,17,0,194,Tons,"4,309",204,53,0,715,Tons,"7,480",3
551693,"Woven fabrics containing predominantly, but < 85% artificial staple fibres by weight, other . . .",,,,22,,,,,182,-4,0,12,Tons,"15,167",10,-15,0,155,Tons,"9,045",1
551694,"Woven fabrics containing predominantly, but < 85% artificial staple fibres by weight, other . . .",,,,22,,,,,"4,326",131,9,"2,953",Tons,"1,465",21,-22,0,31,Tons,"10,452",
560121,"Wadding of cotton and articles thereof (excl. sanitary towels and tampons, napkins and napkin . . .",,,,15,,,,,"5,307",-3,1,950,Tons,"5,586",107,-14,0,0,Tons,,64
560122,"Wadding of man-made fibres and articles thereof (excl. sanitary towels and tampons, napkins . . .",,,,20,,,,,814,-37,0,47,Tons,"17,319","11,258",0,1,"1,525",Tons,"18,418",-
560129,Wadding of textile materials and articles thereof (excl. of cotton or man-made fibres; sanitary . . .,,,,20,,,,,489,-2,1,65,Tons,"7,523",86,-17,0,0,Tons,,-
560130,Textile flock and dust and mill neps,,,0,0,,,,,800,-10,0,85,Tons,"9,412",,,,428,Tons,"1,371",1
560210,"Needleloom felt and stitch-bonded fibre fabrics, whether or not impregnated, coated, covered . . .",,,,10,,,,,"3,708",15,0,"1,191",Tons,"3,113",83,26,0,562,Tons,"6,388",2
560221,"Felt, not impregnated, coated, covered or laminated, of wool or fine animal hair, n.e.s. (excl. . . .",,,,10,,,,,386,-8,0,38,Tons,"10,158",4,,0,12,Tons,"16,417",
560229,"Felt, not impregnated, coated, covered or laminated (excl. that of wool or fine animal hair; . . .",,,,10,,,,,632,-32,0,200,Tons,"3,160",2,-56,0,"1,144",Tons,"1,347",1
560290,"Felt, impregnated, coated, covered or laminated (excl. needleloom felt and stitch-bonded fibre . . .",,,,10,,,,,"6,532",70,2,"1,849",Tons,"3,533",47,-8,0,334,Tons,"2,042",
560311,"Nonwovens, whether or not impregnated, coated, covered or laminated, n.e.s., of synthetic or . . .",,,,15,,,,,"20,407",-8,1,"7,030",Tons,"2,903","2,584",38,0,"1,001",Tons,"3,352",87
560312,"Nonwovens, whether or not impregnated, coated, covered or laminated, n.e.s., of man-made filaments, . . .",,,,15,,,,,"25,158",8,1,"8,235",Tons,"3,055","1,105",33,0,"3,424",Tons,"4,959",55
560313,"Nonwovens, whether or not impregnated, coated, covered or laminated, n.e.s., of man-made filaments, . . .",,,,15,,,,,"9,365",-12,0,"1,705",Tons,"5,493",170,1,0,"1,767",Tons,"6,251",11
560314,"Nonwovens, whether or not impregnated, coated, covered or laminated, n.e.s., of man-made filaments, . . .",,,,15,,,,,"7,364",5,0,"1,229",Tons,"5,992",136,26,0,"1,524",Tons,"6,608",7
560391,"Nonwovens, whether or not impregnated, coated, covered or laminated, n.e.s., weighing <= 25 . . .",,,,15,,,,,"2,954",-7,1,"1,132",Tons,"2,610",818,130,0,0,Tons,,
560392,"Nonwovens, whether or not impregnated, coated, covered or laminated, n.e.s., weighing > 25 . . .",,,,15,,,,,"16,402",5,1,"4,718",Tons,"3,476",286,9,0,"1,980",Tons,"3,723",10
560393,"Nonwovens, whether or not impregnated, coated, covered or laminated, n.e.s., weighing > 70 . . .",,,,15,,,,,"15,092",44,1,"3,547",Tons,"4,255",110,40,0,"1,484",Tons,"5,348",6
560394,"Nonwovens, whether or not impregnated, coated, covered or laminated, n.e.s., weighing > than . . .",,,,15,,,,,"4,520",-2,0,997,Tons,"4,534",344,50,0,0,Tons,,4
560410,Textile-covered rubber thread and cord,,,,15,,,,,953,13,0,153,Tons,"6,229",744,1,0,538,Tons,"6,273",4
560490,"Textile yarn, strip and the like of heading 5404 and 5405, impregnated, coated, covered or . . .",,,,15,,,,,853,4,0,154,Tons,"5,539","1,146",40,0,147,Tons,"6,170",-
560500,"Metallised yarn, whether or not gimped, being textile yarn, or strip or the like of heading . . .",,,,0,,,,,174,-10,0,19,Tons,"9,158",1,-58,0,"1,034",Tons,"6,066",1
560600,"Gimped yarn, gimped strip and the like of heading 5404 or 5405; chenille yarn, incl. flock . . .",,,,18,,,,,327,-4,0,29,Tons,"11,276",880,37,0,74,Tons,"7,027",
560721,"Binder or baler twine, of sisal or other textile fibres of the genus Agave",,,,15,,,,,118,19,0,43,Tons,"2,744",24,-18,0,1,Tons,"6,000",
560729,"Twine, cordage, ropes and cables, of sisal or other textile fibres of the genus Agave, whether . . .",,,,15,,,,,389,-7,0,183,Tons,"2,126",189,25,0,273,Tons,"2,271",-
560741,"Binder or baler twine, of polyethylene or polypropylene",,,,15,,,,,"2,664",2,1,920,Tons,"2,896",112,-35,0,212,Tons,"1,892",24
560749,"Twine, cordage, ropes and cables of polyethylene or polypropylene, whether or not plaited or . . .",,,,15,,,,,"1,894",1,0,512,Tons,"3,699","5,634",3,1,"7,188",Tons,"2,459",33
560750,"Twine, cordage, ropes and cables, of synthetic fibres, whether or not plaited or braided and . . .",,,,15,,,,,"2,145",2,0,585,Tons,"3,667","1,181",-6,0,"3,230",Tons,"4,464",11
560790,"Twine, cordage, ropes and cables, whether or not plaited or braided and whether or not impregnated, . . .",,,,5,,,,,"3,520",-1,1,"2,274",Tons,"1,548",957,-4,0,717,Tons,"4,057",25
560811,Made-up knotted fishing nets of man-made textile materials (excl. landing nets),,,,20,,,,,398,-9,0,84,Tons,"4,738","1,972",56,0,"2,373",Tons,"6,324",1
560819,"Knotted netting of twine, cordage, ropes or cables, by the piece or metre; made-up nets, of . . .",,,,20,,,,,"5,485",-1,1,"1,374",Tons,"3,992","2,484",132,0,"2,581",Tons,"3,613",13
560890,"Knotted netting of twine, cordage, ropes or cables, by the piece or metre; made-up fishing . . .",,,,20,,,,,"1,508",2,1,365,Tons,"4,132",47,-7,0,153,Tons,"4,268",13
560900,"Articles of yarn, strip or the like of heading 5404 or 5405, or of twine, cordage, ropes or . . .",,,,20,,,,,"1,208",2,0,188,Tons,"6,426","1,298",-2,0,"1,455",Tons,"4,517",12
570110,"Carpets and other textile floor coverings, of wool or fine animal hair, knotted, whether or . . .",22,8,2,5,11,1000 square meters,"2,000",,"1,411",-17,0,72,1000 square meters,"19,597","1,218",-33,0,0,1000 square meters,,16
570190,"Carpets and other textile floor coverings, of textile materials, knotted, whether or not made . . .",29,172,0,5,14,1000 square meters,"2,071",,510,-6,0,89,1000 square meters,"5,730","10,526",-24,3,0,1000 square meters,,15
570210,"Kelem, Schumacks, Karamanie and similar hand-woven rugs, whether or not made up",,,,5,,,,,737,-4,0,45,1000 square meters,"16,378",561,5,0,0,1000 square meters,,2
570220,"Floor coverings of coconut fibres ""coir"", woven, whether or not made up",,,,30,,,,,762,4,1,109,1000 square meters,"6,991",5,-19,0,111,1000 square meters,"3,892",
570231,"Carpets and other floor coverings, of wool or fine animal hair, woven, not tufted or flocked, . . .",,,,30,,,,,550,-12,0,67,1000 square meters,"8,209",623,18,0,600,1000 square meters,"14,825",5
570232,"Carpets and other floor coverings, of man-made textile materials, woven, not tufted or flocked, . . .",1,,0,30,0,1000 square meters,,,"1,030",16,1,66,1000 square meters,"15,606",328,2,0,0,1000 square meters,,18
570239,"Carpets and other floor coverings, of vegetable textile materials or coarse animal hair, woven, . . .",,,,30,,,,,35,-13,0,7,1000 square meters,"5,000",27,-25,0,0,1000 square meters,,6
570241,"Carpets and other floor coverings, of wool or fine animal hair, woven, not tufted or flocked, . . .",,,,30,,,,,69,-5,0,5,1000 square meters,"13,800",432,-11,0,0,1000 square meters,,1
570242,"Carpets and other floor coverings, of man-made textile materials, woven, not tufted or flocked, . . .",,,,30,,,,,"4,914",-9,0,896,1000 square meters,"5,484","3,520",45,0,0,1000 square meters,,219
570249,"Carpets and other floor coverings, of vegetable textile materials or coarse animal hair, woven, . . .",1,61,1,30,0,1000 square meters,,,879,-5,0,126,1000 square meters,"6,976",89,-21,0,0,1000 square meters,,5
570250,"Carpets and other textile floor coverings, woven, not tufted or flocked, not of pile construction, . . .",,,,30,,,,,299,0,0,54,1000 square meters,"5,537",46,5,0,0,1000 square meters,,1
570291,"Carpets and other floor coverings, of wool or fine animal hair, woven, not tufted or flocked, . . .",,,,30,,,,,24,-26,0,0,1000 square meters,,49,-20,0,0,1000 square meters,,-
570292,"Carpets and other floor coverings, of man-made textile materials, woven, not tufted or flocked, . . .",11,38,2,30,4,1000 square meters,"2,750",,"2,195",43,1,559,1000 square meters,"3,927",525,1,0,0,1000 square meters,,8
570299,"Carpets and other floor coverings, of vegetable textile materials or coarse animal hair, woven, . . .",,,,30,,,,,"3,947",-7,1,971,1000 square meters,"4,065",343,-8,0,0,1000 square meters,,4
570310,"Carpets and other floor coverings, of wool or fine animal hair, tufted ""needle punched"", whether . . .",,,,30,,,,,716,9,0,153,1000 square meters,"4,680",378,72,0,0,1000 square meters,,2
570320,"Carpets and other floor coverings, of nylon or other polyamides, tufted ""needle punched"", whether . . .",7,,0,30,5,1000 square meters,"1,400",,"5,147",6,0,648,1000 square meters,"7,943","31,280",15,1,0,1000 square meters,,43
570330,"Carpets and other floor coverings, of man-made textile materials, tufted ""needle punched"", . . .",144,,1,30,63,1000 square meters,"2,286",,"6,673",-1,0,"1,886",1000 square meters,"3,538","23,756",2,1,0,1000 square meters,,234
570390,"Carpet tiles of vegetable textile materials or coarse animal hair, tufted ""needle punched"", . . .",112,146,1,30,50,1000 square meters,"2,240",,"4,070",2,1,"141,598",1000 square meters,29,"8,103",43,1,0,1000 square meters,,8
570410,"Floor tiles, of felt, not tufted or flocked, with an area of <= 0,3 m²",,,,30,,,,,0,,0,,1000 square meters,,"2,733",12,12,5,1000 square meters,"4,600",11
570420,"Floor tiles, of felt, not tufted or flocked, with an area of > 0,3 m² but <= 1 m²",,,,30,,,,,6,-37,0,0,1000 square meters,,202,152,2,124,1000 square meters,"1,444",
570490,"Carpets and other floor coverings, of felt, not tufted or flocked, whether or not made up (excl. . . .",,,,30,,,,,"3,847",45,1,736,1000 square meters,"5,227",249,0,0,0,1000 square meters,,
570500,"Carpets and other textile floor coverings, whether or not made up (excl. knotted, woven or . . .",38,85,1,30,9,1000 square meters,"4,222",,"4,804",6,0,"63,785",1000 square meters,75,"4,552",15,0,0,1000 square meters,,16
580110,"Woven pile fabrics and chenille fabrics, of wool or fine animal hair (excl. terry towelling . . .",,,,22,,,,,42,-20,0,1,Tons,"42,000",2,-54,0,6,Tons,"107,667",
580121,"Uncut weft pile fabrics, of cotton (excl. terry towelling and similar woven terry fabrics, . . .",,,0,22,,,,,8,59,0,1,,"8,000",,,,2,,"12,500",
580122,"Cut corduroy, of cotton (excl. terry towelling and similar woven terry fabrics, tufted textile . . .",,,0,0,,,,,"4,288",0,1,"1,143",Tons,"3,752",,,,15,Tons,"16,467",
580123,"Cut weft pile fabrics, of cotton (excl. terry towelling and similar woven terry fabrics, tufted . . .",,,,22,,,,,92,10,0,6,,"15,333",66,44,0,0,,,
580126,"Chenille fabrics, of cotton (excl. terry towelling and similar woven terry fabrics, tufted . . .",,,,22,,,,,81,-24,0,14,Tons,"5,786",1,-53,0,1,Tons,"79,000",
580127,"Warp pile fabrics, of cotton (excl. terry towelling and similar woven terry fabrics, tufted . . .",,,,22,,,,,329,-9,0,54,Tons,"6,093",16,-7,0,0,Tons,,
580131,"Uncut weft pile fabrics, of man-made fibres (excl. terry towelling and similar woven terry . . .",,,,22,,,,,187,12,0,44,Tons,"4,250",105,30,0,170,Tons,"8,829",
580132,"Cut corduroy, of man-made fibres (excl. terry towelling and similar woven terry fabrics, tufted . . .",,,,0,,,,,482,0,1,126,,"3,825",2,-61,0,"1,279",,"3,564",15
580133,"Cut weft pile fabrics, of man-made fibres (excl. terry towelling and similar woven terry fabrics, . . .",,,,22,,,,,517,43,0,97,Tons,"5,330",49,20,0,"1,303",Tons,"11,208",4
580136,"Chenille fabrics, of man-made fibres (excl. terry towelling and similar woven terry fabrics, . . .",,,,22,,,,,"1,677",-9,0,212,Tons,"7,910",27,-14,0,0,Tons,,1
580137,"Warp pile fabrics, of man-made fibres (excl. terry towelling and similar woven terry fabrics, . . .",,,,21,,,,,"1,702",-8,0,227,Tons,"7,498",58,-16,0,0,Tons,,5
580190,"Woven pile fabrics and chenille fabrics (excl. those of man-made fibres, wool or fine animal . . .",,,,22,,,,,245,-13,0,52,Tons,"4,712",622,13,2,0,Tons,,-
580211,"Terry towelling and similar woven terry fabrics, of cotton, unbleached (excluding narrow woven . . .",,,,22,,,,,52,20,1,8,Tons,"6,500",5,2,0,3,Tons,"18,667",
580219,"Terry towelling and similar woven terry fabrics, of cotton (excluding unbleached, narrow woven . . .",,,,22,,,,,351,4,0,54,Tons,"6,500",149,27,0,74,Tons,"16,311",
580220,"Terry towelling and similar woven terry fabrics (excl. those of cotton, narrow woven fabrics . . .",,,,22,,,,,311,-3,1,46,Tons,"6,761",43,-13,0,167,Tons,"4,222",1
580230,Tufted textile fabrics (excl. carpets and other floor coverings),,,,22,,,,,5,-31,0,1,Tons,"5,000",4,-52,0,0,Tons,,
580300,Gauze (excl. narrow woven fabrics of heading 5806),,,,0,,,,,"1,238",16,2,167,Tons,"7,413",20,13,0,0,Tons,,
580410,"Tulles and other net fabrics (excl. woven, knitted or crocheted fabrics)",46,-42,23,0,1,Tons,"46,000",,"2,342",-11,0,358,Tons,"6,542",199,-31,0,0,Tons,,-
580421,"Mechanically made lace of man-made fibres in the piece, in strips or in motifs (excl. fabrics . . .",,,,22,,,,,"1,576",20,0,628,Tons,"2,510",110,0,0,"1,610",Tons,"11,871",-
580429,"Mechanically made lace in the piece, in strips or in motifs (excl. that of man-made fibres, . . .",2,-34,3,22,0,Tons,,,"2,198",24,1,697,Tons,"3,154",75,-15,0,144,Tons,"12,049",-
580430,"Handmade lace in the piece, in strips or in motifs (excl. fabrics of heading 6002 to 6006)",,,,0,,,,,169,-6,1,45,Tons,"3,756",51,5,0,59,Tons,"5,542",
580500,"Hand-woven tapestries of the type Gobelin, Flanders, Aubusson, Beauvais and the like, and needle-worked . . .",,,,20,,,,,"1,862",33,7,2,Tons,"931,000",5,-25,0,0,Tons,,
580610,"Narrow woven pile fabrics, incl. terry towelling and similar terry fabrics, and chenille fabrics, . . .",,,,22,,,,,"1,248",18,0,256,Tons,"4,875",187,56,0,0,Tons,,
580620,"Narrow woven fabrics of textile materials, containing >= 5% elastomeric yarn or rubber thread . . .",,,,22,,,,,"1,132",-2,0,207,Tons,"5,469",162,-16,0,405,Tons,"8,770",-
580631,"Narrow woven fabrics of cotton, with a width of <= 30 cm, n.e.s.",,,,22,,,,,345,-3,0,51,Tons,"6,765",33,40,0,209,Tons,"8,560",
580632,"Narrow woven fabrics of man-made fibres, with a width of <= 30 cm, n.e.s.",1,-46,0,22,0,Tons,,,"3,974",-3,0,552,Tons,"7,199",350,-32,0,"2,974",Tons,"4,912",-
580639,"Narrow woven fabrics of textile materials other than cotton or man-made fibres, with a width . . .",,,,22,,,,,"1,577",4,1,336,Tons,"4,693",72,-29,0,0,Tons,,3
580640,"Narrow fabrics consisting of warp without weft assembled by means of an adhesive ""bolducs"", . . .",,,,0,,,,,225,17,0,70,Tons,"3,214",765,129,1,93,Tons,"4,430",
580710,"Labels, badges and similar articles, of textile materials, in the piece, in strips or cut to . . .",,,,25,,,,,"1,506",-3,0,92,Tons,"16,370",874,-25,0,204,Tons,"22,221",5
580790,"Labels, badges and similar articles, of textile materials, in the piece, in strips or cut to . . .",6,57,1,22,5,Tons,"1,200",,202,-17,0,26,Tons,"7,769",511,-6,0,16,Tons,"36,500",-
580810,Braids in the piece,,,,22,,,,,"4,447",-1,2,"2,205",Tons,"2,017",23,35,0,224,Tons,"7,540",
580890,"Ornamental trimmings of textile materials, in the piece, not embroidered, other than knitted . . .",9,68,14,22,0,Tons,,,792,-8,0,170,Tons,"4,659",64,-9,0,275,Tons,"10,178",-
580900,"Woven fabrics of metal thread and woven fabrics of metallised yarn of heading 5605, of a kind . . .",,,,0,,,,,"1,468",101,6,375,Tons,"3,915",38,22,0,0,Tons,,
581010,"Embroidery on a textile fabric ground without visible ground, in the piece, in strips or in . . .",2,-15,18,11,0,Tons,,,170,-40,0,16,Tons,"10,625",11,-22,0,350,Tons,"19,566",-
581091,"Embroidery of cotton on a textile fabric ground, in the piece, in strips or in motifs (excl. . . .",,,,11,,,,,431,-21,0,27,Tons,"15,963",144,29,0,454,Tons,"38,053",4
581092,"Embroidery of man-made fibres on a textile fabric base, in the piece, in strips or in motifs . . .",,,,11,,,,,"2,044",-29,0,156,Tons,"13,103",582,-6,0,"10,495",Tons,"9,543",-
581099,"Embroidery of materials other than cotton or man-made fibres, on a textile fabric base, in . . .",,,,11,,,,,187,-24,0,9,Tons,"20,778",107,-3,0,405,Tons,"8,743",3
581100,"Quilted textile products in the piece, composed of one or more layers of textile materials . . .",,,,13,,,,,680,16,0,69,Tons,"9,855",83,13,0,83,Tons,"5,048",1
590110,"Textile fabrics coated with gum or amylaceous substances, of a kind used for the outer covers . . .",,,,0,,,,,360,2,1,31,Tons,"11,613",63,-39,0,0,Tons,,3
590190,Tracing cloth; prepared painting canvas; buckram and similar stiffened textile fabrics of a . . .,,,,13,,,,,"2,713",10,1,588,Tons,"4,614",69,-9,0,0,Tons,,3
590210,"Tyre cord fabric of high-tenacity yarn of nylon or other polyamides, whether or not dipped . . .",,,0,0,,,,,"10,108",-2,1,"1,234",Tons,"8,191",,,,18,Tons,"8,000",7
590220,"Tyre cord fabric of high-tenacity polyester yarn, whether or not dipped or impregnated with . . .",,,,0,,,,,"19,362",5,1,"4,992",Tons,"3,879",35,-50,0,3,Tons,"3,000",
590290,"Tyre cord fabric of high-tenacity viscose rayon yarn, whether or not dipped in rubber or plastic",,,,0,,,,,"1,501",-18,1,209,Tons,"7,182",1,-33,0,0,Tons,,
590310,"Textile fabrics impregnated, coated, covered or laminated with poly""vinyl chloride"" (excl. . . .",7,-36,2,9,1,Tons,"7,000",,"12,638",2,0,"2,969",Tons,"4,257",361,-22,0,0,Tons,,50
590320,"Textile fabrics impregnated, coated, covered or laminated with polyurethane (excl. wallcoverings . . .",,,,9,,,,,"24,298",2,0,"5,054",Tons,"4,808",161,39,0,0,Tons,,99
590390,"Textile fabrics impregnated, coated, covered or laminated with plastics other than poly""vinyl . . .",,,,13,,,,,"12,899",9,0,"3,736",Tons,"3,453",486,14,0,0,Tons,,20
590410,"Linoleum, whether or not cut to shape",,,,10,,,,,142,-13,0,15,1000 square meters,"9,467",122,25,0,13,1000 square meters,"4,538",
590490,"Floor coverings consisting of a coating or covering applied on a textile backing, whether or . . .",,,,20,,,,,17,3,0,7,1000 square meters,"2,429",158,89,0,0,1000 square meters,,
590500,Textile wallcoverings,1,,2,7,0,1000 square meters,,,158,8,0,10,1000 square meters,"15,800",59,-28,0,0,1000 square meters,,1
590610,"Adhesive tape of rubberised textile fabrics, of a width of <= 20 cm (excl. that impregnated . . .",,,,11,,,,,"2,374",10,0,302,Tons,"7,861",529,8,0,791,Tons,"6,424",15
590691,"Knitted or crocheted textile fabrics, rubberised, n.e.s.",,,,19,,,,,590,-9,0,74,Tons,"7,973",25,19,0,24,Tons,"8,542",
590699,"Rubberised textile fabrics (excl. knitted or crocheted textile fabrics, adhesive tape of a . . .",,,,19,,,,,"12,613",-3,2,"3,871",Tons,"3,258",22,-13,0,0,Tons,,6
590700,"Impregnated, coated or covered textile fabrics; painted canvas being theatrical scenery, studio . . .",1,-2,0,9,0,Tons,,,"2,522",-9,0,368,Tons,"6,853","8,678",53,1,"3,389",Tons,"5,854",59
590800,"Textile wicks, woven, plaited or knitted, for lamps, stoves, lighters, candles or the like; . . .",,,,16,,,,,210,3,0,15,Tons,"14,000",6,-16,0,28,Tons,"5,750",
590900,"Textile hosepiping and similar textile tubing, whether or not impregnated or coated, with or . . .",,,,15,,,,,312,-8,0,41,Tons,"7,610",406,1,0,"1,134",Tons,"5,072",8
591000,"Transmission or conveyor belts or belting, of textile material, whether or not impregnated, . . .",,,,13,,,,,"12,826",35,2,"1,916",Tons,"6,694",43,32,0,548,Tons,"9,432",7
591110,"Textile fabrics, felt and felt-lined woven fabrics, coated, covered or laminated with rubber, . . .",,,,16,,,,,"4,117",9,1,336,Tons,"12,253",104,-14,0,0,Tons,,11
591120,"Bolting cloth, whether or not made up",,,,0,,,,,"1,119",7,0,52,Tons,"21,519",37,-8,0,99,Tons,"19,232",2
591131,"Textile fabrics and felts, endless or fitted with linking devices, of a kind used in papermaking . . .",,,,0,,,,,"2,374",-6,1,46,Tons,"51,609",6,-60,0,36,Tons,"21,250",6
591132,"Textile fabrics and felts, endless or fitted with linking devices, of a kind used in papermaking . . .",,,,0,,,,,"12,512",-2,1,229,Tons,"54,638",3,-10,0,0,Tons,,11
591140,"Filtering or straining cloth of a kind used in oil-presses or for similar technical purposes, . . .",,,,0,,,,,"3,366",50,1,231,Tons,"14,571",3,-26,0,269,Tons,"12,409",
591190,"Textile products and articles, for technical purposes, specified in Note 7 to chapter 59, n.e.s.",,,,10,,,,,"19,941",-5,1,"1,510",Tons,"13,206","1,251",7,0,"1,720",Tons,"14,205",-
600110,"""Long pile"" fabrics, knitted or crocheted",,,,22,,,,,"16,008",11,3,"5,390",Tons,"2,970",100,135,0,200,Tons,"7,790",17
600121,"Looped pile fabrics of cotton, knitted or crocheted",,,,22,,,,,208,-28,0,37,Tons,"5,622",15,-43,0,20,Tons,"21,850",
600122,"Looped pile fabrics of man-made fibres, knitted or crocheted",,,0,22,,,,,"4,955",13,1,"1,247",Tons,"3,974",,,,34,Tons,"4,941",
600129,"Looped pile fabrics, knitted or crocheted (excl. of cotton or man-made fibres)",,,,22,,,,,242,70,0,101,Tons,"2,396",3,-45,0,3,Tons,"9,333",2
600191,"Pile fabrics of cotton, knitted or crocheted (excl. ""long pile"" fabrics)",,,0,22,,,,,"1,940",18,0,285,Tons,"6,807",,,,181,Tons,"11,608",
600192,"Pile fabrics of man-made fibres, knitted or crocheted (excl. ""long pile"" fabrics)",,,,22,,,,,"25,246",5,1,"8,066",Tons,"3,130",516,0,0,0,Tons,,74
600199,"Pile fabrics, knitted or crocheted (excl. cotton or man-made fibres and ""long pile"" fabrics)",,,,22,,,,,327,4,0,70,Tons,"4,671",85,6,0,67,Tons,"2,612",7
600240,"Knitted or crocheted fabrics, of a width of <= 30 cm, containing >= 5% by weight elastomeric . . .",,,,22,,,,,138,-31,0,66,Tons,"2,091",163,-30,0,32,Tons,"7,625",
600290,"Knitted or crocheted fabrics, of a width of <= 30 cm, containing >= 5% by weight elastomeric . . .",,,,22,,,,,790,-7,0,202,Tons,"3,911",30,-25,0,151,Tons,"4,821",
600320,"Knitted or crocheted fabrics of cotton, of a width of <= 30 cm (excl. those containing by weight . . .",,,,22,,,,,762,9,1,110,Tons,"6,927",1,-2,0,6,Tons,"10,667",
600330,"Knitted or crocheted fabrics of synthetic fibres, of a width of <= 30 cm (excl. those containing . . .",,,0,22,,,,,942,-12,0,218,Tons,"4,321",,,,207,Tons,"12,623",
