760691,"Plates, sheets and strip, of non-alloy aluminium, of a thickness of > 0,2 mm (other than square . . .",,,,0,,,,,"12,936",-13,1,"2,212",Tons,"5,848","2,660",-16,0,"1,641",Tons,"3,768",106
760692,"Plates, sheets and strip, of aluminium alloys, of a thickness of > 0,2 mm (other than square . . .",,,,0,,,,,"75,031",-10,3,"19,451",Tons,"3,857","26,166",24,1,"5,093",Tons,"3,855",770
760711,"Aluminium foil, not backed, rolled but not further worked, of a thickness of <= 0,2 mm (excl. . . .",3,,0,0,0,Tons,,,"8,453",-7,0,"1,929",Tons,"4,382","21,518",7,0,"62,619",Tons,"3,947",52
760719,"Aluminium foil, not backed, rolled and further worked, of a thickness of <= 2 mm (excl. stamping . . .",,,,0,,,,,"13,266",1,0,"2,709",Tons,"4,897","16,150",21,0,"7,523",Tons,"4,277",4
760720,"Aluminium foil, backed, of a thickness (excl. any backing) of <= 0,2 mm (excl. stamping foils . . .",33,19,0,0,25,Tons,"1,320",,"21,311",-5,0,"4,812",Tons,"4,429","22,079",16,1,"17,026",Tons,"3,844",135
760810,Tubes and pipes of non-alloy aluminium (excl. hollow profiles),,,,5,,,,,"3,991",-5,1,"1,119",Tons,"3,567",156,-11,0,524,Tons,"5,842",41
760820,Tubes and pipes of aluminium alloys (excl. hollow profiles),,,,0,,,,,"13,881",2,1,"3,207",Tons,"4,328","8,239",29,0,"1,225",Tons,"6,042",19
760900,"Aluminium tube or pipe fittings ""e.g., couplings, elbows, sleeves""",4,231,0,5,1,Tons,"4,000",,"4,313",5,0,301,Tons,"14,329",859,-7,0,536,Tons,"9,597",9
761010,"Doors, windows and their frames and thresholds for door, of aluminium (excl. door furniture)",,,,10,,,,,"12,697",3,0,"3,540",Tons,"3,587","17,366",-14,0,0,Tons,,148
761090,"Structures and parts of structures, of aluminium, n.e.s., and plates, rods, profiles, tubes . . .",247,146,0,10,83,Tons,"2,976",,"28,034",12,0,"6,479",Tons,"4,327","71,788",8,1,"9,326",Tons,"6,882",18
761100,"Reservoirs, tanks, vats and similar containers, of aluminium, for any material (other than . . .",,,,0,,,,,"1,200",77,1,72,Tons,"16,667",84,-9,0,0,Tons,,-
761210,"Collapsible tubular containers, of aluminium",,,,10,,,,,"3,339",-1,1,303,Tons,"11,020",74,-24,0,0,Tons,,7
761290,"Casks, drums, cans, boxes and similar containers, incl. rigid tubular containers, of aluminium, . . .",779,501,1,5,129,Tons,"6,039",,"19,722",14,0,"2,484",Tons,"7,940","107,152",48,2,0,Tons,,343
761300,Aluminium containers for compressed or liquefied gas,30,-4,2,0,5,Tons,"6,000",,"1,494",3,0,99,Tons,"15,091","1,856",45,0,0,Tons,,-
761410,"Stranded wire, cables, plaited bands and the like, of aluminium, with steel core (excl. such . . .",,,,10,,,,,"1,358",36,0,418,Tons,"3,249","1,402",127,0,99,Tons,"5,040",16
761490,"Stranded wires, cables, ropes and similar articles, of aluminium (other than with steel core . . .",,,,10,,,,,726,-16,0,159,Tons,"4,566","7,836",281,1,422,Tons,"3,429",1
761510,"Table, kitchen or other household articles and parts thereof, and pot scourers and scouring . . .",5,8,0,23,1,Tons,"5,000",,"17,299",18,0,"3,391",Tons,"5,101","14,234",8,0,"17,581",Tons,"5,772",144
761520,"Sanitary ware and parts thereof, of aluminium (excl. cans, boxes and similar containers of . . .",,,,20,,,,,271,34,0,135,Tons,"2,007",233,-11,0,121,Tons,"12,860",1
761610,"Nails, tacks, staples, screws, bolts, nuts, screw hooks, rivets, cotters, cotter pins, washers . . .",,,,0,,,,,"2,239",-9,0,454,Tons,"4,932",276,-15,0,420,Tons,"13,160",5
761691,"Cloth, grill, netting and fencing, of aluminium wire (excl. cloth of metal fibres for clothing, . . .",,,,0,,,,,232,2,0,28,Tons,"8,286",681,64,0,391,Tons,"8,969",-
761699,"Articles of aluminium, n.e.s.",9,-52,0,9,1,Tons,"9,000",,"27,141",-3,0,"5,332",Tons,"5,090","9,149",-4,0,"18,129",Tons,"5,260",86
780110,"Unwrought lead, refined",,,,0,,,,,"19,585",-2,0,"8,007",Tons,"2,446","50,343",-11,1,"18,257",Tons,"1,886",188
780191,"Unwrought lead, containing by weight antimony as the principal other element",,,,0,,,,,3,-42,0,0,Tons,,"11,952",-14,1,"6,357",Tons,"2,300",14
780199,Unwrought lead (excl. refined lead and lead containing by weight antimony as the principal . . .,,,,0,,,,,"2,536",189,0,834,Tons,"3,041","74,730",16,4,"5,806",Tons,"2,483",-
780200,"Lead waste and scrap (excl. ashes and residues from lead production ""heading No 2620"", and . . .",,,,0,,,,,110,-55,0,159,Tons,692,"6,567",-13,1,"3,941",Tons,"1,386",
780411,"Lead sheets, strip and foil, of a thickness ""excl. any backing"" of <= 0,2 mm",,,,0,,,,,61,14,0,21,Tons,"2,905",25,292,0,378,Tons,"2,614",
780419,"Lead plates; lead sheets, strip and foil, of a thickness ""excl. any backing"" of > 0,2 mm",,,,0,,,,,"1,436",51,0,245,Tons,"5,861","3,649",-1,1,"1,756",Tons,"1,984",20
780600,"Articles of lead, n.e.s.",34,,6,0,4,Tons,"8,500",,"2,155",12,1,373,Tons,"5,777",598,63,0,"2,411",Tons,"1,169",7
790111,"Unwrought zinc, not alloyed, containing by weight >= 99,99% of zinc",,,,0,,,,,"164,018",28,1,"56,911",Tons,"2,882","15,205",-11,0,"61,859",Tons,"3,708",812
790112,"Unwrought zinc, not alloyed, containing by weight < 99,99% of zinc",,,,0,,,,,"65,009",-1,2,"18,559",Tons,"3,503","108,690",25,3,"5,968",Tons,"3,824",614
790120,Unwrought zinc alloys,,,,0,,,,,"5,442",-30,0,"1,638",Tons,"3,322",657,-14,0,"3,041",Tons,"3,839",5
790200,"Zinc waste and scrap (excl. ash and residues from zinc production ""heading 2620"", ingots and . . .",,,,0,,,,,306,36,0,140,Tons,"2,186","19,827",-15,2,"1,250",Tons,"1,548",2
790310,Zinc dust,,,,0,,,,,529,8,0,142,Tons,"3,725","3,515",40,1,959,Tons,"3,436",-
790390,"Zinc powders and flakes (excl. grains of zinc, and spangles of heading 8308, and zinc dust)",,,,0,,,,,50,36,0,27,Tons,"1,852","1,497",17,1,58,Tons,"5,259",1
790400,"Zinc bars, rods, profiles and wire, n.e.s.",,,,0,,,,,710,-65,0,165,Tons,"4,303",541,136,0,"1,055",Tons,"4,051",8
790500,"Zinc plates, sheets, strip and foil",,,,0,,,,,755,-15,0,171,Tons,"4,415",65,-30,0,1,Tons,"12,000",3
790700,"Articles of zinc, n.e.s.",,,,0,,,,,"2,070",-2,0,437,Tons,"4,737",748,2,0,0,Tons,,283
800110,"Unwrought tin, not alloyed",,,0,0,,,,,"14,266",3,0,457,Tons,"31,217",,,,790,Tons,"25,222",13
800120,Unwrought tin alloys,,,,0,,,,,47,46,0,1,Tons,"47,000","12,625",1,3,249,Tons,"15,124",3
800200,"Tin waste and scrap (excl. ash and residues from the manufacture of tin of heading 2620, and . . .",,,,0,,,,,1,-72,0,0,,,965,84,1,187,,"11,877",
800300,"Tin bars, rods, profiles and wire, n.e.s.",,,,0,,,,,431,-14,0,13,Tons,"33,154",40,-32,0,138,Tons,"35,783",1
800700,"Articles of tin, n.e.s.",,,,0,,,,,581,-15,0,65,Tons,"8,938",76,-12,0,0,Tons,,53
810110,Tungsten powders,,,,0,,,,,"5,494",23,2,112,Tons,"49,054",8,136,0,1,Tons,"121,000",
810194,"Unwrought tungsten, incl. bars and rods of tungsten obtained simply by sintering",,,,0,,,,,18,-26,0,0,Tons,,6,69,0,0,Tons,,
810196,Tungsten wire,,,,0,,,,,649,0,0,8,,"81,125",7,21,0,2,,"81,000",
810197,Tungsten waste and scrap (excl. ash and residues containing tungsten),,,,0,,,,,766,85,0,68,Tons,"11,265","1,900",160,0,3,Tons,"1,000",
810199,"Articles of tungsten, n.e.s.",,,,0,,,,,366,-33,0,5,Tons,"73,200",28,-63,0,7,Tons,"88,571",1
810210,Molybdenum powders,,,0,0,,,,,269,313,0,5,,"53,800",,,,0,,,
810294,"Unwrought molybdenum, incl. bars and rods obtained simply by sintering",,,,0,,,,,3,-46,0,0,,,16,,0,5,,"44,200",
810295,"Molybdenum bars and rods (other than those obtained simply by sintering), profiles, plates, . . .",,,0,0,,,,,"2,295",121,1,113,,"20,310",,,,6,,"90,000",
810296,Molybdenum wire,,,,0,,,,,173,56,0,1,,"173,000",3,,0,0,,,
810297,Molybdenum waste and scrap (excl. ash and residues containing molybdenum),,,,0,,,,,"6,822",24,2,282,,"24,191",14,,0,43,,"43,837",
810299,"Articles of molybdenum, n.e.s.",,,,0,,,,,"1,631",-16,1,7,,"233,000",203,,0,2,,"143,000",
810320,"Unwrought tantalum, incl. bars and rods of tantalum obtained simply by sintering; tantalum . . .",,,0,0,,,,,10,79,0,0,,,,,,7,,"431,571",
810390,"Articles of tantalum, n.e.s.",,,0,0,,,,,"1,746",57,0,3,Tons,"582,000",,,,1,Tons,"162,000",
810411,"Unwrought magnesium, containing >= 99,8% by weight of magnesium",,,0,0,,,,,"29,719",24,2,"5,319",Tons,"5,587",,,,"14,031",Tons,"5,586",
810419,"Unwrought magnesium, containing < 99,8% by weight of magnesium",,,0,0,,,,,12,-9,0,2,Tons,"6,000",,,,840,Tons,"2,364",
810420,"Magnesium waste and scrap (excl. ash and residues containing magnesium, and raspings, turnings . . .",,,,0,,,,,0,,0,,Tons,,"2,991",156,1,"8,061",Tons,495,
810430,"Magnesium raspings, turnings and granules, graded according to size; magnesium powders",,,0,0,,,,,"18,204",20,3,"2,725",Tons,"6,680",,,,87,Tons,"6,402",
810490,"Articles of magnesium, n.e.s.",,,,0,,,,,960,25,0,89,Tons,"10,787",288,22,0,21,Tons,"17,952",1
810520,Cobalt mattes and other intermediate products of cobalt metallurgy; unwrought cobalt; cobalt . . .,,,,0,,,,,182,-26,0,2,Tons,"91,000","3,846",247,0,209,Tons,"33,062",
810530,Cobalt waste and scrap (excl. ash and residues containing cobalt),,,,0,,,,,0,,0,,Tons,,270,2,0,2,Tons,"10,500",
810590,"Articles of cobalt, n.e.s.",,,,0,,,,,554,15,0,5,Tons,"110,800",67,-17,0,"2,914",Tons,"8,743",1
810600,"Bismuth and articles thereof, n.e.s.; bismuth waste and scrap (excluding ash and residues containing . . .",,,,0,,,,,48,-7,0,1,,"48,000",2,,0,0,,,
810720,Unwrought cadmium; cadmium powders,,,,0,,,,,2,24,0,0,,,"2,208",63,4,1,,"10,000",
810820,Unwrought titanium; titanium powders,,,,0,,,,,477,27,0,28,Tons,"17,036",133,126,0,4,Tons,"66,000",
810830,Titanium waste and scrap (excl. ash and residues containing titanium),,,,0,,,,,"3,253",9,1,469,Tons,"6,936",708,3,0,,Tons,,11
810890,"Articles of titanium, n.e.s.",9,,1,0,0,Tons,,,"13,647",9,0,298,Tons,"45,795","1,658",32,0,0,Tons,,-
810920,Unwrought zirconium; zirconium powders,,,,0,,,,,10,-32,0,0,Tons,,11,,0,,Tons,,
810990,"Articles of zirconium, n.e.s.",,,,0,,,,,244,-3,0,92,Tons,"2,652",14,,0,1,Tons,"103,000",
811010,Unwrought antimony; antimony powders,,,0,0,,,,,"1,343",47,0,96,Tons,"13,990",,,,11,Tons,"11,909",2
811020,Antimony waste and scrap (excl. ash and residues containing antimony),,,0,,,,,,147,-14,22,11,,"13,364",,,,,,,
811100,"Manganese and articles thereof, n.e.s.; manganese waste and scrap (excl. ash and residues containing . . .",,,,0,,,,,"7,276",47,0,"1,972",Tons,"3,690",455,43,0,498,Tons,"4,669",
811219,"Articles of beryllium, n.e.s.",,,,,,,,,0,,0,,,,1,-41,0,0,,,
811221,Unwrought chromium; chromium powders,,,0,0,,,,,689,-18,0,41,,"16,805",,,,43,,"11,837",-
811229,"Articles of chromium, n.e.s.",46,,100,0,3,Tons,"15,333",,435,-28,0,39,Tons,"11,154",46,,0,1,Tons,"277,000",
811292,"Unwrought niobium ""columbium"", gallium, indium, vanadium and germanium; powders and waste and . . .",,,0,0,,,,,607,-48,0,21,Tons,"28,905",,,,0,Tons,,
811299,"Articles of niobium ""columbium"", gallium, indium, vanadium and germanium, n.e.s.",,,,0,,,,,595,-31,0,1,,"595,000",436,,0,3,,"20,667",
811300,"Cermets and articles thereof, n.e.s.; waste and scrap of cermets (excl. ash and residues containing . . .",,,,0,,,,,"3,303",35,0,36,Tons,"91,750",200,50,0,38,Tons,"81,158",
820110,"Spades and shovels, with working parts of base metal",,,,13,,,,,889,9,0,587,Tons,"1,514",168,-38,0,0,Tons,,5
820130,"Mattocks, picks, hoes and rakes, with working parts of base metal (excl. ice axes)",,,,15,,,,,855,3,0,533,Tons,"1,604","1,883",5,0,0,Tons,,3
820140,"Axes, billhooks and similar hewing tools, with working parts of base metal (excl. ice axes)",,,,10,,,,,"1,264",-5,0,587,Tons,"2,153",84,-51,0,0,Tons,,7
820150,"Secateurs and similar one-handed pruners and shears, incl. poultry shears, with working parts . . .",,,,0,,,,,"2,766",12,1,174,Tons,"15,897",5,-63,0,0,Tons,,4
820160,"Hedge shears, two-handed pruning shears and similar two-handed shears, with working parts of . . .",,,,0,,,,,"1,739",8,1,435,Tons,"3,998",13,-14,0,0,Tons,,3
820190,"Scythes, sickles, hay knives, timber wedges and other hand tools of a kind used in agriculture, . . .",,,,12,,,,,"1,549",7,0,650,Tons,"2,383",311,-40,0,0,Tons,,2
820210,"Handsaws, with working parts of base metal (excl. power-operated saws)",,,,0,,,,,"2,192",1,1,542,Tons,"4,044",474,17,0,0,Tons,,5
820220,Bandsaw blades of base metal,,,,10,,,,,"8,452",5,1,602,Tons,"14,040",218,-5,0,0,Tons,,12
820231,"Circular saw blades, incl. slitting or slotting saw blades, of base metal, with working parts . . .",,,,0,,,,,"3,228",5,0,276,Tons,"11,696",108,-26,0,0,Tons,,6
820239,"Circular saw blades, incl. slitting or slotting saw blades, and parts thereof, of base metal, . . .",,,,10,,,,,"6,592",8,1,937,Tons,"7,035","11,778",234,1,0,Tons,,23
820240,Chainsaw blades of base metal,,,,0,,,,,"4,369",3,1,216,Tons,"20,227",10,27,0,43,Tons,"19,930",7
820291,"Straight saw blades, of base metal, for working metal",,,,20,,,,,421,5,0,54,Tons,"7,796",9,-31,0,0,Tons,,2
820299,"Saw blades, incl. toothless saw blades, of base metal (excl. bandsaw blades, circular saw blades, . . .",,,,0,,,,,"4,788",-6,0,626,Tons,"7,649",263,2,0,0,Tons,,25
820310,"Files, rasps and similar hand tools of base metal",,,,15,,,,,"1,461",2,0,299,Tons,"4,886",60,9,0,0,Tons,,4
820320,"Pliers, incl. cutting pliers, pincers and tweezers for non-medical use and similar hand tools, . . .",1,11,0,16,0,Tons,,,"9,816",-1,0,"1,304",Tons,"7,528",532,21,0,0,Tons,,15
820330,"Metal-cutting shears and similar hand tools, of base metal",,,,0,,,,,716,2,0,94,Tons,"7,617",55,-19,0,0,Tons,,-
820340,"Pipe-cutters, bolt croppers, perforating punches and similar hand tools, of base metal",,,,0,,,,,"1,444",-2,0,228,Tons,"6,333",130,-10,0,0,Tons,,8
820411,"Hand-operated spanners and wrenches, incl. torque meter wrenches, of base metal, non-adjustable",,,,13,,,,,"12,186",2,1,"2,166",Tons,"5,626",413,-2,0,0,Tons,,29
820412,"Hand-operated spanners and wrenches, incl. torque meter wrenches, of base metal, adjustable . . .",,,,13,,,,,"4,154",-1,1,798,Tons,"5,206",282,3,0,0,Tons,,14
820420,"Interchangeable spanner sockets, with or without handles, of base metal",,,,10,,,,,"6,617",0,0,"1,204",Tons,"5,496",260,11,0,0,Tons,,20
820510,"Hand-operated drilling, threading or tapping hand tools",,,,0,,,,,638,-5,0,132,Tons,"4,833","1,599",38,1,0,Tons,,10
820520,Hammers and sledge hammers with working parts of base metal,,,,10,,,,,"3,706",-6,1,"1,587",Tons,"2,335",167,4,0,0,Tons,,20
820530,"Planes, chisels, gouges and similar cutting tools for working wood",,,,0,,,,,973,2,1,210,Tons,"4,633",100,-4,0,0,Tons,,12
820540,Hand-operated screwdrivers,4,96,5,15,0,Tons,,,"4,204",1,0,842,Tons,"4,993",77,-22,0,0,Tons,,25
820551,"Household hand tools, non-mechanical, with working parts of base metal, n.e.s.",,,,0,,,,,"5,666",2,0,"1,066",Tons,"5,315",171,2,0,0,Tons,,20
820559,"Hand tools, incl. glaziers' diamonds, of base metal, n.e.s.",1,-38,0,10,0,Tons,,,"21,213",-4,1,"3,176",Tons,"6,679","1,905",15,0,0,Tons,,129
820560,Blowlamps and the like (excl. gas-powered blowlamps),,,,0,,,,,606,3,0,57,Tons,"10,632",4,-34,0,0,Tons,,
820570,"Vices, clamps and the like (excl. accessories for and parts of machine tools or water-jet cutting . . .",,,,15,,,,,"4,745",0,1,828,Tons,"5,731",476,3,0,0,Tons,,9
820590,Anvils; portable forges; hand- or pedal-operated grinding wheels with frameworks; sets of articles . . .,,,,0,,,,,"1,197",3,0,146,Tons,"8,199",626,-3,0,0,Tons,,32
820600,"Sets of two or more tools of heading 8202 to 8205, put up in sets for retail sale",11,136,2,20,0,Tons,,,"11,233",0,1,"2,190",Tons,"5,129",641,-26,0,0,Tons,,28
820713,"Rock-drilling or earth-boring tools, interchangeable, with working parts of sintered metal . . .",,,,8,,,,,"46,005",-1,6,"1,863",Tons,"24,694",592,-1,0,0,Tons,,330
820719,"Rock-drilling or earth-boring tools, interchangeable, and parts therefor, with working parts . . .",1,-71,0,8,0,Tons,,,"46,659",11,2,"3,540",Tons,"13,181","18,720",9,1,0,Tons,,"1,382"
820720,Interchangeable dies for drawing or extruding metal,,,,0,,,,,"3,316",-2,0,166,Tons,"19,976","1,128",-15,0,0,Tons,,-
820730,"Interchangeable tools for pressing, stamping or punching",,,,0,,,,,"78,872",51,1,"9,326",Tons,"8,457",338,1,0,0,Tons,,4
820740,"Tools for tapping or threading, interchangeable",6,,2,10,0,Tons,,,"3,489",1,0,144,Tons,"24,229",312,16,0,0,Tons,,2
820750,"Tools for drilling, interchangeable (excl. rock-drilling or earth-boring tools and tools for . . .",,,,20,,,,,"16,427",3,0,"1,036",Tons,"15,856",908,-2,0,0,Tons,,44
820760,Interchangeable tools for boring or broaching,,,,10,,,,,"2,853",-1,1,207,Tons,"13,783",133,-8,0,0,Tons,,3
820770,Interchangeable tools for milling,,,,10,,,,,"9,915",9,0,203,Tons,"48,842","2,022",31,0,0,Tons,,12
820780,Interchangeable tools for turning,,,,10,,,,,"3,862",1,1,74,Tons,"52,189",133,3,0,0,Tons,,-
820790,"Interchangeable tools for hand tools, whether or not power-operated, or for machine tools, . . .",71,1,1,0,1,Tons,"71,000",,"15,454",-6,0,"1,157",Tons,"13,357","5,892",1,0,0,Tons,,9
820810,"Knives and cutting blades, of base metal, for machines or for mechanical appliances, for m . . .",4,,3,0,0,Tons,,,"1,727",-11,0,134,Tons,"12,888",144,-26,0,0,Tons,,5
820820,"Knives and cutting blades, of base metal, for machines or for mechanical appliances, for w . . .",,,,0,,,,,"1,820",6,0,102,Tons,"17,843",23,-12,0,0,Tons,,
820830,"Knives and cutting blades, of base metal, for kitchen appliances or for machines used by the . . .",,,,0,,,,,"3,203",1,1,92,Tons,"34,815",53,-35,0,0,Tons,,17
820840,"Knives and cutting blades, of base metal, for agricultural, horticultural or forestry machines . . .",,,,10,,,,,"3,769",8,1,444,Tons,"8,489",85,213,0,0,Tons,,
820890,"Knives and cutting blades, of base metal, for machines or for mechanical appliances (excl. . . .",,,,0,,,,,"10,950",2,1,547,Tons,"20,018",744,-2,0,0,Tons,,-
820900,"Plates, sticks, tips and the like for tools, unmounted, of sintered metal carbides or cermets",16,-1,4,12,0,Tons,,,"36,702",-6,1,228,Tons,"160,974",397,2,0,0,Tons,,1
821000,"Hand-operated mechanical devices, of base metal, weighing <= 10 kg, used in the preparation, . . .",1,3,1,20,0,Tons,,,"3,708",1,1,843,Tons,"4,399",126,-2,0,0,Tons,,5
821110,Sets of assorted articles of knives of heading 8211; sets in which there is a higher number . . .,,,,11,,,,,"2,624",-2,0,"1,432,860",Units,2,38,6,0,0,Units,,6
821191,"Table knives having fixed blades of base metal, incl. handles (excl. butter knives and fish . . .",,,,15,,,,,"3,186",11,1,"3,936,433",Units,1,604,33,0,0,Units,,8
821192,"Knives with fixed blades of base metal (excl. straw knives, machetes, knives and cutting blades . . .",,,,9,,,,,"9,369",2,1,"9,724,656",Units,1,407,55,0,0,Units,,17
821193,"Knives having other than fixed blades, incl. pruning knives, of base metal (excl. razors)",,,,9,,,,,"3,662",0,0,"1,783,852",Units,2,117,-14,0,0,Units,,-
821194,"Blades of base metal for table knives, pocket knives and other knives of heading 8211",,,,18,,,,,972,3,0,115,Tons,"8,452",71,-9,0,0,Tons,,1
821195,"Handles of base metal for table knives, pocket knives and other knives of heading 8211",,,,18,,,,,64,17,0,75,Tons,853,22,-9,0,0,Tons,,
821210,Non-electric razors of base metal,1,-85,0,0,342,Units,3,,"13,351",-1,1,"58,427,675",Units,0,"5,469",18,0,0,Units,,472
821220,"Safety razor blades of base metal, incl. razor blade blanks in strips",45,-41,2,0,"237,315",Units,0,,"10,917",-13,1,"16,841,991",Units,1,"2,496",7,0,0,Units,,303
821290,Parts of non-electric razors of base metal (excl. safety razor blades and razor blade blanks . . .,,,,0,,,,,124,47,0,4,Tons,"31,000",118,35,0,0,Tons,,-
821300,"Scissors, tailors' shears and similar shears, and blades therefor, of base metal (excl. hedge . . .",,,,0,,,,,"5,325",-2,1,"1,064",Tons,"5,005",388,25,0,0,Tons,,5
821410,"Paperknives, letter openers, erasing knives, pencil sharpeners and blades therefor, of base . . .",,,,15,,,,,"1,643",-5,1,355,Tons,"4,628",15,-24,0,0,Tons,,4
821420,"Manicure or pedicure sets and instruments, incl. nail files, of base metal (excl. ordinary . . .",2,41,2,20,0,Tons,,,"3,313",3,1,996,Tons,"3,326",117,-4,0,0,Tons,,10
821490,"Hair clippers, butchers' or kitchen cleavers and other articles of cutlery of base metal, n.e.s.",,,,5,,,,,"1,268",40,1,202,Tons,"6,277",56,-28,0,0,Tons,,3
821510,"Sets of spoons, forks or other articles of heading 8215, which may also contain up to an equivalent . . .",,,,30,,,,,128,-27,0,23,Tons,"5,565",33,1,0,0,Tons,,18
821520,"Sets consisting of one or more knives of heading 8211 and at least an equal number of spoons, . . .",,,,30,,,,,"4,174",-6,0,"1,092",Tons,"3,822",205,-1,0,0,Tons,,30
821591,"Spoons, forks, ladles, skimmers, cake-servers, fish-knives, butter-knives, sugar tongs and . . .",,,,30,,,,,69,-18,0,11,Tons,"6,273",9,21,0,0,Tons,,-
821599,"Spoons, forks, ladles, skimmers, cake-servers, fish-knives, butter-knives, sugar tongs and . . .",,,,30,,,,,"7,153",-2,0,"2,613",Tons,"2,737",512,0,0,0,Tons,,17
830110,Padlocks of base metal,,,,20,,,,,"15,080",0,1,"5,110",Tons,"2,951",241,11,0,0,Tons,,68
830120,"Locks used for motor vehicles, of base metal",10,111,2,20,1,Tons,"10,000",,"12,200",-3,0,"1,067",Tons,"11,434",480,-6,0,0,Tons,,16
830130,"Locks used for furniture, of base metal",,,,20,,,,,"1,891",-5,0,229,Tons,"8,258",319,15,0,"1,461",Tons,"7,283",28
830140,Locks of base metal (excl. padlocks and locks for motor vehicles or furniture),10,-10,0,20,1,Tons,"10,000",,"26,862",1,1,"6,274",Tons,"4,281","2,441",14,0,0,Tons,,43
830150,"Clasps and frames with clasps, incorporating locks, of base metal",,,,20,,,,,148,-6,0,47,Tons,"3,149",53,-36,0,206,Tons,"7,345",1
830160,"Parts of padlocks, locks, clasps and frames with clasps, incorporating locks, of base metal, . . .",7,17,1,20,0,Tons,,,"8,112",-2,0,708,Tons,"11,458",789,30,0,"4,403",Tons,"7,662",8
830170,"Keys presented separately for padlocks, locks, clasps and frames with clasps incorporating . . .",18,94,5,20,0,Tons,,,"3,501",-7,1,155,Tons,"22,587",335,16,0,133,Tons,"12,541",-
830210,"Hinges of all kinds, of base metal",5,2,0,20,0,Tons,,,"19,738",2,0,"5,272",Tons,"3,744","1,372",7,0,0,Tons,,45
830220,Castors with mountings of base metal,2,105,2,20,0,Tons,,,"2,355",4,0,972,Tons,"2,423",102,-16,0,0,Tons,,1
830230,"Base metal mountings, fittings and similar articles suitable for motor vehicles (excl. hinges . . .",19,5,2,13,3,Tons,"6,333",,"28,332",6,0,"3,922",Tons,"7,224","1,141",13,0,"3,552",Tons,"25,302",256
830241,Base metal mountings and fittings suitable for buildings (excl. locks with keys and hinges),4,-29,0,13,0,Tons,,,"40,507",4,0,"10,500",Tons,"3,858","3,578",6,0,"15,671",Tons,"7,629",126
830242,"Base metal mountings, fittings and similar articles suitable for furniture (excl. locks with . . .",,,,13,,,,,"25,757",4,0,"6,412",Tons,"4,017","1,541",34,0,"14,642",Tons,"5,914",28
830249,"Base metal mountings, fittings and similar articles (excl. locks with keys, clasps and frames . . .",2,-12,0,20,0,Tons,,,"11,035",0,0,"2,989",Tons,"3,692","2,212",-9,0,"2,273",Tons,"20,993",36
830250,"Hat-racks, hat-pegs, brackets and similar fixtures of base metal",4,70,0,20,0,Tons,,,"12,621",0,0,"2,987",Tons,"4,225","1,343",8,0,0,Tons,,20
830260,Automatic door closers of base metal,,,,20,,,,,"3,586",-7,0,361,Tons,"9,934",474,8,0,0,Tons,,32
830300,"Armoured or reinforced safes, strongboxes and doors and safe deposit lockers for strongrooms, . . .",,,,18,,,,,"4,458",6,0,"1,225",Tons,"3,639",394,-12,0,0,Tons,,7
830400,"Filing cabinets, card-index cabinets, paper trays, paper rests, pen trays, office-stamp stands . . .",,,,20,,,,,308,-8,0,136,Tons,"2,265",631,-5,0,0,Tons,,2
830510,"Fittings for loose-leaf binders or files, of base metal (excl. drawing pins and clasps for . . .",,,,20,,,,,"2,504",2,1,893,Tons,"2,804",9,-4,0,196,Tons,"6,122",
830520,"Staples in strips, of base metal",,,,20,,,,,"2,587",-9,0,"2,140",Tons,"1,209",45,-10,0,"1,370",Tons,"2,763",3
830590,"Office articles such as letter clips, letter corners, paper clips and indexing tags, of base . . .",,,,20,,,,,"1,121",-7,0,484,Tons,"2,316",23,-24,0,624,Tons,"7,006",-
830610,"Bells, gongs and the like, non-electric, of base metal (excl. musical instruments)",,,,0,,,,,375,3,0,46,Tons,"8,152",23,23,0,110,Tons,"7,091",
830621,"Statuettes and other ornaments, of base metal, plated with precious metal (excl. works of art, . . .",1,50,1,0,0,Tons,,,85,-22,0,5,Tons,"17,000",141,12,0,50,Tons,"42,000",-
830629,"Statuettes and other ornaments, of base metal, not plated with precious metal (excl. works . . .",2,45,0,0,0,Tons,,,"4,220",-6,0,790,Tons,"5,342",458,13,0,0,Tons,,-
830630,"Photograph, picture or similar frames, of base metal; mirrors of base metal (excl. optical . . .",1,15,1,0,0,Tons,,,"1,196",-23,0,366,Tons,"3,268",191,32,0,0,Tons,,2
830710 ,"Flexible tubing of iron or steel, with or without fittings",,,,10,,,,,"4,756",5,0,408,Tons,"11,657",731,6,0,"3,093",Tons,"7,568",22
830790,"Flexible tubing of base metal other than iron or steel, with or without fittings",,,,10,,,,,371,-4,0,24,Tons,"15,458","2,536",45,1,0,Tons,,2
830810,"Hooks, eyes and eyelets, of base metal, of a kind used for clothing, footwear, awnings, handbags, . . .",,,,15,,,,,"3,644",9,0,"1,230",Tons,"2,963",254,-18,0,"1,045",Tons,"7,552",-
830820,"Tubular or bifurcated rivets, of base metal",,,,8,,,,,"6,405",10,1,"1,724",Tons,"3,715",16,-22,0,711,Tons,"5,082",3
830890,"Clasps, frames with clasps without locks, buckles and buckle-clasps, of base metal, for clothing, . . .",1,90,0,5,0,Tons,,,"7,169",7,0,"1,075",Tons,"6,669","3,169",51,0,854,Tons,"8,088",-
830910,Crown corks of base metal,,,,5,,,,,"11,902",20,2,"2,817",Tons,"4,225",76,-64,0,166,Tons,"7,759",6
830990,"Stoppers, caps and lids, incl. screw caps and pouring stoppers, capsules for bottles, threaded . . .",8,-29,0,10,3,Tons,"2,667",,"70,419",15,1,"13,003",Tons,"5,416","144,808",14,1,"19,646",Tons,"5,381","1,835"
