Product Code,Product Label,"UAE export to south africa Value in 2022, USD thousands","nnual growth in value uae export to south africa between 2018-2022, %, p.a","Share in United Arab Emirates's exports, %",Equivalent ad valorem tariff faced by United Arab Emirates,Quantity exported from uae to south africa in 2022 ,Quantity unit ,Unit value (USD/unit) ,Number of non-tariff requirements faced by United Arab Emirates ,"south africa imports from world Value in 2022, USD thousand ","Annual growth south africa imports from world  in value between 2018-2022, %, p.a. ","Share in world imports, % ",Quantity exported from south africa to world in 2022 ,Quantity unit ,Unit value (USD/unit) ,"Uae export to world Value in 2022, USD thousand ","Annual growth in value between 2018-2022, %, p.a. ","UAE Share in world exports, % ",Quantity exported from uae to world in 2022 ,Quantity unit ,Unit value (USD/unit) ,"Estimation of untapped potential trade, USD thousand"
10121,Pure-bred breeding horses,,,,0,,,,,434,-20,0,"1,606",Units,270,"3,300",-12,0,0,Units,,
10129,Live horses (excl. pure-bred for breeding),,,,0,,,,,"2,575",-25,0,228,Units,"11,294",878,-35,0,0,Units,,
10130,Live asses,,,0,0,,,,,1,-73,0,1,Units,"1,000",,,,0,Units,,
10190,Live mules and hinnies,,,0,0,,,,,37,107,0,254,Units,146,,,,4,Units,"21,500",
10221,Pure-bred cattle for breeding,,,0,0,,,,,145,168,0,167,Units,868,,,,13,Units,"13,538",
10229,Live cattle (excl. pure-bred for breeding),,,,0,,,,,"171,218",4,2,"347,074",Units,493,"5,602",,0,0,Units,,
10231,Pure-bred buffalo for breeding,,,0,,,,,,5,,0,1,Units,"5,000",,,,,Units,,
10290,Live bovine animals (excl. cattle and buffalo),,,0,0,,,,,100,-48,0,256,Units,391,,,,12,Units,"1,250",
10410,Live sheep,,,,0,,,,,"33,410",-1,3,"426,209",Units,78,339,,0,0,Units,,30
10420,Live goats,,,0,0,,,,,"6,489",-5,11,"167,631",Units,39,,,,0,Units,,8
10511,"Live fowls of the species Gallus domesticus, weighing <= 185 g (excl. turkeys and guinea fowls)",,,,0,,,,,"13,239",14,1,"293,837",Units,45,16,-25,0,20,Units,"53,000",8
10594,"Live fowls of the species Gallus domesticus, weighing > 185",,,,0,,,,,0,,0,,Units,,28,-28,0,0,Units,,
10611,Live primates,,,0,0,,,,,4,-3,0,12,Units,333,,,,0,Units,,
10612,"Live whales, dolphins and porpoises (mammals of the order Cetacea); manatees and dugongs (mammals . . .",,,,,,,,,0,,0,,,,1,,0,,,,
10613,Live camels and other camelids [Camelidae],,,,0,,,,,0,,0,,Units,,"12,287",345,8,0,Units,,
10614,Live rabbits and hares,,,,0,,,,,0,,0,,Units,,1,78,0,0,Units,,
10619,"Live mammals (excl. primates, whales, dolphins and porpoises, manatees and dugongs, seals, . . .",,,,0,,,,,28,-57,0,693,Units,40,259,1,0,0,Units,,
10620,"Live reptiles ""e.g. snakes, turtles, alligators, caymans, iguanas, gavials and lizards""",,,,0,,,,,55,33,0,"1,245",Units,44,19,163,0,0,Units,,
10631,Live birds of prey,,,,,,,,,0,,0,,,,609,11,2,0,,,
10632,"Live psittaciformes ""incl. parrots, parrakeets, macaws and cockatoos""",15,,7,0,213,Units,70,,103,188,1,265,Units,389,206,139,1,0,Units,,-
10633,"Live ostriches, and emus [Dromaius novaehollandiae]",,,0,0,,,,,0,,0,,Units,,,,,0,Units,,
10639,"Live birds (excl. birds of prey, psittaciformes, parrots, parrakeets, macaws, cockatoos, ostriches . . .",,,,0,,,,,27,2,0,"2,778",Units,10,437,-28,1,0,Units,,
10649,Live insects (excl. bees),,,0,0,,,,,"1,302",6,1,"1,600,670,226,705",Units,0,,,,0,Units,,
10690,"Live animals (excl. mammals, reptiles, birds, insects, fish, crustaceans, molluscs and other . . .",,,,0,,,,,165,-15,0,"10,045,638,487",Units,0,12,-25,0,0,Units,,
20110,"Carcases or half-carcases of bovine animals, fresh or chilled",,,,40,,,,,"2,144",44,0,786,Tons,"2,728",17,0,0,"38,415",Tons,"4,511",2
20120,"Fresh or chilled bovine cuts, with bone in (excl. carcases and 1/2 carcases)",,,,40,,,,,220,58,0,84,Tons,"2,619",34,-39,0,"2,290",Tons,"9,909",-
20130,"Fresh or chilled bovine meat, boneless",,,,40,,,,,249,-13,0,30,Tons,"8,300",242,-25,0,"29,140",Tons,"8,822",-
20210,Frozen bovine carcases and half-carcases,,,0,40,,,,,207,80,0,96,Tons,"2,156",,,,107,Tons,"7,626",12
20220,"Frozen bovine cuts, with bone in (excl. carcases and half-carcases)",,,,40,,,,,590,-30,0,245,Tons,"2,408",38,-39,0,"2,042",Tons,"7,135",2
20230,"Frozen, boneless meat of bovine animals",,,,40,,,,,"6,479",-38,0,"1,939",Tons,"3,341","3,944",3,0,"101,593",Tons,"3,858",195
20312,"Fresh or chilled hams, shoulders and cuts thereof of swine, with bone in",,,,15,,,,,0,,0,,Tons,,1,,0,22,Tons,"2,227",
20319,"Fresh or chilled meat of swine (excl. carcases and half-carcases, and hams, shoulders and cuts . . .",,,,8,,,,,"1,542",114,0,595,Tons,"2,592",9,,0,188,Tons,"7,277",
20322,"Frozen hams, shoulders and cuts thereof of swine, with bone in",,,,15,,,,,149,-17,0,152,Tons,980,21,-17,0,"1,731",Tons,"1,776",1
20329,"Frozen meat of swine (excl. carcases and half-carcases, and hams, shoulders and cuts thereof, . . .",,,,8,,,,,"49,960",-6,0,"20,031",Tons,"2,494",114,-40,0,"13,507",Tons,"2,512",15
20410,Fresh or chilled lamb carcases and half-carcases,,,0,40,,,,,64,-48,0,29,Tons,"2,207",,,,"13,817",Tons,"6,571",-
20421,Fresh or chilled sheep carcases and half-carcases (excl. lambs),,,0,40,,,,,968,-54,0,431,Tons,"2,246",,,,"8,771",Tons,"6,960",1
20422,"Fresh or chilled cuts of sheep, with bone in (excl. carcases and half-carcases)",,,0,40,,,,,128,66,0,25,Tons,"5,120",,,,"4,927",Tons,"9,658",-
20423,Fresh or chilled boneless cuts of sheep,,,0,40,,,,,0,,0,,Tons,,,,,"1,807",Tons,"10,498",
20430,Frozen lamb carcases and half-carcases,,,0,40,,,,,0,,0,,Tons,,,,,"2,057",Tons,"5,785",
20441,Frozen sheep carcases and half-carcases (excl. lambs),,,0,40,,,,,0,,0,,Tons,,,,,985,Tons,"4,470",-
20442,"Frozen cuts of sheep, with bone in (excl. carcases and half-carcases)",,,,40,,,,,"4,142",-7,0,"1,395",Tons,"2,969",30,-45,0,"6,131",Tons,"6,259",3
20443,Frozen boneless cuts of sheep,,,,40,,,,,158,-44,0,19,Tons,"8,316",17,-52,0,"2,493",Tons,"8,081",-
20500,"Meat of horses, asses, mules or hinnies, fresh, chilled or frozen",,,0,,,,,,62,,0,40,Tons,"1,550",,,,,Tons,,
20610,Fresh or chilled edible offal of bovine animals,,,,11,,,,,340,18,0,331,Tons,"1,027",87,,0,134,Tons,"4,500",
20621,Frozen edible bovine tongues,,,0,0,,,,,839,-7,0,666,Tons,"1,260",,,,101,Tons,"2,802",
20622,Frozen edible bovine livers,,,,30,,,,,"15,716",-3,4,"14,306",Tons,"1,099",96,26,0,"1,767",Tons,"1,339",
20629,Frozen edible bovine offal (excl. tongues and livers),,,,0,,,,,"27,363",1,1,"15,189",Tons,"1,802","3,829",,0,"3,983",Tons,"1,993",3
20641,Frozen edible livers of swine,,,0,30,,,,,271,8,0,382,Tons,709,,,,214,Tons,696,
20649,"Edible offal of swine, frozen (excl. livers)",,,,0,,,,,"7,473",4,0,"9,614",Tons,777,338,,0,"2,768",Tons,"1,238",
20690,"Frozen edible offal of sheep, goats, horses, asses, mules and hinnies",,,0,0,,,,,"2,491",-2,1,"2,251",Tons,"1,107",,,,"2,530",Tons,"2,447",
20712,"Frozen fowls of the species Gallus domesticus, not cut in pieces",,,,38,,,,,"130,350",10,3,"197,622",Tons,660,176,-18,0,"277,686",Tons,"1,869","1,095"
20713,Fresh or chilled cuts and edible offal of fowls of the species Gallus domesticus,,,0,0,,,,,17,-11,0,9,Tons,"1,889",,,,260,Tons,"6,485",-
20714,Frozen cuts and edible offal of fowls of the species Gallus domesticus,,,,30,,,,,"124,988",-23,1,"162,062",Tons,771,"5,052",-7,0,"265,336",Tons,"2,103","1,617"
20724,"Fresh or chilled turkeys of the species domesticus, not cut in pieces",,,0,0,,,,,51,,0,26,Tons,"1,962",,,,18,Tons,"4,167",
20725,"Frozen turkeys of the species domesticus, not cut into pieces",,,,0,,,,,"1,488",-12,2,523,Tons,"2,845",91,-6,0,391,Tons,"2,703",18
20726,Fresh or chilled cuts and edible offal of turkeys of the species domesticus,,,,0,,,,,147,,0,76,Tons,"1,934",6,,0,47,Tons,"4,468",
20727,Frozen cuts and edible offal of turkeys of the species domesticus,,,,0,,,,,"21,166",-7,2,"12,018",Tons,"1,761",261,-6,0,"2,351",Tons,"2,595",61
20742,"Frozen domestic ducks, not cut in pieces",,,,0,,,,,413,-20,0,138,Tons,"2,993",3,-60,0,"1,140",Tons,"2,847",
20743,"Fatty livers of domestic ducks, fresh or chilled",,,0,0,,,,,42,,0,1,Tons,"42,000",,,,2,Tons,"55,000",
20745,Frozen cuts and edible offal of domestic ducks,,,,0,,,,,43,-34,0,6,Tons,"7,167",11,-42,0,292,Tons,"4,688",
20753,"Fatty livers of domestic geese, fresh or chilled",,,,0,,,,,0,,0,,Tons,,1,,0,,Tons,,
20890,"Fresh, chilled or frozen meat and edible offal of pigeons, game, reindeer and other animals . . .",,,,0,,,,,10,-71,0,4,Tons,"2,500",92,15,0,41,Tons,"12,902",
20910,"Pig fat, free of lean meat, not rendered or otherwise extracted, fresh, chilled, frozen, salted, . . .",,,0,0,,,,,"1,637",1,0,"1,472",Tons,"1,112",,,,17,Tons,882,
21011,"Hams, shoulders and cuts thereof of swine, salted, in brine, dried or smoked, with bone in",,,0,15,,,,,37,39,0,4,Tons,"9,250",,,,40,Tons,"12,150",
21012,"Bellies ""streaky"" and cuts thereof of swine, salted, in brine, dried or smoked",,,,15,,,,,24,-48,0,3,Tons,"8,000",8,,0,289,Tons,"4,920",
21019,"Meat of swine, salted, in brine, dried or smoked (excl. hams, shoulders and cuts thereof, with . . .",,,0,15,,,,,"1,163",6,0,101,Tons,"11,515",,,,341,Tons,"9,284",
21020,"Meat of bovine animals, salted, in brine, dried or smoked",,,,40,,,,,338,-25,0,31,Tons,"10,903","8,338",205,3,158,Tons,"12,500",3
21099,"Meat and edible offal, salted, in brine, dried or smoked, and edible flours and meals of meat . . .",,,,40,,,,,134,-35,0,11,Tons,"12,182",117,-15,0,388,Tons,"2,804",
30111,Live ornamental freshwater fish,,,,0,,,,,48,6,0,5,Tons,"9,600",15,,0,0,Tons,,
30119,Live ornamental fish (excl. freshwater),,,,0,,,,,"1,592",1,2,165,Tons,"9,648",2,-42,0,0,Tons,,
30193,"Live carp ""Cyprinus spp., Carassius spp., Ctenopharyngodon idellus, Hypophthalmichthys spp., . . .",,,0,,,,,,69,240,0,8,,"8,625",,,,,,,
30199,"Live fish (excl. ornamental fish, trout [Salmo trutta, Oncorhynchus mykiss, Oncorhynchus clarki, . . .",,,,0,,,,,2,-6,0,0,Tons,,9,,0,0,Tons,,
30211,"Fresh or chilled trout ""Salmo trutta, Oncorhynchus mykiss, Oncorhynchus clarki, Oncorhynchus . . .",,,,25,,,,,"4,171",21,1,892,Tons,"4,676",2,94,0,163,Tons,"10,712",
30213,"Fresh or chilled Pacific salmon ""Oncorhynchus nerka, Oncorhynchus gorbuscha, Oncorhynchus keta, . . .",,,,25,,,,,0,,0,,Tons,,15,-25,0,1,Tons,"20,000",
30214,"Fresh or chilled Atlantic salmon ""Salmo salar"" and Danube salmon ""Hucho hucho""",,,,25,,,,,"29,013",22,0,"2,717",Tons,"10,678",51,8,0,"7,261",Tons,"8,951",
30219,"Fresh or chilled salmonidae (excl. trout ""Salmo trutta, Oncorhynchus mykiss, Oncorhynchus clarki, . . .",,,,25,,,,,105,209,0,11,Tons,"9,545",200,2,0,159,Tons,"4,686",
30221,"Fresh or chilled lesser or Greenland halibut ""Reinhardtius hippoglossoides, Atlantic halibut . . .",,,,,,,,,0,,0,,,,4,26,0,2,,"20,500",
30223,"Fresh or chilled sole ""Solea spp.""",,,0,0,,,,,14,-23,0,8,Tons,"1,750",,,,28,Tons,"18,036",
30229,"Fresh or chilled flat fish ""Pleuronectidae, Bothidae, Cynoglossidae, Soleidae, Scophthalmidae . . .",,,0,0,,,,,11,-62,0,5,Tons,"2,200",,,,98,Tons,"7,102",
30231,"Fresh or chilled albacore or longfinned tunas ""Thunnus alalunga""",,,,0,,,,,0,,0,,Tons,,2,-21,0,2,Tons,"24,500",
30232,"Fresh or chilled yellowfin tunas ""Thunnus albacares""",,,,0,,,,,0,,0,,Tons,,2,-50,0,159,Tons,"5,176",
30235,"Fresh or chilled Atlantic and Pacific bluefin tuna (Thunnus thynnus, Thunnus orientalis)",,,0,0,,,,,22,44,0,1,Tons,"22,000",,,,55,Tons,"26,036",
30239,"Fresh or chilled tunas of the genus ""Thunnus"" (excl. Thunnus alalunga, Thunnus albacares, Thunnus . . .",,,,0,,,,,0,,0,,Tons,,5,-24,0,3,Tons,"5,333",
30243,"Fresh or chilled sardines ""Sardina pilchardus, Sardinops spp."", sardinella ""Sardinella spp."", . . .",,,,0,,,,,0,,0,,Tons,,1,,0,0,Tons,,
30244,"Fresh or chilled mackerel ""Scomber scombrus, Scomber australasicus, Scomber japonicus""",,,,0,,,,,3,-22,0,7,Tons,429,4,-24,0,7,Tons,"5,857",1
30249,"Fresh or chilled Indian mackerels ""Rastrelliger spp."", seerfishes ""Scomberomorus spp."", jacks, . . .",,,,0,,,,,3,-41,0,3,Tons,"1,000",3,-5,0,174,Tons,"6,678",
30251,"Fresh or chilled cod ""Gadus morhua, Gadus ogac, Gadus macrocephalus""",,,0,0,,,,,38,-16,0,18,,"2,111",,,,17,,"12,941",
30254,"Fresh or chilled hake ""Merluccius spp., Urophycis spp.""",,,0,0,,,,,47,-4,0,25,Tons,"1,880",,,,0,Tons,,
30255,"Fresh or chilled Alaska pollack ""Theragra chalcogramma""",,,,,,,,,0,,0,,,,11,,0,,,,
30259,"Fresh or chilled fish of the families Bregmacerotidae, Euclichthyidae, Gadidae, Macrouridae, . . .",,,0,0,,,,,4,-50,0,2,,"2,000",,,,20,,"8,600",
30279,"Fresh or chilled, Nile perch ""Lates niloticus"" and snakeheads ""Channa spp.""",,,,0,,,,,5,-48,0,13,Tons,385,30,37,0,72,Tons,"16,639",
30281,Fresh or chilled dogfish and other sharks,,,,,,,,,0,,0,,,,1,,0,0,,,
30284,"Fresh or chilled sea bass ""Dicentrarchus spp.""",,,,0,,,,,85,-49,0,21,,"4,048",15,,0,"2,337",,"7,185",
30289,"Fresh or chilled fish, n.e.s.",,,,0,,,,,130,45,0,150,Tons,867,56,-16,0,"1,826",Tons,"5,321",
30291,"Fresh or chilled fish livers, roes and milt",,,0,0,,,,,2,-19,0,0,Tons,,,,,4,Tons,"37,500",
30299,"Fresh or chilled fish fins, heads, tails, maws and other edible fish offal (excl. livers, roes, . . .",,,,0,,,,,17,,0,3,Tons,"5,667",1,-48,0,4,Tons,"1,750",
30312,"Frozen Pacific salmon (excl. sockeye salmon ""red salmon"")",,,,25,,,,,0,,0,,Tons,,163,7,0,0,Tons,,
30313,"Frozen, Atlantic salmon ""Salmo salar"" and Danube salmon ""Hucho hucho""",,,,25,,,,,"7,819",-7,1,955,Tons,"8,187",274,52,0,"2,758",Tons,"7,992",16
30314,"Frozen trout ""Salmo trutta, Oncorhynchus mykiss, Oncorhynchus clarki, Oncorhynchus aguabonita, . . .",,,0,25,,,,,"3,164",4,1,559,Tons,"5,660",,,,0,Tons,,
30319,"Frozen salmonidae (excl. trout and Pacific, Atlantic and Danube salmon)",,,,25,,,,,0,,0,,Tons,,778,-8,1,64,Tons,"5,391",
30323,"Frozen tilapia ""Oreochromis spp.""",,,,0,,,,,"7,226",2,2,"7,825",Tons,923,316,272,0,"2,307",Tons,"1,206",
30324,"Frozen catfish ""Pangasius spp., Silurus spp., Clarias spp., Ictalurus spp.""",,,,0,,,,,155,-20,0,149,Tons,"1,040",2,,0,"1,030",Tons,"1,561",
30325,"Frozen carp ""Cyprinus spp., Carassius spp., Ctenopharyngodon idellus, Hypophthalmichthys spp., . . .",,,0,0,,,,,191,589,0,237,,806,,,,"3,820",,"1,495",
30326,"Frozen eels ""Anguilla spp.""",,,0,,,,,,1,-29,0,0,,,,,,,,,
30329,"Frozen, Nile perch (Lates niloticus) and snakeheads (Channa spp.)",,,,0,,,,,0,,0,,Tons,,10,-45,0,62,Tons,"3,161",
30331,"Frozen lesser or Greenland halibut ""Reinhardtius hippoglossoides"", Atlantic halibut ""Hippoglossus . . .",,,,0,,,,,4,,0,2,,"2,000",8,,0,0,,,
30333,"Frozen sole ""Solea spp.""",,,,0,,,,,"1,058",-16,2,382,Tons,"2,770",80,,0,7,Tons,"6,000",
30339,"Frozen flat fish ""Pleuronectidae, Bothidae, Cynoglossidae, Soleidae, Scophthalmidae and Citharidae"" . . .",,,,0,,,,,45,-33,0,17,Tons,"2,647",1,69,0,386,Tons,"2,119",
30341,"Frozen albacore or longfinned tunas ""Thunnus alalunga""",,,,0,,,,,"1,575",28,0,387,Tons,"4,070",16,21,0,,Tons,,
30342,"Frozen yellowfin tunas ""Thunnus albacares""",,,,0,,,,,128,-33,0,17,Tons,"7,529",90,33,0,1,Tons,"22,000",6
30343,"Frozen skipjack or stripe-bellied bonito ""Euthynnus -Katsuwonus- pelamis""",,,,0,,,,,9,8,0,8,,"1,125",13,,0,313,,"1,300",1
30344,"Frozen bigeye tunas ""Thunnus obesus""",,,0,,,,,,46,-44,0,37,Tons,"1,243",,,,,Tons,,
30349,"Frozen tunas of the genus ""Thunnus"" (excl. Thunnus alalunga, Thunnus albacares, Thunnus obesus, . . .",,,,0,,,,,303,-21,0,24,Tons,"12,625",42,-40,0,446,Tons,"2,726",
30351,"Frozen herrings ""Clupea harengus, Clupea pallasii""",,,,0,,,,,0,,0,,Tons,,51,-47,0,47,Tons,"1,255",
30353,"Frozen sardines ""Sardina pilchardus, Sardinops spp."", sardinella ""Sardinella spp."", brisling . . .",,,,0,,,,,"110,289",10,15,"113,715",Tons,970,497,43,0,485,Tons,"1,767",41
30354,"Frozen mackerel ""Scomber scombrus, Scomber australasicus, Scomber japonicus""",,,,0,,,,,931,-15,0,723,Tons,"1,288",186,18,0,748,Tons,"2,040",5
30355,"Frozen jack and horse mackerel ""Trachurus spp.""",,,,0,,,,,"15,224",-7,2,"14,190",Tons,"1,073",588,132,0,157,Tons,"1,510",
30359,"Frozen anchovies ""Engraulis spp."", Indian mackerels ""Rastrelliger spp."", seerfishes ""Scomberomorus . . .",,,,0,,,,,707,,0,278,Tons,"2,543","1,601",198,0,"1,144",Tons,"3,847",
30363,"Frozen cod ""Gadus morhua, Gadus ogac, Gadus macrocephalus""",,,,0,,,,,129,8,0,30,Tons,"4,300",2,-42,0,263,Tons,"4,871",
30364,"Frozen haddock ""Melanogrammus aeglefinus""",,,,0,,,,,0,,0,,Tons,,29,,0,,Tons,,
30365,"Frozen coalfish ""Pollachius virens""",,,,,,,,,0,,0,,,,10,,0,,,,
30366,"Frozen hake ""Merluccius spp., Urophycis spp.""",,,,0,,,,,"23,043",-9,5,"14,519",Tons,"1,587",14,,0,144,Tons,"1,250",
30367,"Frozen Alaska pollack ""Theragra chalcogramma""",,,0,0,,,,,715,128,0,438,Tons,"1,632",,,,3,Tons,"4,333",
30368,"Frozen blue whiting ""Micromesistius poutassou, Micromesistius australis""",,,,0,,,,,"1,878",11,1,"1,288",Tons,"1,458",125,3,0,472,Tons,888,
30369,"Frozen fish of the families Bregmacerotidae, Euclichthyidae, Gadidae, Macrouridae, Melanonidae, . . .",,,,0,,,,,285,-32,0,49,Tons,"5,816",223,11,0,98,Tons,"1,184",
30381,Frozen dogfish and other sharks,,,,0,,,,,2,-17,0,3,Tons,667,41,,0,,Tons,,
30382,"Frozen rays and skates ""Rajidae""",,,,0,,,,,0,,0,,Tons,,126,484,0,15,Tons,"2,200",
30383,"Frozen toothfish ""Dissostichus spp.""",,,,0,,,,,0,,0,,Tons,,7,,0,83,Tons,"11,217",
30384,"Frozen sea bass ""Dicentrarchus spp.""",,,,0,,,,,"1,067",-6,2,234,Tons,"4,560",152,17,0,40,Tons,"13,200",-
30389,"Frozen fish, n.e.s.",,,,0,,,,,"18,088",-1,0,"10,631",Tons,"1,701","5,400",2,0,"19,234",Tons,"1,525",
30399,"Frozen fish fins, heads, tails, maws and other edible fish offal (excl. livers, roes, milt . . .",,,,0,,,,,8,-43,0,1,Tons,"8,000",79,-24,0,1,Tons,"29,000",
30431,"Fresh or chilled fillets of tilapia ""Oreochromis spp.""",,,,25,,,,,0,,0,,Tons,,33,78,0,41,Tons,"7,390",
30432,"Fresh or chilled fillets of catfish ""Pangasius spp., Silurus spp., Clarias spp., Ictalurus . . .",,,,25,,,,,0,,0,,Tons,,1,4,0,2,Tons,"5,000",
30433,"Fresh or chilled fillets of Nile perch ""Lates niloticus""",,,,,,,,,0,,0,,,,22,-8,0,55,,"5,327",
30439,"Fresh or chilled fillets of carp ""Cyprinus spp., Carassius spp., Ctenopharyngodon idellus, . . .",,,,25,,,,,87,127,0,7,Tons,"12,429",30,156,0,1,Tons,"5,000",
30441,"Fresh or chilled fillets of Pacific salmon ""Oncorhynchus nerka, Oncorhynchus gorbuscha, Oncorhynchus . . .",,,,25,,,,,171,-26,0,10,Tons,"17,100",5,-44,0,170,Tons,"12,747",
30442,"Fresh or chilled fillets of trout ""Salmo trutta, Oncorhynchus mykiss, Oncorhynchus clarki, . . .",,,,25,,,,,0,,0,,Tons,,66,,0,11,Tons,"10,182",
30444,"Fresh or chilled fillets of fish of the families Bregmacerotidae, Euclichthyidae, Gadidae, . . .",,,0,25,,,,,0,,0,,Tons,,,,,2,Tons,"13,000",
30445,"Fresh or chilled fillets of swordfish ""Xiphias gladius""",,,,,,,,,0,,0,,,,3,195,0,,,,
30446,"Fresh or chilled fillets of toothfish ""Dissostichus spp.""",,,,,,,,,0,,0,,,,22,85,0,,,,
30447,Fresh or chilled fillets of dogfish and other sharks,,,,25,,,,,0,,0,,Tons,,4,215,0,,Tons,,
30449,"Fresh or chilled fillets of fish, n.e.s.",,,,13,,,,,"2,251",30,0,242,Tons,"9,302",238,-8,0,76,Tons,"26,118",
30452,"Fresh or chilled meat, whether or not minced, of salmonidae (excl. fillets)",,,,25,,,,,0,,0,,Tons,,19,,0,1,Tons,"12,000",
30454,"Fresh or chilled meat, whether or not minced, of swordfish ""Xiphias gladius"" (excl. fillets)",,,,,,,,,0,,0,,,,2,,0,,,,
30459,"Fresh or chilled fish meat, whether or not minced (excl. all fillets, tilapias, catfish, carp, . . .",,,,13,,,,,0,,0,,Tons,,17,-2,0,1,Tons,"56,000",
30461,"Frozen fillets of tilapia ""Oreochromis spp.""",,,,13,,,,,45,-44,0,30,Tons,"1,500",13,71,0,15,Tons,"2,467",
30462,"Frozen fillets of catfish ""Pangasius spp., Silurus spp., Clarias spp., Ictalurus spp.""",,,,13,,,,,691,-20,0,207,Tons,"3,338",851,43,0,71,Tons,"1,141",
30463,"Frozen fillets of Nile perch ""Lates niloticus""",,,,13,,,,,0,,0,,Tons,,140,10,0,640,Tons,"6,164",
30469,"Frozen fillets of carp ""Cyprinus spp., Carassius spp., Ctenopharyngodon idellus, Hypophthalmichthys . . .",,,0,13,,,,,62,,0,34,Tons,"1,824",,,,425,Tons,"2,033",
30471,"Frozen fillets of cod ""Gadus morhua, Gadus ogac, Gadus macrocephalus""",,,,13,,,,,0,,0,,Tons,,"1,079",68,0,66,Tons,"10,121",
30472,"Frozen fillets of haddock ""Melanogrammus aeglefinus""",,,,13,,,,,0,,0,,Tons,,2,,0,1,Tons,"11,000",
30473,"Frozen fillets of coalfish ""Pollachius virens""",,,,13,,,,,70,,0,23,,"3,043",7,,0,0,,,
30474,"Frozen fillets of hake ""Merluccius spp., Urophycis spp.""",,,,13,,,,,"26,705",-7,3,"8,088",Tons,"3,302",7,,0,3,Tons,"4,333",
30475,"Frozen fillets of Alaska pollack ""Theragra chalcogramma""",,,,13,,,,,1,-79,0,1,,"1,000",1,,0,96,,"3,219",
30479,"Frozen fillets of fish of the families Bregmacerotidae, Euclichthyidae, Gadidae, Macrouridae, . . .",,,,13,,,,,177,-23,0,94,Tons,"1,883",111,366,0,5,Tons,"5,400",
30481,"Frozen fillets of Pacific salmon ""Oncorhynchus nerka, Oncorhynchus gorbuscha, Oncorhynchus . . .",,,,13,,,,,"1,554",40,0,126,Tons,"12,333",474,7,0,499,Tons,"13,116",
30482,"Frozen fillets of trout ""Salmo trutta, Oncorhynchus mykiss, Oncorhynchus clarki, Oncorhynchus . . .",,,,13,,,,,0,,0,,Tons,,16,25,0,5,Tons,"8,800",
30483,"Frozen fillets of flat fish ""Pleuronectidae, Bothidae, Cynoglossidae, Soleidae, Scophthalmidae . . .",,,,13,,,,,146,6,0,86,,"1,698",65,293,0,59,,"7,780",
30484,"Frozen fillets of swordfish ""Xiphias gladius""",,,,,,,,,0,,0,,,,5,,0,,,,
30486,"Frozen fillets of herring ""Clupea harengus, Clupea pallasii""",,,0,0,,,,,18,-33,0,10,,"1,800",,,,5,,"10,800",
30487,"Frozen fillets of tuna ""of the genus Thunnus"", skipjack or stripe-bellied bonito ""Euthynnus . . .",,,,13,,,,,164,-5,0,21,Tons,"7,810",97,15,0,160,Tons,"13,656",
30489,"Frozen fish fillets, n.e.s.",,,,8,,,,,524,25,0,115,Tons,"4,557","1,597",12,0,441,Tons,"8,422",
30495,"Frozen meat, whether or not minced, of fish of the families Bregmacerotidae, Euclichthyidae, . . .",,,0,13,,,,,245,35,0,110,Tons,"2,227",,,,4,Tons,"7,000",
30497,"Frozen meat, whether or not minced, of rays and skates ""Rajidae""",,,0,,,,,,1,58,0,3,,333,,,,,,,
30499,Frozen fish meat n.e.s. (excl. fillets),,,,13,,,,,"2,399",6,0,"1,189",Tons,"2,018",774,-22,0,338,Tons,"2,769",
30510,"Flours, meals and pellets of fish, fit for human consumption",,,,0,,,,,42,,0,10,Tons,"4,200",31,45,0,8,Tons,"2,750",
30539,"Fish fillets, dried, salted or in brine, but not smoked (excl. tilapia, catfish, carp, eels, . . .",,,,13,,,,,64,-41,0,10,Tons,"6,400",39,0,0,2,Tons,"12,500",
30541,"Smoked Pacific salmon ""Oncorhynchus nerka, Oncorhynchus gorbuscha, Oncorhynchus keta, Oncorhynchus . . .",,,,25,,,,,87,-12,0,191,Tons,455,260,11,0,54,Tons,"20,759",
30543,"Smoked trout ""Salmo trutta, Oncorhynchus mykiss, Oncorhynchus clarki, Oncorhynchus aguabonita, . . .",,,,25,,,,,0,,0,,Tons,,3,29,0,2,Tons,"15,500",
30549,"Smoked fish, incl. fillets (excl. offal, Pacific salmon, Atlantic salmon, Danube salmon, herring, . . .",,,,13,,,,,510,18,0,188,Tons,"2,713",243,-14,0,12,Tons,"10,833",
30551,"Dried cod ""Gadus morhua, Gadus ogac, Gadus macrocephalus"", even salted, not smoked (excl. fillets . . .",,,,0,,,,,"1,181",0,0,132,Tons,"8,947",1,124,0,0,Tons,,
30552,"Dried tilapia ""Oreochromis spp."", catfish ""Pangasius spp., Silurus spp., Clarias spp., Ictalurus . . .",,,,,,,,,0,,0,,,,239,-11,4,,,,
30553,"Dried fish of the families Bregmacerotidae, Euclichthyidae, Gadidae, Macrouridae, Melanonidae, . . .",,,,25,,,,,0,,0,,Tons,,5,91,0,0,Tons,,
30554,"Dried herrings ""Clupea harengus, Clupea pallasii"", anchovies ""Engraulis spp."", sardines ""Sardina . . .",,,,13,,,,,1,-29,0,0,,,"22,518",5,21,7,,"9,286",
30559,"Fish, dried, even salted but not smoked, n.e.s. (excl. fillets and offal)",,,,25,,,,,38,151,0,30,Tons,"1,267",256,-47,0,0,Tons,,
30569,"Fish, salted or in brine only (excl. fillets, offal, herring, cod, anchovies, tilapia, catfish, . . .",,,,25,,,,,"1,650",8,1,625,Tons,"2,640",3,-23,0,89,Tons,"2,045",
30571,"Shark fins, smoked, dried, salted or in brine",,,,13,,,,,254,-18,0,31,Tons,"8,194",562,-38,0,,Tons,,
30572,"Fish heads, tails and maws, smoked, dried, salted or in brine",,,,13,,,,,0,,0,,Tons,,"1,581",-34,0,1,Tons,"200,000",
30579,"Fish fins and other edible fish offal, smoked, dried, salted or in brine (excl. heads, tails, . . .",,,,13,,,,,0,,0,,Tons,,201,-27,0,,Tons,,
30611,"Frozen rock lobster and other sea crawfish ""Palinurus spp."", ""Panulirus spp."" and ""Jasus spp."", . . .",,,,0,,,,,77,-61,0,3,Tons,"25,667","15,837",27,2,100,Tons,"17,270",2
30612,"Frozen lobsters ""Homarus spp."", even smoked, whether in shell or not, incl. lobsters in shell, . . .",,,,15,,,,,0,,0,,Tons,,"8,819",18,1,152,Tons,"26,776",4
30614,"Frozen crabs, even smoked, whether in shell or not, incl. crabs in shell, cooked by steaming . . .",,,,0,,,,,"1,868",-2,0,428,Tons,"4,364",356,-14,0,464,Tons,"14,412",-
30616,"Frozen cold-water shrimps and prawns ""Pandalus spp., Crangon crangon"", even smoked, whether . . .",,,,0,,,,,"3,979",36,0,362,Tons,"10,992","4,969",20,0,150,Tons,"5,040",
30617,"Frozen shrimps and prawns, even smoked, whether in shell or not, incl. shrimps and prawns in . . .",,,,0,,,,,"40,572",1,0,"6,582",Tons,"6,164","138,616",-2,1,"28,005",Tons,"6,464",
30619,"Frozen crustaceans, even smoked, fit for human consumption, whether in shell or not, incl. . . .",,,,0,,,,,2,-74,0,1,Tons,"2,000",648,-2,1,91,Tons,"7,242",
30632,"Lobsters ""Homarus spp."", whether in shell or not, live, fresh or chilled",,,,0,,,,,4,,0,1,,"4,000",70,-27,0,293,,"24,362",
30633,"Crabs, whether in shell or not, live, fresh or chilled",,,,0,,,,,6,80,0,3,,"2,000",10,-29,0,147,,"23,082",
