Product Code,Product Label,uae export to world Value in 2022,Annual growth in value between uae export to world 2018-2022,Share in world exports,Quantity exported in 2022 ,Quantity unit ,Unit value (USD/unit) ,,"Estimation of untapped potential trade, USD thousand"
10121,Pure-bred breeding horses,"3,300",-12,0,0,Tons, ,,
10129,Live horses (excl. pure-bred for breeding),878,-35,0,0,Tons, ,,
10229,Live cattle (excl. pure-bred for breeding),"5,602", ,0,0, , ,,
10391,"Live pure-bred swine, weighing < 50 kg (excl. pure-bred for breeding)", , , ,0, , ,,
10410,Live sheep,339, ,0,0,Tons, ,,
10420,Live goats, , , ,0,Units, ,,
10511,"Live fowls of the species Gallus domesticus, weighing <= 185 g (excl. turkeys and guinea fowls)",16,-25,0,20,Tons,"53,000",,3
10594,"Live fowls of the species Gallus domesticus, weighing > 185",28,-28,0,0,Tons, ,,
10611,Live primates, , , ,0, , ,,
10612,"Live whales, dolphins and porpoises (mammals of the order Cetacea); manatees and dugongs (mammals . . .",1, ,0, , , ,,
10613,Live camels and other camelids [Camelidae],"12,287",345,8,0, , ,,
10614,Live rabbits and hares,1,78,0,0, , ,,
10619,"Live mammals (excl. primates, whales, dolphins and porpoises, manatees and dugongs, seals, . . .",259,1,0,0,Tons, ,,
10620,"Live reptiles ""e.g. snakes, turtles, alligators, caymans, iguanas, gavials and lizards""",19,163,0,0, , ,,
10631,Live birds of prey,609,11,2,0, , ,,
10632,"Live psittaciformes ""incl. parrots, parrakeets, macaws and cockatoos""",206,139,1,0, , ,,
10639,"Live birds (excl. birds of prey, psittaciformes, parrots, parrakeets, macaws, cockatoos, ostriches . . .",437,-28,1,0, , ,,
10649,Live insects (excl. bees), , , ,0, , ,,
10690,"Live animals (excl. mammals, reptiles, birds, insects, fish, crustaceans, molluscs and other . . .",12,-25,0,0,Tons, ,,
20110,"Carcases or half-carcases of bovine animals, fresh or chilled",17,0,0,"38,415",Tons,"4,511",,
20120,"Fresh or chilled bovine cuts, with bone in (excl. carcases and 1/2 carcases)",34,-39,0,"2,290",Tons,"9,909",,
20130,"Fresh or chilled bovine meat, boneless",242,-25,0,"29,140",Tons,"8,822",,
20220,"Frozen bovine cuts, with bone in (excl. carcases and half-carcases)",38,-39,0,"2,042",Tons,"7,135",,
20230,"Frozen, boneless meat of bovine animals","3,944",3,0,"101,593",Tons,"3,858",,
20312,"Fresh or chilled hams, shoulders and cuts thereof of swine, with bone in",1, ,0,22,Tons,"2,227",,
20319,"Fresh or chilled meat of swine (excl. carcases and half-carcases, and hams, shoulders and cuts . . .",9, ,0,188, ,"7,277",,
20321,Frozen carcases and half-carcases of swine, , , ,90,Tons,"3,267",,
20322,"Frozen hams, shoulders and cuts thereof of swine, with bone in",21,-17,0,"1,731",Tons,"1,776",,-
20329,"Frozen meat of swine (excl. carcases and half-carcases, and hams, shoulders and cuts thereof, . . .",114,-40,0,"13,507", ,"2,512",,-
20410,Fresh or chilled lamb carcases and half-carcases, , , ,"13,817",Tons,"6,571",,
20421,Fresh or chilled sheep carcases and half-carcases (excl. lambs), , , ,"8,771",Tons,"6,960",,
20430,Frozen lamb carcases and half-carcases, , , ,"2,057",Tons,"5,785",,
20441,Frozen sheep carcases and half-carcases (excl. lambs), , , ,985,Tons,"4,470",,
20442,"Frozen cuts of sheep, with bone in (excl. carcases and half-carcases)",30,-45,0,"6,131",Tons,"6,259",,1
20443,Frozen boneless cuts of sheep,17,-52,0,"2,493",Tons,"8,081",,-
20610,Fresh or chilled edible offal of bovine animals,87, ,0,134,Tons,"4,500",,
20622,Frozen edible bovine livers,96,26,0,"1,767",Tons,"1,339",,
20629,Frozen edible bovine offal (excl. tongues and livers),"3,829", ,0,"3,983",Tons,"1,993",,
20649,"Edible offal of swine, frozen (excl. livers)",338, ,0,"2,768", ,"1,238",,
20712,"Frozen fowls of the species Gallus domesticus, not cut in pieces",176,-18,0,"277,686",Tons,"1,869",,-
20714,Frozen cuts and edible offal of fowls of the species Gallus domesticus,"5,052",-7,0,"265,336",Tons,"2,103",,1
20725,"Frozen turkeys of the species domesticus, not cut into pieces",91,-6,0,391, ,"2,703",,-
20726,Fresh or chilled cuts and edible offal of turkeys of the species domesticus,6, ,0,47, ,"4,468",,
20727,Frozen cuts and edible offal of turkeys of the species domesticus,261,-6,0,"2,351", ,"2,595",,-
20742,"Frozen domestic ducks, not cut in pieces",3,-60,0,"1,140", ,"2,847",,
20745,Frozen cuts and edible offal of domestic ducks,11,-42,0,292, ,"4,688",,
20753,"Fatty livers of domestic geese, fresh or chilled",1, ,0, , , ,,
20890,"Fresh, chilled or frozen meat and edible offal of pigeons, game, reindeer and other animals . . .",92,15,0,41, ,"12,902",,
21012,"Bellies ""streaky"" and cuts thereof of swine, salted, in brine, dried or smoked",8, ,0,289, ,"4,920",,
21020,"Meat of bovine animals, salted, in brine, dried or smoked","8,338",205,3,158, ,"12,500",,
21099,"Meat and edible offal, salted, in brine, dried or smoked, and edible flours and meals of meat . . .",117,-15,0,388,Tons,"2,804",,
30111,Live ornamental freshwater fish,15, ,0,0,Tons, ,,
30119,Live ornamental fish (excl. freshwater),2,-42,0,0,Tons, ,,
30199,"Live fish (excl. ornamental fish, trout [Salmo trutta, Oncorhynchus mykiss, Oncorhynchus clarki, . . .",9, ,0,0,Tons, ,,
30211,"Fresh or chilled trout ""Salmo trutta, Oncorhynchus mykiss, Oncorhynchus clarki, Oncorhynchus . . .",2,94,0,163,Tons,"10,712",,
30213,"Fresh or chilled Pacific salmon ""Oncorhynchus nerka, Oncorhynchus gorbuscha, Oncorhynchus keta, . . .",15,-25,0,1, ,"20,000",,
30214,"Fresh or chilled Atlantic salmon ""Salmo salar"" and Danube salmon ""Hucho hucho""",51,8,0,"7,261", ,"8,951",,
30219,"Fresh or chilled salmonidae (excl. trout ""Salmo trutta, Oncorhynchus mykiss, Oncorhynchus clarki, . . .",200,2,0,159,Tons,"4,686",,
30221,"Fresh or chilled lesser or Greenland halibut ""Reinhardtius hippoglossoides, Atlantic halibut . . .",4,26,0,2, ,"20,500",,
30223,"Fresh or chilled sole ""Solea spp.""", , , ,28,Tons,"18,036",,
30229,"Fresh or chilled flat fish ""Pleuronectidae, Bothidae, Cynoglossidae, Soleidae, Scophthalmidae . . .", , , ,98,Tons,"7,102",,
30231,"Fresh or chilled albacore or longfinned tunas ""Thunnus alalunga""",2,-21,0,2, ,"24,500",,
30232,"Fresh or chilled yellowfin tunas ""Thunnus albacares""",2,-50,0,159,Tons,"5,176",,
30239,"Fresh or chilled tunas of the genus ""Thunnus"" (excl. Thunnus alalunga, Thunnus albacares, Thunnus . . .",5,-24,0,3,Tons,"5,333",,
30242,"Fresh or chilled anchovies ""Engraulis spp.""", , , ,181,Tons,"4,028",,
30243,"Fresh or chilled sardines ""Sardina pilchardus, Sardinops spp."", sardinella ""Sardinella spp."", . . .",1, ,0,0,Tons, ,,
30244,"Fresh or chilled mackerel ""Scomber scombrus, Scomber australasicus, Scomber japonicus""",4,-24,0,7,Tons,"5,857",,
30246,"Fresh or chilled cobia ""Rachycentron canadum""", , , ,0,Tons, ,,
30249,"Fresh or chilled Indian mackerels ""Rastrelliger spp."", seerfishes ""Scomberomorus spp."", jacks, . . .",3,-5,0,174,Tons,"6,678",,
30251,"Fresh or chilled cod ""Gadus morhua, Gadus ogac, Gadus macrocephalus""", , , ,17,Tons,"12,941",,
30252,"Fresh or chilled haddock ""Melanogrammus aeglefinus""", , , ,1, ,"12,000",,
30255,"Fresh or chilled Alaska pollack ""Theragra chalcogramma""",11, ,0, , , ,,
30259,"Fresh or chilled fish of the families Bregmacerotidae, Euclichthyidae, Gadidae, Macrouridae, . . .", , , ,20,Tons,"8,600",,
30271,"Fresh or chilled tilapia ""Oreochromis spp.""", , , ,"1,269",Tons,"5,980",,
30272,"Fresh or chilled catfish ""Pangasius spp., Silurus spp., Clarias spp., Ictalurus spp.""", , , ,0,Tons, ,,
30273,"Fresh or chilled carp ""Cyprinus spp., Carassius spp., Ctenopharyngodon idellus, Hypophthalmichthys . . .", , , ,198,Tons,"2,399",,
30274,"Fresh or chilled eels ""Anguilla spp.""", , , ,0,Tons, ,,
30279,"Fresh or chilled, Nile perch ""Lates niloticus"" and snakeheads ""Channa spp.""",30,37,0,72,Tons,"16,639",,
30281,Fresh or chilled dogfish and other sharks,1, ,0,0, , ,,
30284,"Fresh or chilled sea bass ""Dicentrarchus spp.""",15, ,0,"2,337",Tons,"7,185",,
30285,"Fresh or chilled sea bream ""Sparidae""", , , ,"1,870",Tons,"4,941",,
30289,"Fresh or chilled fish, n.e.s.",56,-16,0,"1,826",Tons,"5,321",,
30299,"Fresh or chilled fish fins, heads, tails, maws and other edible fish offal (excl. livers, roes, . . .",1,-48,0,4, ,"1,750",,
30312,"Frozen Pacific salmon (excl. sockeye salmon ""red salmon"")",163,7,0,0, , ,,
30313,"Frozen, Atlantic salmon ""Salmo salar"" and Danube salmon ""Hucho hucho""",274,52,0,"2,758", ,"7,992",,1
30319,"Frozen salmonidae (excl. trout and Pacific, Atlantic and Danube salmon)",778,-8,1,64,Tons,"5,391",,
30323,"Frozen tilapia ""Oreochromis spp.""",316,272,0,"2,307",Tons,"1,206",,
30324,"Frozen catfish ""Pangasius spp., Silurus spp., Clarias spp., Ictalurus spp.""",2, ,0,"1,030",Tons,"1,561",,
30325,"Frozen carp ""Cyprinus spp., Carassius spp., Ctenopharyngodon idellus, Hypophthalmichthys spp., . . .", , , ,"3,820",Tons,"1,495",,
30326,"Frozen eels ""Anguilla spp.""", , , , ,Tons, ,,
30329,"Frozen, Nile perch (Lates niloticus) and snakeheads (Channa spp.)",10,-45,0,62,Tons,"3,161",,
30331,"Frozen lesser or Greenland halibut ""Reinhardtius hippoglossoides"", Atlantic halibut ""Hippoglossus . . .",8, ,0,0, , ,,
30333,"Frozen sole ""Solea spp.""",80, ,0,7,Tons,"6,000",,
30339,"Frozen flat fish ""Pleuronectidae, Bothidae, Cynoglossidae, Soleidae, Scophthalmidae and Citharidae"" . . .",1,69,0,386,Tons,"2,119",,
30341,"Frozen albacore or longfinned tunas ""Thunnus alalunga""",16,21,0, , , ,,
30342,"Frozen yellowfin tunas ""Thunnus albacares""",90,33,0,1,Tons,"22,000",,
30343,"Frozen skipjack or stripe-bellied bonito ""Euthynnus -Katsuwonus- pelamis""",13, ,0,313,Tons,"1,300",,
30344,"Frozen bigeye tunas ""Thunnus obesus""", , , , , , ,,
30345,"Frozen Atlantic and Pacific bluefin tuna (Thunnus thynnus, Thunnus orientalis)", , , ,23, ,"8,435",,
30349,"Frozen tunas of the genus ""Thunnus"" (excl. Thunnus alalunga, Thunnus albacares, Thunnus obesus, . . .",42,-40,0,446,Tons,"2,726",,
30351,"Frozen herrings ""Clupea harengus, Clupea pallasii""",51,-47,0,47, ,"1,255",,
30353,"Frozen sardines ""Sardina pilchardus, Sardinops spp."", sardinella ""Sardinella spp."", brisling . . .",497,43,0,485,Tons,"1,767",,-
30354,"Frozen mackerel ""Scomber scombrus, Scomber australasicus, Scomber japonicus""",186,18,0,748,Tons,"2,040",,-
30355,"Frozen jack and horse mackerel ""Trachurus spp.""",588,132,0,157,Tons,"1,510",,
30356,"Frozen cobia ""Rachycentron canadum""", , , , ,Tons, ,,
30357,"Frozen swordfish ""Xiphias gladius""", , , , ,Tons, ,,
30359,"Frozen anchovies ""Engraulis spp."", Indian mackerels ""Rastrelliger spp."", seerfishes ""Scomberomorus . . .","1,601",198,0,"1,144",Tons,"3,847",,
30363,"Frozen cod ""Gadus morhua, Gadus ogac, Gadus macrocephalus""",2,-42,0,263,Tons,"4,871",,
30364,"Frozen haddock ""Melanogrammus aeglefinus""",29, ,0, , , ,,
30365,"Frozen coalfish ""Pollachius virens""",10, ,0, , , ,,
30366,"Frozen hake ""Merluccius spp., Urophycis spp.""",14, ,0,144, ,"1,250",,
30368,"Frozen blue whiting ""Micromesistius poutassou, Micromesistius australis""",125,3,0,472, ,888,,
30369,"Frozen fish of the families Bregmacerotidae, Euclichthyidae, Gadidae, Macrouridae, Melanonidae, . . .",223,11,0,98,Tons,"1,184",,
30381,Frozen dogfish and other sharks,41, ,0, , , ,,
30382,"Frozen rays and skates ""Rajidae""",126,484,0,15,Tons,"2,200",,
30383,"Frozen toothfish ""Dissostichus spp.""",7, ,0,83, ,"11,217",,
30384,"Frozen sea bass ""Dicentrarchus spp.""",152,17,0,40,Tons,"13,200",,5
30389,"Frozen fish, n.e.s.","5,400",2,0,"19,234",Tons,"1,525",,
30391,"Frozen fish livers, roes and milt", , , ,48,Tons,"4,542",,
30399,"Frozen fish fins, heads, tails, maws and other edible fish offal (excl. livers, roes, milt . . .",79,-24,0,1,Tons,"29,000",,
30431,"Fresh or chilled fillets of tilapia ""Oreochromis spp.""",33,78,0,41,Tons,"7,390",,
30432,"Fresh or chilled fillets of catfish ""Pangasius spp., Silurus spp., Clarias spp., Ictalurus . . .",1,4,0,2,Tons,"5,000",,
30433,"Fresh or chilled fillets of Nile perch ""Lates niloticus""",22,-8,0,55, ,"5,327",,
30439,"Fresh or chilled fillets of carp ""Cyprinus spp., Carassius spp., Ctenopharyngodon idellus, . . .",30,156,0,1,Tons,"5,000",,
30441,"Fresh or chilled fillets of Pacific salmon ""Oncorhynchus nerka, Oncorhynchus gorbuscha, Oncorhynchus . . .",5,-44,0,170, ,"12,747",,
30442,"Fresh or chilled fillets of trout ""Salmo trutta, Oncorhynchus mykiss, Oncorhynchus clarki, . . .",66, ,0,11, ,"10,182",,
30445,"Fresh or chilled fillets of swordfish ""Xiphias gladius""",3,195,0, ,Tons, ,,
30446,"Fresh or chilled fillets of toothfish ""Dissostichus spp.""",22,85,0, , , ,,
30447,Fresh or chilled fillets of dogfish and other sharks,4,215,0, , , ,,
30449,"Fresh or chilled fillets of fish, n.e.s.",238,-8,0,76,Tons,"26,118",,
30452,"Fresh or chilled meat, whether or not minced, of salmonidae (excl. fillets)",19, ,0,1, ,"12,000",,
30454,"Fresh or chilled meat, whether or not minced, of swordfish ""Xiphias gladius"" (excl. fillets)",2, ,0, ,Tons, ,,
30459,"Fresh or chilled fish meat, whether or not minced (excl. all fillets, tilapias, catfish, carp, . . .",17,-2,0,1,Tons,"56,000",,
30461,"Frozen fillets of tilapia ""Oreochromis spp.""",13,71,0,15,Tons,"2,467",,
30462,"Frozen fillets of catfish ""Pangasius spp., Silurus spp., Clarias spp., Ictalurus spp.""",851,43,0,71,Tons,"1,141",,
30463,"Frozen fillets of Nile perch ""Lates niloticus""",140,10,0,640, ,"6,164",,
30469,"Frozen fillets of carp ""Cyprinus spp., Carassius spp., Ctenopharyngodon idellus, Hypophthalmichthys . . .", , , ,425,Tons,"2,033",,
30471,"Frozen fillets of cod ""Gadus morhua, Gadus ogac, Gadus macrocephalus""","1,079",68,0,66,Tons,"10,121",,
30472,"Frozen fillets of haddock ""Melanogrammus aeglefinus""",2, ,0,1, ,"11,000",,
30473,"Frozen fillets of coalfish ""Pollachius virens""",7, ,0,0, , ,,
30474,"Frozen fillets of hake ""Merluccius spp., Urophycis spp.""",7, ,0,3, ,"4,333",,
30475,"Frozen fillets of Alaska pollack ""Theragra chalcogramma""",1, ,0,96, ,"3,219",,
30479,"Frozen fillets of fish of the families Bregmacerotidae, Euclichthyidae, Gadidae, Macrouridae, . . .",111,366,0,5,Tons,"5,400",,
30481,"Frozen fillets of Pacific salmon ""Oncorhynchus nerka, Oncorhynchus gorbuscha, Oncorhynchus . . .",474,7,0,499, ,"13,116",,
30482,"Frozen fillets of trout ""Salmo trutta, Oncorhynchus mykiss, Oncorhynchus clarki, Oncorhynchus . . .",16,25,0,5, ,"8,800",,
30483,"Frozen fillets of flat fish ""Pleuronectidae, Bothidae, Cynoglossidae, Soleidae, Scophthalmidae . . .",65,293,0,59, ,"7,780",,
30484,"Frozen fillets of swordfish ""Xiphias gladius""",5, ,0, ,Tons, ,,
30487,"Frozen fillets of tuna ""of the genus Thunnus"", skipjack or stripe-bellied bonito ""Euthynnus . . .",97,15,0,160,Tons,"13,656",,
30489,"Frozen fish fillets, n.e.s.","1,597",12,0,441,Tons,"8,422",,
30493,"Frozen meat, whether or not minced, of tilapia ""Oreochromis spp."", catfish ""Pangasius spp., . . .", , , ,0,Tons, ,,
30494,"Frozen meat, whether or not minced, of Alaska pollack ""Theragra chalcogramma"" (excl. fillets)", , , , , , ,,
30499,Frozen fish meat n.e.s. (excl. fillets),774,-22,0,338,Tons,"2,769",,
30510,"Flours, meals and pellets of fish, fit for human consumption",31,45,0,8,Tons,"2,750",,
30539,"Fish fillets, dried, salted or in brine, but not smoked (excl. tilapia, catfish, carp, eels, . . .",39,0,0,2,Tons,"12,500",,
30541,"Smoked Pacific salmon ""Oncorhynchus nerka, Oncorhynchus gorbuscha, Oncorhynchus keta, Oncorhynchus . . .",260,11,0,54, ,"20,759",,
30543,"Smoked trout ""Salmo trutta, Oncorhynchus mykiss, Oncorhynchus clarki, Oncorhynchus aguabonita, . . .",3,29,0,2, ,"15,500",,
30549,"Smoked fish, incl. fillets (excl. offal, Pacific salmon, Atlantic salmon, Danube salmon, herring, . . .",243,-14,0,12,Tons,"10,833",,
30551,"Dried cod ""Gadus morhua, Gadus ogac, Gadus macrocephalus"", even salted, not smoked (excl. fillets . . .",1,124,0,0, , ,,
30552,"Dried tilapia ""Oreochromis spp."", catfish ""Pangasius spp., Silurus spp., Clarias spp., Ictalurus . . .",239,-11,4, , , ,,
30553,"Dried fish of the families Bregmacerotidae, Euclichthyidae, Gadidae, Macrouridae, Melanonidae, . . .",5,91,0,0,Tons, ,,
30554,"Dried herrings ""Clupea harengus, Clupea pallasii"", anchovies ""Engraulis spp."", sardines ""Sardina . . .","22,518",5,21,7,Tons,"9,286",,
30559,"Fish, dried, even salted but not smoked, n.e.s. (excl. fillets and offal)",256,-47,0,0,Tons, ,,
30563,"Anchovies ""Engraulis spp."", salted or in brine only (excl. fillets and offal)", , , ,1,Tons,"9,000",,
30569,"Fish, salted or in brine only (excl. fillets, offal, herring, cod, anchovies, tilapia, catfish, . . .",3,-23,0,89,Tons,"2,045",,
30571,"Shark fins, smoked, dried, salted or in brine",562,-38,0, , , ,,
30572,"Fish heads, tails and maws, smoked, dried, salted or in brine","1,581",-34,0,1,Tons,"200,000",,
30579,"Fish fins and other edible fish offal, smoked, dried, salted or in brine (excl. heads, tails, . . .",201,-27,0, ,Tons, ,,
30611,"Frozen rock lobster and other sea crawfish ""Palinurus spp."", ""Panulirus spp."" and ""Jasus spp."", . . .","15,837",27,2,100,Tons,"17,270",,
30612,"Frozen lobsters ""Homarus spp."", even smoked, whether in shell or not, incl. lobsters in shell, . . .","8,819",18,1,152,Tons,"26,776",,-
30614,"Frozen crabs, even smoked, whether in shell or not, incl. crabs in shell, cooked by steaming . . .",356,-14,0,464,Tons,"14,412",,-
30616,"Frozen cold-water shrimps and prawns ""Pandalus spp., Crangon crangon"", even smoked, whether . . .","4,969",20,0,150,Tons,"5,040",,
30617,"Frozen shrimps and prawns, even smoked, whether in shell or not, incl. shrimps and prawns in . . .","138,616",-2,1,"28,005",Tons,"6,464",,
30619,"Frozen crustaceans, even smoked, fit for human consumption, whether in shell or not, incl. . . .",648,-2,1,91,Tons,"7,242",,
30631,"Rock lobster and other sea crawfish ""Palinurus spp., Panulirus spp. and Jasus spp."", whether . . .", , , ,47,Tons,"35,340",,
30632,"Lobsters ""Homarus spp."", whether in shell or not, live, fresh or chilled",70,-27,0,293,Tons,"24,362",,
30633,"Crabs, whether in shell or not, live, fresh or chilled",10,-29,0,147,Tons,"23,082",,
30634,"Norway lobsters ""Nephrops norvegicus"", whether in shell or not, live, fresh or chilled", , , ,10,Tons,"23,900",,
30635,"Cold-water shrimps and prawns ""Pandalus spp., Crangon crangon"", whether in shell or not, live, . . .",1,-28,0,162,Tons,"10,722",,
30636,"Shrimps and prawns, whether in shell or not, live, fresh or chilled (excl. cold-water shrimps . . .",229,9,0,"1,981",Tons,"6,488",,
30639,"Crustaceans, fit for human consumption, whether in shell or not, live, fresh or chilled (excl. . . .",23,87,0,22,Tons,"6,955",,
30692,"Lobsters ""Homarus spp."", whether in shell or not, dried, salted, smoked or in brine, incl. . . .", , , ,0,Tons, ,,
30693,"Crabs, whether in shell or not, dried, salted, smoked or in brine, incl. crabs in shell, cooked . . .",1,-43,0,0,Tons, ,,
30695,"Shrimps and prawns, whether in shell or not, dried, salted, smoked or in brine, incl. ones . . .",19,-33,0,290,Tons,"4,490",,
30699,"Crustaceans, fit for human consumption, whether in shell or not, dried, salted, smoked or in . . .",7,-23,0,4, ,"6,000",,
30711,"Oysters, even in shell, live, fresh or chilled",549,57,0,180,Tons,"11,439",,
30712,"Oysters, even in shell, frozen",51,-21,0,2,Tons,"6,500",,
30719,"Oysters, even in shell, smoked, dried, salted or in brine",20,-25,0,1, ,"40,000",,
30721,"Live, fresh or chilled, scallops and other molluscs of the family Pectinidae, even in shell",14,-56,0,52, ,"12,173",,
30722,"Scallops and other molluscs of the family Pectinidae, frozen, even in shell",319,-6,0,281,Tons,"17,409",,
30729,"Scallops and other molluscs of the family Pectinidae, smoked, dried, salted or in brine, even . . .",54,2,0,4,Tons,"20,250",,
30731,"Live, fresh or chilled, not smoked, mussels ""Mytilus spp., Perna spp."", with or without shell",135,26,0,162,Tons,"4,377",,
30732,"Mussels ""Mytilus spp., Perna spp."", frozen, even in shell",756,11,0,973,Tons,"4,799",,
30739,"Mussels ""Mytilus spp., Perna spp."", smoked, dried, salted or in brine, even in shell",113,12,0,19,Tons,"3,789",,
30742,"Cuttle fish and squid, live, fresh or chilled, with or without shell",743,9,0,120,Tons,"5,108",,
30743,"Cuttle fish and squid, frozen, with or without shell","5,938",48,0,"5,780",Tons,"4,021",,
30749,"Cuttle fish and squid, smoked, dried, salted or in brine, with or without shell","1,188",15,0,143,Tons,"2,993",,
30751,"Octopus ""Octopus spp."", live, fresh or chilled",1,-50,0,0,Tons, ,,
30752,"Octopus ""Octopus spp."", frozen",302,19,0,539,Tons,"8,124",,
30759,"Octopus ""Octopus spp."", smoked, dried, salted or in brine",6,-20,0,64,Tons,"10,406",,
30771,"Live, fresh or chilled, even in shell, clams, cockles and ark shells ""families Arcidae, Arcticidae, . . .",4,-4,0,79,Tons,"6,177",,
30772,"Frozen, even in shell, clams, cockles and ark shells ""families Arcidae, Arcticidae, Cardiidae, . . .",20,22,0,43, ,"4,721",,
30779,"Smoked, dried, salted or in brine, even in shell, clams, cockles and ark shells ""families Arcidae, . . .",11,-2,0,10,Tons,"4,400",,
30781,"Live, fresh or chilled, even in shell, abalone ""Haliotis spp.""",651,166,0,11, ,"27,818",,
30783,"Frozen, even in shell, abalone ""Haliotis spp.""", , , ,0, , ,,
30784,"Frozen, even in shell, stromboid conchs ""Strombus spp.""",8,384,0, ,Tons, ,,
30787,"Smoked, dried, salted or in brine, even in shell, abalone ""Haliotis spp.""","4,483",272,7, , , ,,
30791,"Live, fresh or chilled molluscs, even in shell (excl. oysters, scallops of the genera Pecten, . . .",9,-30,0,4, ,"26,500",,
30792,"Molluscs, even in shell, frozen (excl. oysters, scallops of the genera Pecten, Chlamys or Placopecten, . . .",45,106,0,89,Tons,"15,719",,
30799,"Molluscs, even in shell, smoked, dried, salted or in brine (excl. oysters, scallops of the . . .",12,15,0,8,Tons,"12,000",,
30819,"Smoked, dried, salted or in brine, sea cucumbers ""Stichopus japonicus, Holothuroidea""",267,-22,0, , , ,,
30821,"Live, fresh or chilled, sea urchins ""Strongylocentrotus spp., Paracentrotus lividus, Loxechinus . . .", , , ,1, ,"234,000",,
30890,"Live, fresh, chilled, frozen, dried, salted or in brine, even smoked, aquatic invertebrates . . .",22,-19,0,1,Tons,"231,000",,
40110,"Milk and cream of a fat content by weight of <= 1%, not concentrated nor containing added sugar . . .","1,191",46,0,0,Tons, ,,-
40120,"Milk and cream of a fat content by weight of > 1% but <= 6%, not concentrated nor containing . . .",799,20,0,0,Tons, ,,16
40140,"Milk and cream of a fat content by weight of > 6% but <= 10%, not concentrated nor containing . . .",97,-26,0,102,Tons,"2,373",,
40150,"Milk and cream of a fat content by weight of > 10%, not concentrated nor containing added sugar . . .",656,37,0,0,Tons, ,,
40210,"Milk and cream in solid forms, of a fat content by weight of <= 1,5%","3,325",-43,0,"30,140",Tons,"3,783",,9
40221,"Milk and cream in solid forms, of a fat content by weight of > 1,5%, unsweetened","44,336",29,0,"84,778",Tons,"4,044",,-
40229,"Milk and cream in solid forms, of a fat content by weight of > 1,5%, sweetened","6,170",9,1,"18,573",Tons,"3,678",,-
40291,"Milk and cream, concentrated but unsweetened (excl. in solid forms)",967,-27,0,"39,228",Tons,"1,758",,-
40299,"Milk and cream, concentrated and sweetened (excl. in solid forms)","5,226",22,1,"3,138",Tons,"2,573",,-
40310,"Yogurt, whether or not flavoured or containing added sugar or other sweetening matter, fruits, . . .",356,-10,0,950,Tons,"2,740",,-
40390,"Buttermilk, curdled milk and cream, kephir and other fermented or acidified milk and cream, . . .",136,3,0,"6,660",Tons,"3,101",,41
40410,"Whey and modified whey, whether or not concentrated or containing added sugar or other sweetening . . .",3,0,0,"10,330",Tons,"1,963",,55
40490,"Products consisting of natural milk constituents, whether or not sweetened, n.e.s.",16,-35,0,"3,767",Tons,"2,230",,-
40510,Butter (excl. dehydrated butter and ghee),394,-27,0,"11,860",Tons,"6,506",,15
40520,"Dairy spreads of a fat content, by weight, of >= 39% but < 80%",2,-70,0,94,Tons,"8,309",,
40590,"Fats and oils derived from milk, and dehydrated butter and ghee (excl. natural butter, recombined . . .","1,071",-3,0,"7,965",Tons,"6,728",,29
40610,"Fresh cheese ""unripened or uncured cheese"", incl. whey cheese, and curd","1,058",-23,0,"11,523",Tons,"5,119",,3
40620,"Grated or powdered cheese, of all kinds",430,22,0,"9,126",Tons,"4,221",,-
40630,"Processed cheese, not grated or powdered",431,2,0,"16,521",Tons,"5,996",,-
40640,"Blue-veined cheese and other cheese containing veins produced by ""Penicillium roqueforti""",19,-7,0,156,Tons,"9,436",,
40690,"Cheese (excl. fresh cheese, incl. whey cheese, curd, processed cheese, blue-veined cheese and . . .","1,209",54,0,"16,735",Tons,"6,587",,-
40711,"Fertilised eggs for incubation, of domestic fowls",27, ,0,0,Tons, ,,
40719,Fertilised birds' eggs for incubation (excl. of domestic fowls), , , ,8,Tons,"8,625",,
40721,"Fresh eggs of domestic fowls, in shell (excl. fertilised for incubation)","2,210",13,0,0,Tons, ,,
40729,"Fresh birds' eggs, in shell (excl. of domestic fowls, and fertilised for incubation)",34,-37,0,0,Tons, ,,
40790,"Birds' eggs, in shell, preserved or cooked",4,-45,0,654,Tons,"4,249",,
40811,"Dried egg yolks, whether or not sweetened",1,-56,0,111,Tons,"5,874",,
40819,"Egg yolks, fresh, cooked by steaming or boiling in water, moulded, frozen or otherwise preserved, . . .",28,-23,0,716,Tons,"3,170",,
40891,"Dried birds' eggs, not in shell, whether or not sweetened (excl. egg yolks)",32,279,0,127,Tons,"5,850",,
40899,"Birds' eggs, not in shell, fresh, cooked by steaming or boiling in water, moulded, frozen or . . .",278,-11,0,"1,497",Tons,"2,043",,
