320641,Ultramarine and preparations based thereon of a kind used for colouring any material or produce . . .,6,72,0,453,Tons,"3,587",,9
320642,Lithopone and other pigments and preparations based on zinc sulphide of a kind used for colouring . . ., , , ,67,Tons,"1,045",,
320649,"Inorganic or mineral colouring matter, n.e.s.; preparations based on inorganic or mineral colouring . . .","28,646",-7,1,"8,559",Tons,"4,223",,-
320650,"Inorganic products of a kind used as luminophores, whether or not chemically defined",38,2,0,52,Tons,"2,731",,
320710,"Prepared pigments, prepared opacifiers, prepared colours and similar preparations of a kind . . .",337,-31,0,"3,555",Tons,"4,957",,"1,243"
320720,"Vitrifiable enamels and glazes, engobes ""slips"" and similar preparations of the kind used in . . .",407,10,0,"9,886",Tons,918,,6
320730,"Liquid lustres and similar preparations of the kind used in the ceramic, enamelling or glass . . .",193,-40,0,15,Tons,"757,200",,168
320740,"Glass frit and other glass in the form of powder, granules or flakes",420,93,0,"26,012",Tons,972,,155
320810,"Paints and varnishes, incl. enamels and lacquers, based on polyesters, dispersed or dissolved . . .","8,938",12,0,0,Tons, ,,-
320820,"Paints and varnishes, incl. enamels and lacquers, based on acrylic or vinyl polymers, dispersed . . .","8,152",27,0,0,Tons, ,,642
320890,"Paints and varnishes based, incl. enamels and lacquers, on synthetic polymers or chemically . . .","70,211",5,1,0,Tons, ,,"9,238"
320910,"Paints and varnishes, incl. enamels and lacquers, based on acrylic or vinyl polymers, dispersed . . .","3,836",9,0,0,Tons, ,,-
320990,"Paints and varnishes, incl. enamels and lacquers, based on synthetic or chemically modified . . .","10,568",10,0,0,Tons, ,,464
321000,"Paints and varnishes, incl. enamels, lacquers and distempers (excl. those based on synthetic . . .","1,101",-14,0,0,Tons, ,,"1,442"
321100,Prepared driers,"9,235",-1,4,464,Tons,"5,006",,440
321210,Stamping foils of a kind used in the printing of book bindings or hatband leather,403,-3,0,0,Tons, ,,129
321290,"Pigments, incl. metallic powders and flakes, dispersed in non-aqueous media, in liquid or paste . . .",828,-44,0,"1,400",Tons,"9,405",,421
321310,"Sets of artist's, student's or signboard painter's colours, modifying tints, amusement colours . . .",7,-29,0,0,Tons, ,,4
321390,"Artist's, student's or signboard painter's colours, modifying tints, amusement colours and . . .",818,20,0,0,Tons, ,,-
321410,"Glaziers' putty, grafting putty, resin cements, caulking compounds and other mastics; painters' . . .","24,935",20,0,"18,413",Tons,"4,275",,376
321490,"Non-refractory surfacing preparations for facades, inside walls, floors, ceilings and the like","12,355",-4,0,"4,249",Tons,"2,711",,812
321511,"Black printing ink, whether or not concentrated or solid",788,12,0,"1,151",Tons,"8,841",,321
321519,"Printing ink, whether or not concentrated or solid (excl. black ink)","6,268",55,0,"8,080",Tons,"6,766",,996
321590,"Ink, whether or not concentrated or solid (excl. printing ink)","2,266",4,0,0,Tons, ,,85
330112,"Oils of sweet and bitter orange, whether or not terpeneless, incl. concretes and absolutes . . .",20,-57,0,66,Tons,"11,515",,-
330113,"Oils of lemon, whether or not terpeneless, incl. concretes and absolutes",84,42,0,8,Tons,"19,250",,
330119,"Essential oils of citrus fruit, whether or not terpeneless, incl. concretes and absolutes (excl. . . .",77,-10,0,0,Tons, ,,1
330124,"Oils of peppermint ""Mentha piperita"", whether or not terpeneless, incl. concretes and absolutes", , , ,10,Tons,"58,400",,
330125,"Oils of mints, whether or not terpeneless, incl. concretes and absolutes (excl. those of peppermint . . .",33,-93,0,0,Tons, ,,-
330129,"Essential oils, whether or not terpeneless, incl. concretes and absolutes (excl. those of citrus . . .","8,971",-2,0,0,Tons, ,,764
330130,Resinoids,287,-8,1,274,Tons,"7,584",,-
330190,"Extracted oleoresins; concentrates of essential oils in fats, fixed oils, waxes and the like, . . .","8,245",31,1,0,Tons, ,,"43,758"
330210,"Mixtures of odoriferous substances and mixtures, incl. alcoholic solutions, with a basis of . . .","6,301",26,0,"5,921",Tons,"25,315",,628
330290,"Mixtures of odoriferous substances and mixtures, incl. alcoholic solutions, based on one or . . .","41,453",17,0,"11,139",Tons,"37,207",,-
330300,"Perfumes and toilet waters (excl. aftershave lotions, personal deodorants and hair lotions)","403,252",34,2,0,Tons, ,,"3,781"
330410,Lip make-up preparations,"3,818",-15,0,0,Tons, ,,-
330420,Eye make-up preparations,"3,769",12,0,"2,232",Tons,"36,659",,-
330430,Manicure or pedicure preparations,507,-31,0,0,Tons, ,,7
330491,"Make-up or skin care powders, incl. baby powders, whether or not compressed (excl. medicaments)","5,857",14,0,0,Tons, ,,-
330499,"Beauty or make-up preparations and preparations for the care of the skin (other than medicaments), . . .","65,585",9,0,0,Tons, ,,137
330510,Shampoos,"24,744",-1,0,0,Tons, ,,"1,679"
330520,Preparations for permanent waving or straightening,824,2,0,0,Tons, ,,"1,319"
330530,Hair lacquers,324,2,0,0,Tons, ,,-
330590,"Preparations for use on the hair (excl. shampoos, preparations for permanent waving or straightening . . .","29,589",8,0,0,Tons, ,,"2,545"
330610,"Dentifrices, incl. those used by dental practitioners","17,301",5,0,"19,599",Tons,"3,668",,"2,959"
330620,"Yarn used to clean between the teeth ""dental floss"", in individual retail packages",22,-19,0,273,Tons,"18,059",,3
330690,"Preparations for oral or dental hygiene, incl. denture fixative pastes and powders (excl. dentifrices . . .","4,790",24,0,0,Tons, ,,182
330710,"Shaving preparations, incl. pre-shave and aftershave products",914,10,0,0,Tons, ,,-
330720,Personal deodorants and antiperspirants,"27,812",-4,1,0,Tons, ,,"3,493"
330730,Perfumed bath salts and other bath and shower preparations,"4,987",31,1,0,Tons, ,,7
330741,Agarbatti and other odoriferous preparations which operate by burning,"3,926",18,1,0,Tons, ,,"8,341"
330749,"Preparations for perfuming or deodorising rooms, incl. odoriferous preparations used during . . .","9,253",15,0,"5,059",Tons,"7,624",,370
330790,"Depilatories and other perfumery, toilet or cosmetic preparations, n.e.s.","10,701",39,0,0,Tons, ,,-
340111,"Soap and organic surface-active products and preparations, in the form of bars, cakes, moulded . . .","12,700",-20,0,0,Tons, ,,"1,901"
340119,"Soap and organic surface-active products and preparations, in the form of bars, cakes, moulded . . .","3,671",-11,0,0,Tons, ,,360
340120,"Soap in the form of flakes, granules, powder, paste or in aqueous solution","18,700",6,1,"55,804",Tons,"1,277",,"3,038"
340130,"Organic surface-active products and preparations for washing the skin, in the form of liquid . . .","15,059",35,0,"24,964",Tons,"4,403",,621
340211,"Anionic organic surface-active agents, whether or not put up for retail sale (excluding soap)","66,119",50,2,"22,784",Tons,"1,892",,327
340212,"Cationic organic surface-active agents, whether or not put up for retail sale (excluding soap)",440,-3,0,0,Tons, ,,256
340213,"Non-ionic organic surface-active agents, whether or not put up for retail sale (excluding soap)","7,051",12,0,0,Tons, ,,"2,729"
340219,"Organic surface-active agents, whether or not put up for retail sale (excluding anionic, cationic . . .","2,945",1,0,0,Tons, ,,-
340220,"Surface-active preparations, washing preparations, auxiliary washing preparations and cleaning . . .","8,546",-13,0,0,Tons, ,,716
340290,"Surface-active preparations, washing preparations, incl. auxiliary washing preparations and . . .","15,879",15,0,0,Tons, ,,"2,736"
340311,Textile lubricant preparations and preparations of a kind used for the oil or grease treatment . . .,"3,109",4,1,371,Tons,"2,585",,175
340319,"Lubricant preparations, incl. cutting-oil preparations, bolt or nut release preparations, anti-rust . . .","24,792",31,1,"10,717",Tons,"4,830",,-
340391,Textile lubricant preparations and preparations of a kind used for the oil or grease treatment . . .,88,-33,0,864,Tons,"2,483",,127
340399,"Lubricant preparations, incl. cutting-oil preparations, bolt or nut release preparations, anti-rust . . .","23,871",20,0,"7,758",Tons,"7,972",,173
340420,"Poly""oxyethylene"" [polyethylene glycol] waxes",29,-10,0,"8,853",Tons,"1,173",,140
340490,"Artificial waxes and prepared waxes (excl. poly""oxyethylene"" [polyethylene glycol] waxes)","9,962",42,0,"6,604",Tons,"3,645",,-
340510,"Polishes, creams and similar preparations, for footwear or leather, whether or not in the form . . .",109,-4,0,"1,004",Tons,"5,025",,57
340520,"Polishes, creams and similar preparations, for the maintenance of wooden furniture, floors . . .",88,22,0,341,Tons,"4,419",,-
340530,"Polishes and similar preparations for coachwork, whether or not in the form of paper, wadding, . . .",233,23,0,"1,131",Tons,"5,739",,29
340540,"Scouring pastes and powders and other scouring preparations, whether or not in the form of . . .",27,34,0,580,Tons,"2,545",,1
340590,"Glass or metal polishes, whether or not in the form of paper, wadding, felt, nonwovens, cellular . . .",388,-8,0,"1,494",Tons,"4,982",,16
340600,"Candles, tapers and the like",526,19,0,0,Tons, ,,57
340700,"Modelling pastes, incl. those put up for children's amusement; preparations known as ""dental . . .",11,-48,0,"2,555",Tons,"6,484",,50
350110,Casein, , , ,39,Tons,"10,077",,
350190,Caseinates and other casein derivatives; casein glues (excl. those put up for retail sale as . . .,2,-79,0,67,Tons,"31,925",,5
350211,"Egg albumin, dried ""e.g. in sheets, scales, flakes, powder""",1,-30,0,86,Tons,"13,767",,
350219,"Egg albumin (excl. dried [e.g. in sheets, scales, flakes, powder])",22,0,0,212,Tons,"3,212",,
350220,"Milk albumin ""lactalbumin"", incl. concentrates of two or more whey proteins containing by weight . . .",292,160,0,205,Tons,"11,532",,-
350290,"Albumins, albuminates and other albumin derivatives (excl. egg albumin and milk albumin [incl. . . .",17,21,0,0,Tons, ,,
350300,"Gelatin, whether or not in square or rectangular sheets, whether or not surface-worked or coloured, . . .",19,-11,0,"1,647",Tons,"7,733",,218
350400,"Peptones and their derivatives; other protein substances and their derivatives, n.e.s.; hide . . .",72,121,0,894,Tons,"6,247",,-
350510,"Dextrins and other modified starches, e.g. pregelatinised or esterified starches","2,978",29,0,"23,630",Tons,"1,154",,720
350520,"Glues based on starches, dextrins or other modified starches (excl. those put up for retail . . .",367,-16,0,580,Tons,"1,290",,95
350610,"Products suitable for use as glues or adhesives put up for retail sale as glues or adhesives, . . .","4,097",20,0,"8,133",Tons,"5,780",,503
350691,Adhesives based on polymers of headings 3901 to 3913 or on rubber (excl. put up for retail . . .,"5,452",-7,0,"32,163",Tons,"2,628",,720
350699,"Glues, prepared, and other prepared adhesives, n.e.s.","3,800",0,0,"4,689",Tons,"3,163",,"1,674"
350710,Rennet and concentrates thereof, , , ,11,Tons,"42,727",,
350790,"Enzymes and prepared enzymes, n.e.s. (excl. rennet and concentrates thereof)",853,-11,0,"1,831",Tons,"8,881",,561
360100,Propellent powders, , , ,103,Tons,"24,408",,
360200,Prepared explosives (excl. propellent powders),23, ,0,383,Tons,"7,608",,6
360300,Safety fuses; detonating fuses; percussion or detonating caps; igniters; electric detonators . . ., , , ,0,No quantity, ,,1
360410,Fireworks,1, ,0,201,Tons,"14,517",,
360490,"Signalling flares, rain rockets, fog signals and other pyrotechnic articles (excl. fireworks . . .",1,-33,0,90,Tons,"39,622",,
360500,Matches (excl. pyrotechnic articles of heading 3604),168,-3,0,0,Tons, ,,
360610,Liquid or liquefied-gas fuels in containers of a kind used for filling or refilling cigarette . . .,95,-16,0,0,Tons, ,,5
360690,"Ferro-cerium and other pyrophoric alloys in all forms; metaldehyde, hexamethylenetetramine . . .","1,662",-7,1,517,Tons,"1,153",,-
370110,"Photographic plates and film in the flat, sensitised, unexposed, for X-ray (excl. of paper, . . .","1,108",25,0,0,Tons, ,,"2,090"
370120,"Instant print film in the flat, sensitised, unexposed, whether or not in packs",401,31,0,0,Tons, ,,9
370130,"Photographic plates and film in the flat, sensitised, unexposed, with any side > 255 mm",53,-5,0,0,Tons, ,,125
370191,"Photographic plates and film in the flat, sensitised, unexposed, of any material other than . . .", , , ,1,Tons,"3,000",,
370199,"Photographic plates and film in the flat for monochrome photography, sensitised, unexposed, . . .",28,2,0,0,Tons, ,,11
370210,"Photographic film in rolls, unexposed, for X-ray (excl. of paper, paperboard or textiles)",10,-39,0,0,Tons, ,,71
370231,"Photographic film ""incl. instant print film"", in rolls, sensitised, unexposed, without perforations, . . .",7,49,0,0,Tons, ,,
370232,"Photographic film ""incl. instant print film"", in rolls, sensitised, unexposed, without perforations, . . .", , , ,0,Tons, ,,
370239,"Photographic film ""incl. instant print film"", sensitised, in rolls, unexposed, without perforations, . . .",1,-32,0,0,1000 square meters, ,,
370241,"Photographic film ""incl. instant print film"", sensitised, in rolls, unexposed, without perforations, . . .",18,-30,0, , , ,,
370242,"Photographic film ""incl. instant print film"", sensitised, in rolls, unexposed, without perforations, . . .", , , , ,Tons, ,,
370243,"Photographic film ""incl. instant print film"", sensitised, in rolls, unexposed, without perforations, . . .",23,31,0,0,Tons, ,,
370244,"Photographic film ""incl. instant print film""m, sensitised, in rolls, unexposed, without perforations, . . .", , , ,0, , ,,
370254,"Photographic film, sensitised, in rolls, unexposed, with perforations, for colour photography . . .", , , ,0, , ,,
370256,"Photographic film, sensitised, in rolls, unexposed, with perforations, for colour photography . . .", , , ,1, ,"29,000",,
370296,"Photographic film, sensitised, in rolls, unexposed, with perforations, for monochrome photography, . . .", , , ,0, , ,,
370297,"Photographic film, sensitised, in rolls, unexposed, with perforations, for monochrome photography, . . .", , , ,0, , ,,
370298,"Photographic film, sensitised, in rolls, unexposed, with perforations, for monochrome photography, . . .",1,-87,0,0,1000 meters, ,,
370310,"Photographic paper, paperboard and textiles, sensitised, unexposed, in rolls > 610 mm wide",169,-23,0,0,Tons, ,,-
370320,"Photographic paper, paperboard and textiles, sensitised, unexposed, for colour photography . . .",344,-16,0,0,Tons, ,,977
370390,"Photographic paper, paperboard and textiles, sensitised, unexposed, for monochrome photography . . .",285,5,1,0,Tons, ,,
370400,"Photographic plates, film, paper, paperboard and textiles, exposed but not developed",637,-8,2,0,Tons, ,,1
370500,"Photographic plates and film, exposed and developed (excl. products made of paper, paperboard . . .",91,80,0,0,Tons, ,,
370610,"Cinematographic film, exposed and developed, whether or not incorporating soundtrack or consisting . . .",6,-26,0,0,1000 meters, ,,
370690,"Cinematographic film, exposed and developed, whether or not incorporating soundtrack or consisting . . .", , , , ,1000 meters, ,,
370710,"Sensitising emulsions ""for photographic uses""",17,-4,0,29,Tons,"7,724",,
370790,"Preparation of chemicals for photographic uses, incl. unmixed products put up in measured portions . . .",779,-11,0,"2,106",Tons,"5,721",,42
380110,"Artificial graphite (excl. retort graphite, retort carbon and goods of artificial graphite, . . .","10,453",72,0,"3,378",Tons,"1,190",,14
380120,Colloidal or semi-colloidal graphite,70,-76,0,28,Tons,"7,036",,
380130,Carbonaceous pastes for electrodes and similar pastes for furnace linings,288,40,0,"6,613",No quantity,"1,136",,
380190,"Preparations based on graphite or other carbon in the form of pastes, blocks, plates or other . . .","2,547",43,0,"1,079",Tons,"2,420",,-
380210,"Activated carbon (excl. medicaments or deodorant products for fridges, vehicles etc., put up . . .",316,9,0,"6,643",Tons,"2,381",,159
380290,"Activated kieselguhr and other activated natural mineral products; animal black, whether or . . .",87,-34,0,"4,837",Tons,795,,93
380300,"Tall oil, whether or not refined",83,147,0,145, ,"2,028",,-
380400,"Residual lyes from the manufacture of wood pulp, whether or not concentrated, desugared or . . .",207,22,0,"4,160",Tons,579,,933
380510,"Gum, wood or sulphate turpentine oils",111,467,0,37,Tons,"1,892",,297
380590,Crude dipentene; sulphite turpentine and other crude para-cymene; terpenic oils produced by . . ., , , ,892,Tons,"5,841",,78
380610,Rosin and resin acids,9,10,0,"1,729",Tons,"1,873",,56
380620,"Salts of rosin, of resin acids or of derivatives of rosin or resin acids (excl. salts of rosin . . .", , , , ,Tons, ,,
380630,Ester gums, , , ,168,Tons,"2,744",,
380690,"Derivatives of rosin, incl. salts of rosin adducts, and of resin acids, light and heavy resin . . .",3,-59,0,"1,268",Tons,"2,626",,-
380700,Wood tar; wood tar oils; wood creosote; wood naphtha; vegetable pitch; brewer's pitch and similar . . .,477,64,0,1,Tons,"54,000",,
380852,"DDT ""ISO"" ""clofenotane ""INN"""", in packings of a net weight content <= 300 g",27,48,0,2,Tons,"53,000",,
380859,Goods of heading 3808 containing one or more of the following substances: alachlor (ISO); aldicarb . . .,19,-57,0,7,Tons,"2,429",,
380862,"Goods of heading 3808, containing alpha-cypermethrin ""ISO"", bendiocarb ""ISO"", bifenthrin ""ISO"", . . .", , , ,63,Tons,"9,000",,
380869,"Goods of heading 3808, containing alpha-cypermethrin ""ISO"", bendiocarb ""ISO"", bifenthrin ""ISO"", . . .",86,-29,0,337,Tons,"13,027",,
380891,"Insecticides, put up in forms or packings for retail sale or as preparations or articles (excl. . . .","10,599",-5,0,0,Tons, ,,
380892,"Fungicides, put up in forms or packings for retail sale or as preparations or articles (excl. . . .","1,814",58,0,"14,548",Tons,"1,502",,
380893,"Herbicides, anti-sprouting products and plant-growth regulators, put up in forms or packings . . .","4,795",84,0,"1,943",Tons,"6,130",,
380894,"Disinfectants, put up in forms or packings for retail sale or as preparations or articles (excl. . . .","6,220",-14,0,"5,906",Tons,"3,768",,
380899,Rodenticides and other plant protection products put up for retail sale or as preparations . . .,"4,987",77,0,"2,865",Tons,"3,582",,
380910,"Finishing agents, dye carriers to accelerate the dyeing or fixing of dyestuffs and other products . . .",16,-40,0,418,Tons,"2,196",,14
380991,"Finishing agents, dye carriers to accelerate the dyeing or fixing of dyestuffs, and other products . . .","1,190",21,0,"2,238",Tons,"2,265",,260
380992,"Finishing agents, dye carriers to accelerate the dyeing or fixing of dyestuffs, and other products . . .",1,-62,0,"4,707",Tons,"1,633",,52
380993,"Finishing agents, dye carriers to accelerate the dyeing or fixing of dyestuffs, and other products . . .",33,-13,0,218,No quantity,"4,537",,30
381010,"Pickling preparations for metal surfaces; soldering, brazing or welding pastes and powders . . .",736,25,0,"2,475",Tons,"3,057",,152
381090,"Fluxes and other auxiliary preparations for soldering, brazing or welding; preparations of . . .",30,-25,0,"1,789",Tons,"2,139",,81
381111,Anti-knock preparations for motor fuels based on lead compounds, , , ,6,Tons,"4,667",,
381119,Anti-knock preparations for motor fuels (excl. those based on lead compounds),818,6,1,664,Tons,"3,649",,179
381121,Prepared additives for oil lubricants containing petroleum oil or bituminous mineral oil,"13,115",20,0,"112,411",Tons,"3,496",,"1,766"
381129,Prepared additives for oil lubricants not containing petroleum oil or bituminous mineral oil,"4,452",38,0,"1,030",Tons,"5,560",,797
381190,"Oxidation inhibitors, gum inhibitors, viscosity improvers, anti-corrosive preparations and . . .","9,000",2,0,"13,196",Tons,"2,983",,-
381210,Prepared rubber accelerators, , , ,908,Tons,"4,214",,181
381220,"Compound plasticisers for rubber or plastics, n.e.s.","6,018",42,1,"3,647",Tons,"2,060",,"2,060"
381231,"Mixtures of oligomers of 2,2,4-trimethyl-1,2-dihydroquinoline ""TMQ""",445,-25,0,362,Tons,"2,000",,
381239,Anti-oxidising preparations and other compound stabilisers for rubber or plastics (excl. mixtures . . .,"7,427",19,0,"11,882",Tons,"4,247",,
381300,Preparations and charges for fire-extinguishers; charged fire-extinguishing grenades (excl. . . .,907,27,0,"3,645",Tons,"2,543",,49
381400,"Organic composite solvents and thinners, n.e.s.; prepared paint or varnish removers (excl. . . .","14,593",4,1,0,Tons, ,,75
381511,"Supported catalysts with nickel or a nickel compound as the active substance, n.e.s.",263,-10,0,436,Tons,"19,089",,79
381512,"Supported catalysts with precious metal or a precious-metal compound as the active substance, . . .",43,58,0,387,Tons,"166,305",,56
381519,"Supported catalysts, n.e.s. (excl. with precious metal, a precious-metal compound, nickel or . . .","4,579",96,0,"5,444",Tons,"18,128",,-
381590,"Reaction initiators, reaction accelerators and catalytic preparations, n.e.s. (excl. rubber . . .","13,038",60,0,"22,987",Tons,"2,969",,463
381600,"Refractory cements, mortars, concretes and similar compositions, incl. dolomite ramming mix . . .","8,223",-10,0,"49,304",Tons,635,,"2,988"
381700,Mixed alkylbenzenes and mixed alkylnaphthalenes produced by the alkylation of benzene and naphthalene . . .,"36,372",43,1,"9,846",Tons,"1,770",,"10,671"
381800,"Chemical elements and compounds doped for use in electronics, in the form of discs, wafers, . . .","1,418",50,0,31,Tons,"35,194",,-
381900,Hydraulic brake fluids and other prepared liquids for hydraulic transmission not containing . . .,"8,112",7,1,"4,201",Tons,"5,383",,607
382000,Anti-freezing preparations and prepared de-icing fluids (excl. prepared additives for mineral . . .,"3,767",17,0,0,Tons, ,,162
382100,"Prepared culture media for the development or maintenance of micro-organisms ""incl. viruses . . .",642,33,0,497,Tons,"11,070",,
382200,"Diagnostic or laboratory reagents on a backing, prepared diagnostic or laboratory reagents . . .","7,893",1,0,"1,583",Tons,"88,788",,"4,104"
382311,"Stearic acid, industrial",3,-60,0,"40,511",Tons,391,,-
382312,"Oleic acid, industrial",554, ,0,"4,424",Tons,"2,152",,-
382313,"Tall oil fatty acids, industrial",456,286,0,"1,909",Tons,"2,283",,59
382319,"Fatty acids, industrial, monocarboxylic; acid oils from refining (excl. stearic acid, oleic . . .","15,879",87,0,"48,598",Tons,602,,-
382370,"Fatty alcohols, industrial",58,99,0,"32,111",Tons,"2,123",,53
382410,Prepared binders for foundry moulds or cores,180,9,0,"5,913",Tons,"1,022",,371
382430,Non-agglomerated metal carbides mixed together or with metallic binders,3,24,0,7,Tons,"57,286",,
382440,"Prepared additives for cements, mortars or concretes","18,099",-1,1,"18,448",Tons,"1,799",,"5,432"
382450,Non-refractory mortars and concretes,"3,781",-11,0,"8,014",Tons,732,,310
382460,Sorbitol (excl. D-glucitol [sorbitol]),7,50,0,"2,011",Tons,634,,2
382471,"Mixtures containing chlorofluorocarbons ""CFCs"", whether or not containing hydrochlorofluorocarbons . . .",16,148,1, ,Tons, ,,
382472,"Mixtures containing bromochlorodifluoromethane, bromotrifluoromethane or dibromotetrafluoroethanes",1,844,1, , , ,,
382473,"Mixtures containing hydrobromofluorocarbons ""HBFCs""",1,545,0, , , ,,
382474,"Mixtures containing hydrochlorofluorocarbons ""HCFCs"", whether or not containing perfluorocarbons . . .",245,96,4,0, , ,,
382478,"Mixtures containing perfluorocarbons ""PFCs"" or hydrofluorocarbons ""HFCs"", but not containing . . .",154,-2,0,"7,784",Tons,"4,515",,
382479,"Mixtures containing halogenated derivatives of methane, ethane or propane (excluding those . . .",407,10,1,0,Tons, ,,
382481,"Mixtures and preparations containing oxirane ""ethylene oxide""",18,"1,939",0,382,Tons,"10,874",,
382483,"Mixtures and preparations containing tris""2,3-dibromopropyl"" phosphate", , , , , , ,,
382484,"Mixtures and preparations containing aldrin ""ISO"", camphechlor ""ISO"" ""toxaphene"", chlordane . . .", , , ,0,Tons, ,,
382486,"Mixtures and preparations containing pentachlorobenzene ""ISO"" or hexachlorobenzene ""ISO""",2,-15,1, , , ,,
382487,"Mixtures and preparations containing perfluorooctane sulphonic acid, its salts, perfluorooctane . . .", , , ,0,Tons, ,,
382488,"Mixtures and preparations containing tetra-, penta-, hexa-, hepta- or octabromodiphenyl ethers", , , ,10,Tons,"1,500",,
382491,"Mixtures and preparations consisting mainly of ""5-ethyl-2-methyl-2-oxido-1,3,2-dioxaphosphinan-5-yl""methyl . . .",170,9,0,487,Tons,"4,526",,
382499,"Chemical products and preparations of the chemical or allied industries, incl. those consisting . . .","55,296",4,0,0,Tons, ,,
382510,Municipal waste,1, ,0, ,Tons, ,,
382549,"Waste organic solvents, non-halogenated",1,-32,0, ,Tons, ,,
382550,"Wastes of metal pickling liquors, of hydraulic fluids, brake fluids and anti-freeze fluids",2,-19,0, , , ,,
382561,"Wastes from chemical or allied industries, mainly containing organic constituents (excl. anti-freeze . . .", , , ,0,Tons, ,,
382569,"Wastes from chemical or allied industries (excl. wastes of metal pickling liquors, of hydraulic . . .", , , , ,Tons, ,,
382590,"Residual products of the chemical or allied industries, n.e.s. (excl. waste)",40,-3,0,87,Tons,"1,885",,
382600,"Biodiesel and mixtures thereof, not containing or containing < 70 % by weight of petroleum . . .","36,270",77,0,343,Tons,"2,157",,
390110,"Polyethylene with a specific gravity of < 0,94, in primary forms","963,047",12,3,"63,275",Tons,"1,570",,-
390120,"Polyethylene with a specific gravity of >= 0,94, in primary forms","2,756,800",8,8,"22,145",Tons,"1,198",,-
