Product Code,Product Label,"UAE export to vietnam Value in 2022, USD thousands","annual growth export from uae to vietnam in value between 2018-2022, %, p.a","vietnam Share in United Arab Emirates's exports, %",Equivalent ad valorem tariff faced by United Arab Emirates,Quantity exported in 2022 ,Quantity unit ,Unit value (USD/unit) ,Number of non-tariff requirements faced by United Arab Emirates ,"import Value vietnam from world in 2022, USD thousand ","Annual growth in value between 2018-2022, %, p.a. ","Share in world imports, % ",Quantity exported from world to vietnam in 2022 ,Quantity unit ,Unit value (USD/unit) ,"UAE export to world Value in 2022, USD thousand ","Annual growth in value between 2018-2022, %, p.a. ","UAE Share in world exports, % ",Quantity exported from UAE to world  in 2022 ,Quantity unit ,Unit value (USD/unit) ,"Estimation of untapped potential trade, USD thousand"
10121,Pure-bred breeding horses, , , ,0, , , ,,"3,185",249,0,"297,163",No quantity,11,"3,300",-12,0,0,No quantity, ,
10129,Live horses (excl. pure-bred for breeding), , , ,5, , , ,,23,-33,0,0, , ,878,-35,0,0, , ,
10221,Pure-bred cattle for breeding, , , ,0, , , ,,"4,491",8,0,0, , , , , ,13, ,"13,538",
10229,Live cattle (excl. pure-bred for breeding), , , ,5, , , ,,"136,368",-11,2,0,Tons, ,"5,602", ,0,0,Tons, ,
10231,Pure-bred buffalo for breeding, , , , , , , ,,"5,736",199,59,"10,393", ,552, , , , , , ,
10310,Pure-bred breeding swine, , , , , , , ,,"9,978",77,6,0,Tons, , , , , ,Tons, ,
10391,"Live pure-bred swine, weighing < 50 kg (excl. pure-bred for breeding)", , , ,5, , , ,,24,3,0,254, ,94, , , ,0, , ,
10410,Live sheep, , , , , , , ,, , , , , , ,339, ,0,0, , ,
10420,Live goats, , , ,3, , , ,,44,82,0,"1,308", ,34, , , ,0, , ,18
10511,"Live fowls of the species Gallus domesticus, weighing <= 185 g (excl. turkeys and guinea fowls)", , , ,5, , , ,,"16,193",11,1,0, , ,16,-25,0,20, ,"53,000",11
10513,"Live domestic ducks, weighing <= 185 g", , , ,5, , , ,,335,-18,2,1, ,"335,000", , , ,0, , ,
10594,"Live fowls of the species Gallus domesticus, weighing > 185", , , ,6, , , ,,1,-58,0,0,Tons, ,28,-28,0,0,Tons, ,-
10599,"Live domestic ducks, geese, turkeys and guinea fowls, weighing > 185 g", , , ,3, , , ,,4,-68,0,0, , , , , ,0, , ,
10612,"Live whales, dolphins and porpoises (mammals of the order Cetacea); manatees and dugongs (mammals . . .", , , , , , , ,, , , , , , ,1, ,0, , , ,
10613,Live camels and other camelids [Camelidae], , , , , , , ,, , , , , , ,"12,287",345,8,0, , ,
10614,Live rabbits and hares, , , ,5, , , ,,1,-23,0,0, , ,1,78,0,0, , ,
10619,"Live mammals (excl. primates, whales, dolphins and porpoises, manatees and dugongs, seals, . . .", , , ,5, , , ,,212,-39,0,0,No quantity, ,259,1,0,0,No quantity, ,
10620,"Live reptiles ""e.g. snakes, turtles, alligators, caymans, iguanas, gavials and lizards""", , , ,5, , , ,,"8,655",5,13,0,No quantity, ,19,163,0,0,No quantity, ,
10631,Live birds of prey, , , ,5, , , ,, , , , ,Units, ,609,11,2,0,Units, ,
10632,"Live psittaciformes ""incl. parrots, parrakeets, macaws and cockatoos""", , , ,5, , , ,,24,-30,0,0, , ,206,139,1,0, , ,-
10639,"Live birds (excl. birds of prey, psittaciformes, parrots, parrakeets, macaws, cockatoos, ostriches . . .", , , ,5, , , ,,"1,112",13,2,0,Units, ,437,-28,1,0,Units, ,
10641,Live bees, , , ,5, , , ,,4, ,0,0, , , , , ,0, , ,
10690,"Live animals (excl. mammals, reptiles, birds, insects, fish, crustaceans, molluscs and other . . .", , , ,5, , , ,,481,10,0,0,No quantity, ,12,-25,0,0,No quantity, ,
20110,"Carcases or half-carcases of bovine animals, fresh or chilled", , , ,30, , , ,,76,-20,0,9,Tons,"8,444",17,0,0,"38,415",Tons,"4,511",
20120,"Fresh or chilled bovine cuts, with bone in (excl. carcases and 1/2 carcases)", , , ,20, , , ,,"2,051",6,0,115, ,"17,835",34,-39,0,"2,290", ,"9,909",1
20130,"Fresh or chilled bovine meat, boneless", , , ,14, , , ,,"21,614",11,0,"1,439",Tons,"15,020",242,-25,0,"29,140",Tons,"8,822",3
20220,"Frozen bovine cuts, with bone in (excl. carcases and half-carcases)", , , ,20, , , ,,"29,723",-3,1,"14,113", ,"2,106",38,-39,0,"2,042", ,"7,135",-
20230,"Frozen, boneless meat of bovine animals", , , ,14, , , ,,"680,396",-26,2,"176,471",Tons,"3,856","3,944",3,0,"101,593",Tons,"3,858","4,710"
20311,Fresh or chilled carcases and half-carcases of swine, , , ,25, , , ,,189,48,0,121, ,"1,562", , , ,32, ,"2,531",
20312,"Fresh or chilled hams, shoulders and cuts thereof of swine, with bone in", , , ,25, , , ,,186,51,0,100, ,"1,860",1, ,0,22, ,"2,227",
20319,"Fresh or chilled meat of swine (excl. carcases and half-carcases, and hams, shoulders and cuts . . .", , , ,25, , , ,,731,-46,0,402, ,"1,818",9, ,0,188, ,"7,277",
20321,Frozen carcases and half-carcases of swine, , , ,15, , , ,,27,-30,0,25,Tons,"1,080", , , ,90,Tons,"3,267",
20322,"Frozen hams, shoulders and cuts thereof of swine, with bone in", , , ,15, , , ,,"13,809",62,1,"9,818", ,"1,406",21,-17,0,"1,731", ,"1,776",5
20329,"Frozen meat of swine (excl. carcases and half-carcases, and hams, shoulders and cuts thereof, . . .", , , ,15, , , ,,"170,913",35,1,"86,766",Tons,"1,970",114,-40,0,"13,507",Tons,"2,512",32
20410,Fresh or chilled lamb carcases and half-carcases, , , ,7, , , ,,529,-14,0,55, ,"9,618", , , ,"13,817", ,"6,571",
20422,"Fresh or chilled cuts of sheep, with bone in (excl. carcases and half-carcases)", , , ,7, , , ,,404,-32,0,20, ,"20,200", , , ,"4,927", ,"9,658",-
20423,Fresh or chilled boneless cuts of sheep, , , ,7, , , ,,15,-48,0,1, ,"15,000", , , ,"1,807", ,"10,498",
20430,Frozen lamb carcases and half-carcases, , , ,7, , , ,,4,-21,0,0, , , , , ,"2,057", ,"5,785",-
20442,"Frozen cuts of sheep, with bone in (excl. carcases and half-carcases)", , , ,7, , , ,,"4,847",-24,0,416,Tons,"11,651",30,-45,0,"6,131",Tons,"6,259",1
20443,Frozen boneless cuts of sheep, , , ,7, , , ,,"1,934",-14,0,182, ,"10,626",17,-52,0,"2,493", ,"8,081",1
20450,"Fresh, chilled or frozen meat of goats", , , ,7, , , ,,323,-39,0,60,Tons,"5,383", , , ,"15,766",Tons,"5,326",4
20500,"Meat of horses, asses, mules or hinnies, fresh, chilled or frozen", , , , , , , ,,"1,217",-57,0,329, ,"3,699", , , , , , ,
20610,Fresh or chilled edible offal of bovine animals, , , ,8, , , ,,"1,448",-45,0,277, ,"5,227",87, ,0,134, ,"4,500",
20621,Frozen edible bovine tongues, , , ,8, , , ,,"2,050",-29,0,782,Tons,"2,621", , , ,101,Tons,"2,802",
20622,Frozen edible bovine livers, , , ,8, , , ,,91,-20,0,53, ,"1,717",96,26,0,"1,767", ,"1,339",
20629,Frozen edible bovine offal (excl. tongues and livers), , , ,8, , , ,,"97,924",-30,4,"29,488",Tons,"3,321","3,829", ,0,"3,983",Tons,"1,993",7
20641,Frozen edible livers of swine, , , ,8, , , ,,384,95,1,422, ,910, , , ,214, ,696,
20649,"Edible offal of swine, frozen (excl. livers)", , , ,8, , , ,,"48,604",-26,1,"46,027",Tons,"1,056",338, ,0,"2,768",Tons,"1,238",
20690,"Frozen edible offal of sheep, goats, horses, asses, mules and hinnies", , , ,10, , , ,,"1,494",-48,1,722,Tons,"2,069", , , ,"2,530",Tons,"2,447",
20712,"Frozen fowls of the species Gallus domesticus, not cut in pieces", , , ,40, , , ,,"59,377",30,2,"43,173", ,"1,375",176,-18,0,"277,686", ,"1,869","1,673"
20713,Fresh or chilled cuts and edible offal of fowls of the species Gallus domesticus, , , ,40, , , ,,84,-48,0,52, ,"1,615", , , ,260, ,"6,485",
20714,Frozen cuts and edible offal of fowls of the species Gallus domesticus, , , ,20, , , ,,"250,413",-22,1,"228,014",Tons,"1,098","5,052",-7,0,"265,336",Tons,"2,103","1,442"
20725,"Frozen turkeys of the species domesticus, not cut into pieces", , , ,40, , , ,,85,-29,0,25, ,"3,400",91,-6,0,391, ,"2,703",1
20726,Fresh or chilled cuts and edible offal of turkeys of the species domesticus, , , , , , , ,, , , , , , ,6, ,0,47, ,"4,468",
20727,Frozen cuts and edible offal of turkeys of the species domesticus, , , ,20, , , ,,"5,014",5,0,"1,020",Tons,"4,916",261,-6,0,"2,351",Tons,"2,595",5
20742,"Frozen domestic ducks, not cut in pieces", , , ,40, , , ,,27,-72,0,5, ,"5,400",3,-60,0,"1,140", ,"2,847",
20743,"Fatty livers of domestic ducks, fresh or chilled", , , ,15, , , ,,2,-48,0,0, , , , , ,2, ,"55,000",
20745,Frozen cuts and edible offal of domestic ducks, , , ,15, , , ,,839,-55,0,145, ,"5,786",11,-42,0,292, ,"4,688",
20752,"Frozen domestic geese, not cut in pieces", , , ,40, , , ,,84,-16,0,11, ,"7,636", , , ,0, , ,
20753,"Fatty livers of domestic geese, fresh or chilled", , , ,15, , , ,,13, ,0,1, ,"13,000",1, ,0, , , ,
20755,Frozen cuts and edible offal of domestic geese, , , ,15, , , ,,4,-56,0,0, , , , , ,36, ,"1,861",
20890,"Fresh, chilled or frozen meat and edible offal of pigeons, game, reindeer and other animals . . .", , , ,8, , , ,,251,-32,0,75,Tons,"3,347",92,15,0,41,Tons,"12,902",
20910,"Pig fat, free of lean meat, not rendered or otherwise extracted, fresh, chilled, frozen, salted, . . .", , , ,10, , , ,,"19,932",29,3,"14,991",Tons,"1,330", , , ,17,Tons,882,
20990,"Poultry fat, not rendered or otherwise extracted, fresh, chilled, frozen, salted, in brine, . . .", , , , , , , ,,64,-61,0,50, ,"1,280", , , , , , ,
21011,"Hams, shoulders and cuts thereof of swine, salted, in brine, dried or smoked, with bone in", , , ,10, , , ,,947,26,0,161, ,"5,882", , , ,40, ,"12,150",
21012,"Bellies ""streaky"" and cuts thereof of swine, salted, in brine, dried or smoked", , , ,10, , , ,,54,-17,0,7, ,"7,714",8, ,0,289, ,"4,920",
21019,"Meat of swine, salted, in brine, dried or smoked (excl. hams, shoulders and cuts thereof, with . . .", , , ,10, , , ,,"1,353",-6,0,86, ,"15,733", , , ,341, ,"9,284",
21020,"Meat of bovine animals, salted, in brine, dried or smoked", , , ,15, , , ,,"3,907",43,1,578,Tons,"6,760","8,338",205,3,158,Tons,"12,500",1
21091,"Meat and edible offal, salted, in brine, dried or smoked, and edible flours and meals of meat . . .", , , , , , , ,,"1,169", ,25,385, ,"3,036", , , , , , ,
21099,"Meat and edible offal, salted, in brine, dried or smoked, and edible flours and meals of meat . . .", , , ,20, , , ,,"3,473",6,0,792,Tons,"4,385",117,-15,0,388,Tons,"2,804",
30111,Live ornamental freshwater fish, , , ,19, , , ,,"7,201",43,3,0,No quantity, ,15, ,0,0,No quantity, ,
30119,Live ornamental fish (excl. freshwater), , , ,19, , , ,,236,87,0,0,No quantity, ,2,-42,0,0,No quantity, ,
30191,"Live trout ""Salmo trutta, Oncorhynchus mykiss, Oncorhynchus clarki, Oncorhynchus aguabonita, . . .", , , ,20, , , ,,"1,044",-7,1,103, ,"10,136", , , ,0, , ,
30192,"Live eels ""Anguilla spp.""", , , ,20, , , ,,"34,323",31,4,"2,715",Tons,"12,642", , , ,0,Tons, ,
30193,"Live carp ""Cyprinus spp., Carassius spp., Ctenopharyngodon idellus, Hypophthalmichthys spp., . . .", , , , , , , ,,"5,701",8,5,"1,216",Tons,"4,688", , , , ,Tons, ,
30199,"Live fish (excl. ornamental fish, trout [Salmo trutta, Oncorhynchus mykiss, Oncorhynchus clarki, . . .", , , ,13, , , ,,"40,884",22,4,"8,887",No quantity,"4,600",9, ,0,0,No quantity, ,
30211,"Fresh or chilled trout ""Salmo trutta, Oncorhynchus mykiss, Oncorhynchus clarki, Oncorhynchus . . .", , , ,10, , , ,,"5,489",47,1,546, ,"10,053",2,94,0,163, ,"10,712",
30213,"Fresh or chilled Pacific salmon ""Oncorhynchus nerka, Oncorhynchus gorbuscha, Oncorhynchus keta, . . .", , , ,10, , , ,,313,114,0,21,Tons,"14,905",15,-25,0,1,Tons,"20,000",
30214,"Fresh or chilled Atlantic salmon ""Salmo salar"" and Danube salmon ""Hucho hucho""", , , ,10, , , ,,"71,471",11,0,"7,120",Tons,"10,038",51,8,0,"7,261",Tons,"8,951",
30219,"Fresh or chilled salmonidae (excl. trout ""Salmo trutta, Oncorhynchus mykiss, Oncorhynchus clarki, . . .", , , ,20, , , ,, , , , ,Tons, ,200,2,0,159,Tons,"4,686",2
30221,"Fresh or chilled lesser or Greenland halibut ""Reinhardtius hippoglossoides, Atlantic halibut . . .", , , ,20, , , ,,2,-79,0,0, , ,4,26,0,2, ,"20,500",
30224,"Fresh or chilled turbot ""Psetta maxima""", , , ,15, , , ,,4,19,0,0, , , , , ,16, ,"18,688",
30229,"Fresh or chilled flat fish ""Pleuronectidae, Bothidae, Cynoglossidae, Soleidae, Scophthalmidae . . .", , , ,15, , , ,,1,-80,0,0, , , , , ,98, ,"7,102",
30231,"Fresh or chilled albacore or longfinned tunas ""Thunnus alalunga""", , , ,15, , , ,,291,-45,0,71,Tons,"4,099",2,-21,0,2,Tons,"24,500",
30232,"Fresh or chilled yellowfin tunas ""Thunnus albacares""", , , ,15, , , ,,642,-2,0,225,Tons,"2,853",2,-50,0,159,Tons,"5,176",
30235,"Fresh or chilled Atlantic and Pacific bluefin tuna (Thunnus thynnus, Thunnus orientalis)", , , ,15, , , ,,366,4,0,10,Tons,"36,600", , , ,55,Tons,"26,036",
30236,"Fresh or chilled Southern bluefin tunas ""Thunnus maccoyii""", , , , , , , ,,3, ,0,0,Tons, , , , , ,Tons, ,
30239,"Fresh or chilled tunas of the genus ""Thunnus"" (excl. Thunnus alalunga, Thunnus albacares, Thunnus . . .", , , ,15, , , ,,18, ,0,5,Tons,"3,600",5,-24,0,3,Tons,"5,333",
30242,"Fresh or chilled anchovies ""Engraulis spp.""", , , ,12, , , ,,1,-54,0,2,Tons,500, , , ,181,Tons,"4,028",
30243,"Fresh or chilled sardines ""Sardina pilchardus, Sardinops spp."", sardinella ""Sardinella spp."", . . .", , , , , , , ,, , , , , , ,1, ,0,0, , ,
30244,"Fresh or chilled mackerel ""Scomber scombrus, Scomber australasicus, Scomber japonicus""", , , ,15, , , ,,58, ,0,12,No quantity,"4,833",4,-24,0,7,No quantity,"5,857",
30245,"Fresh or chilled jack and horse mackerel ""Trachurus spp.""", , , ,12, , , ,,1,17,0,1,Tons,"1,000", , , ,0,Tons, ,
30246,"Fresh or chilled cobia ""Rachycentron canadum""", , , ,12, , , ,,"9,850",910,74,"1,443", ,"6,826", , , ,0, , ,
30249,"Fresh or chilled Indian mackerels ""Rastrelliger spp."", seerfishes ""Scomberomorus spp."", jacks, . . .", , , ,12, , , ,,4,-64,0,2,No quantity,"2,000",3,-5,0,174,No quantity,"6,678",
30254,"Fresh or chilled hake ""Merluccius spp., Urophycis spp.""", , , ,12, , , ,,2,-44,0,3, ,667, , , ,0, , ,
30255,"Fresh or chilled Alaska pollack ""Theragra chalcogramma""", , , , , , , ,, , , , , , ,11, ,0, , , ,
30259,"Fresh or chilled fish of the families Bregmacerotidae, Euclichthyidae, Gadidae, Macrouridae, . . .", , , ,12, , , ,,1,-75,0,3,Tons,333, , , ,20,Tons,"8,600",
30272,"Fresh or chilled catfish ""Pangasius spp., Silurus spp., Clarias spp., Ictalurus spp.""", , , ,20, , , ,,1,-17,0,1,Tons,"1,000", , , ,0,Tons, ,
30273,"Fresh or chilled carp ""Cyprinus spp., Carassius spp., Ctenopharyngodon idellus, Hypophthalmichthys . . .", , , ,20, , , ,,1,-74,0,2,Tons,500, , , ,198,Tons,"2,399",
30279,"Fresh or chilled, Nile perch ""Lates niloticus"" and snakeheads ""Channa spp.""", , , ,20, , , ,,22,17,0,2,Tons,"11,000",30,37,0,72,Tons,"16,639",
30281,Fresh or chilled dogfish and other sharks, , , , , , , ,, , , , , , ,1, ,0,0, , ,
30284,"Fresh or chilled sea bass ""Dicentrarchus spp.""", , , ,12, , , ,,8,-56,0,15, ,533,15, ,0,"2,337", ,"7,185",
30285,"Fresh or chilled sea bream ""Sparidae""", , , ,12, , , ,,17,-41,0,18, ,944, , , ,"1,870", ,"4,941",
30289,"Fresh or chilled fish, n.e.s.", , , ,15, , , ,,"21,273",75,1,"5,561",Tons,"3,825",56,-16,0,"1,826",Tons,"5,321",
30291,"Fresh or chilled fish livers, roes and milt", , , ,20, , , ,,2, ,0,0, , , , , ,4, ,"37,500",
30299,"Fresh or chilled fish fins, heads, tails, maws and other edible fish offal (excl. livers, roes, . . .", , , ,10, , , ,,7,-75,0,1,Tons,"7,000",1,-48,0,4,Tons,"1,750",
30311,"Frozen sockeye salmon [red salmon] ""Oncorhynchus nerka""", , , ,15, , , ,,"5,254",11,1,"1,497", ,"3,510", , , ,6, ,"6,833",
30312,"Frozen Pacific salmon (excl. sockeye salmon ""red salmon"")", , , ,12, , , ,,"77,647",18,5,"16,535",Tons,"4,696",163,7,0,0,Tons, ,
30313,"Frozen, Atlantic salmon ""Salmo salar"" and Danube salmon ""Hucho hucho""", , , ,10, , , ,,"17,496",-10,2,"2,940",Tons,"5,951",274,52,0,"2,758",Tons,"7,992",12
30314,"Frozen trout ""Salmo trutta, Oncorhynchus mykiss, Oncorhynchus clarki, Oncorhynchus aguabonita, . . .", , , ,10, , , ,,"64,205",11,10,"9,705",Tons,"6,616", , , ,0,Tons, ,
30319,"Frozen salmonidae (excl. trout and Pacific, Atlantic and Danube salmon)", , , ,15, , , ,,478,-76,1,144,Tons,"3,319",778,-8,1,64,Tons,"5,391",
30323,"Frozen tilapia ""Oreochromis spp.""", , , ,20, , , ,,59,3,0,20,Tons,"2,950",316,272,0,"2,307",Tons,"1,206",
30324,"Frozen catfish ""Pangasius spp., Silurus spp., Clarias spp., Ictalurus spp.""", , , ,20, , , ,,25,-26,0,12,Tons,"2,083",2, ,0,"1,030",Tons,"1,561",
30326,"Frozen eels ""Anguilla spp.""", , , , , , , ,,194,-53,0,26,Tons,"7,462", , , , ,Tons, ,
30329,"Frozen, Nile perch (Lates niloticus) and snakeheads (Channa spp.)", , , ,20, , , ,,73,-58,0,33,Tons,"2,212",10,-45,0,62,Tons,"3,161",
30331,"Frozen lesser or Greenland halibut ""Reinhardtius hippoglossoides"", Atlantic halibut ""Hippoglossus . . .", , , ,12, , , ,,"2,637",-48,0,420, ,"6,279",8, ,0,0, , ,
30332,"Frozen plaice ""Pleuronectes platessa""", , , ,20, , , ,,14,-11,0,3,Tons,"4,667", , , ,10,Tons,"2,300",
30333,"Frozen sole ""Solea spp.""", , , ,20, , , ,,21,-68,0,1,Tons,"21,000",80, ,0,7,Tons,"6,000",
30334,"Frozen turbot ""Psetta maxima""", , , ,15, , , ,,8,-69,0,0,Tons, , , , ,1,Tons,"13,000",
30339,"Frozen flat fish ""Pleuronectidae, Bothidae, Cynoglossidae, Soleidae, Scophthalmidae and Citharidae"" . . .", , , ,15, , , ,,"4,892",-46,1,"3,197",Tons,"1,530",1,69,0,386,Tons,"2,119",
30341,"Frozen albacore or longfinned tunas ""Thunnus alalunga""", , , ,12, , , ,,"37,362",6,10,"11,560",Tons,"3,232",16,21,0, ,Tons, ,
30342,"Frozen yellowfin tunas ""Thunnus albacares""", , , ,20, , , ,,"231,542",30,16,"69,934",Tons,"3,311",90,33,0,1,Tons,"22,000",771
30343,"Frozen skipjack or stripe-bellied bonito ""Euthynnus -Katsuwonus- pelamis""", , , ,15, , , ,,"29,193",-8,2,"75,414",Tons,387,13, ,0,313,Tons,"1,300",135
30344,"Frozen bigeye tunas ""Thunnus obesus""", , , , , , , ,,"12,510",20,3,"2,817",Tons,"4,441", , , , ,Tons, ,
30345,"Frozen Atlantic and Pacific bluefin tuna (Thunnus thynnus, Thunnus orientalis)", , , ,14, , , ,,12,11,0,8,Tons,"1,500", , , ,23,Tons,"8,435",
30346,"Frozen Southern bluefin tunas ""Thunnus maccoyii""", , , , , , , ,,91,174,0,21,Tons,"4,333", , , , ,Tons, ,
30349,"Frozen tunas of the genus ""Thunnus"" (excl. Thunnus alalunga, Thunnus albacares, Thunnus obesus, . . .", , , ,15, , , ,,"3,769",-30,3,"1,791",Tons,"2,104",42,-40,0,446,Tons,"2,726",
30351,"Frozen herrings ""Clupea harengus, Clupea pallasii""", , , ,10, , , ,,"9,832",86,1,"6,929",Tons,"1,419",51,-47,0,47,Tons,"1,255",
30353,"Frozen sardines ""Sardina pilchardus, Sardinops spp."", sardinella ""Sardinella spp."", brisling . . .", , , ,20, , , ,,"7,283",13,1,"10,152",Tons,717,497,43,0,485,Tons,"1,767",3
30354,"Frozen mackerel ""Scomber scombrus, Scomber australasicus, Scomber japonicus""", , , ,13, , , ,,"126,107",6,6,"86,608",Tons,"1,456",186,18,0,748,Tons,"2,040",184
30355,"Frozen jack and horse mackerel ""Trachurus spp.""", , , ,10, , , ,,"16,135",17,2,"13,305",Tons,"1,213",588,132,0,157,Tons,"1,510",
30357,"Frozen swordfish ""Xiphias gladius""", , , , , , , ,,"4,598",-12,2,912,Tons,"5,042", , , , ,Tons, ,
30359,"Frozen anchovies ""Engraulis spp."", Indian mackerels ""Rastrelliger spp."", seerfishes ""Scomberomorus . . .", , , ,10, , , ,,"35,426",-8,4,"12,577",Tons,"2,817","1,601",198,0,"1,144",Tons,"3,847",
30363,"Frozen cod ""Gadus morhua, Gadus ogac, Gadus macrocephalus""", , , ,14, , , ,,"12,271",21,1,"2,701",Tons,"4,543",2,-42,0,263,Tons,"4,871",
30364,"Frozen haddock ""Melanogrammus aeglefinus""", , , ,14, , , ,,"5,632", ,2,"1,726", ,"3,263",29, ,0, , , ,
30365,"Frozen coalfish ""Pollachius virens""", , , ,14, , , ,,"1,784",77,1,767, ,"2,326",10, ,0, , , ,
30366,"Frozen hake ""Merluccius spp., Urophycis spp.""", , , , , , , ,, , , , , , ,14, ,0,144, ,"1,250",
30367,"Frozen Alaska pollack ""Theragra chalcogramma""", , , ,10, , , ,,"10,933",13,1,"7,538",Tons,"1,450", , , ,3,Tons,"4,333",
30368,"Frozen blue whiting ""Micromesistius poutassou, Micromesistius australis""", , , ,10, , , ,,87,-56,0,59, ,"1,475",125,3,0,472, ,888,
30369,"Frozen fish of the families Bregmacerotidae, Euclichthyidae, Gadidae, Macrouridae, Melanonidae, . . .", , , ,10, , , ,,"5,015",-3,2,0,Tons, ,223,11,0,98,Tons,"1,184",
30381,Frozen dogfish and other sharks, , , ,15, , , ,,64,-47,0,55,Tons,"1,164",41, ,0, ,Tons, ,
30382,"Frozen rays and skates ""Rajidae""", , , ,10, , , ,,50,-36,0,37,Tons,"1,351",126,484,0,15,Tons,"2,200",
30383,"Frozen toothfish ""Dissostichus spp.""", , , ,10, , , ,,497,-74,0,15, ,"33,133",7, ,0,83, ,"11,217",
30384,"Frozen sea bass ""Dicentrarchus spp.""", , , ,20, , , ,,446,-54,1,61,Tons,"7,311",152,17,0,40,Tons,"13,200",
30389,"Frozen fish, n.e.s.", , , ,14, , , ,,"111,846",-19,3,"44,249",Tons,"2,528","5,400",2,0,"19,234",Tons,"1,525",
30391,"Frozen fish livers, roes and milt", , , ,12, , , ,,"16,930",-3,1,"2,916",Tons,"5,806", , , ,48,Tons,"4,542",
30392,Frozen shark fins, , , , , , , ,,"3,555",-28,4,297, ,"11,970", , , , , , ,
30399,"Frozen fish fins, heads, tails, maws and other edible fish offal (excl. livers, roes, milt . . .", , , ,10, , , ,,"20,275",-7,5,"17,426",Tons,"1,163",79,-24,0,1,Tons,"29,000",
30431,"Fresh or chilled fillets of tilapia ""Oreochromis spp.""", , , ,15, , , ,,12,-33,0,3,Tons,"4,000",33,78,0,41,Tons,"7,390",
30432,"Fresh or chilled fillets of catfish ""Pangasius spp., Silurus spp., Clarias spp., Ictalurus . . .", , , ,15, , , ,,71,447,0,42,Tons,"1,690",1,4,0,2,Tons,"5,000",
30433,"Fresh or chilled fillets of Nile perch ""Lates niloticus""", , , ,15, , , ,,116, ,0,19, ,"6,105",22,-8,0,55, ,"5,327",
30439,"Fresh or chilled fillets of carp ""Cyprinus spp., Carassius spp., Ctenopharyngodon idellus, . . .", , , ,15, , , ,,2,-79,0,0,Tons, ,30,156,0,1,Tons,"5,000",
30441,"Fresh or chilled fillets of Pacific salmon ""Oncorhynchus nerka, Oncorhynchus gorbuscha, Oncorhynchus . . .", , , ,15, , , ,,158,-55,0,30,Tons,"5,267",5,-44,0,170,Tons,"12,747",
30442,"Fresh or chilled fillets of trout ""Salmo trutta, Oncorhynchus mykiss, Oncorhynchus clarki, . . .", , , ,15, , , ,, , , , ,Tons, ,66, ,0,11,Tons,"10,182",
30444,"Fresh or chilled fillets of fish of the families Bregmacerotidae, Euclichthyidae, Gadidae, . . .", , , ,15, , , ,,73, ,0,2,Tons,"36,500", , , ,2,Tons,"13,000",
30445,"Fresh or chilled fillets of swordfish ""Xiphias gladius""", , , ,15, , , ,, , , , ,Tons, ,3,195,0, ,Tons, ,
30446,"Fresh or chilled fillets of toothfish ""Dissostichus spp.""", , , ,15, , , ,,64, ,2,1,Tons,"64,000",22,85,0, ,Tons, ,
30447,Fresh or chilled fillets of dogfish and other sharks, , , ,15, , , ,, , , , ,Tons, ,4,215,0, ,Tons, ,
30449,"Fresh or chilled fillets of fish, n.e.s.", , , ,15, , , ,,"1,028",-4,0,25,Tons,"41,120",238,-8,0,76,Tons,"26,118",
30452,"Fresh or chilled meat, whether or not minced, of salmonidae (excl. fillets)", , , ,15, , , ,, , , , ,Tons, ,19, ,0,1,Tons,"12,000",
30454,"Fresh or chilled meat, whether or not minced, of swordfish ""Xiphias gladius"" (excl. fillets)", , , , , , , ,, , , , , , ,2, ,0, , , ,
30459,"Fresh or chilled fish meat, whether or not minced (excl. all fillets, tilapias, catfish, carp, . . .", , , ,15, , , ,, , , , ,Tons, ,17,-2,0,1,Tons,"56,000",
30461,"Frozen fillets of tilapia ""Oreochromis spp.""", , , ,15, , , ,,71,-29,0,25,Tons,"2,840",13,71,0,15,Tons,"2,467",
30462,"Frozen fillets of catfish ""Pangasius spp., Silurus spp., Clarias spp., Ictalurus spp.""", , , ,15, , , ,,"1,159",-15,0,394,Tons,"2,942",851,43,0,71,Tons,"1,141",
30463,"Frozen fillets of Nile perch ""Lates niloticus""", , , ,15, , , ,,86, ,0,18,Tons,"4,778",140,10,0,640,Tons,"6,164",
30469,"Frozen fillets of carp ""Cyprinus spp., Carassius spp., Ctenopharyngodon idellus, Hypophthalmichthys . . .", , , ,15, , , ,,384,-9,1,68,Tons,"5,647", , , ,425,Tons,"2,033",
30471,"Frozen fillets of cod ""Gadus morhua, Gadus ogac, Gadus macrocephalus""", , , ,15, , , ,,917,48,0,148,Tons,"6,196","1,079",68,0,66,Tons,"10,121",
30472,"Frozen fillets of haddock ""Melanogrammus aeglefinus""", , , ,15, , , ,, , , , ,Tons, ,2, ,0,1,Tons,"11,000",
30473,"Frozen fillets of coalfish ""Pollachius virens""", , , ,15, , , ,, , , , ,Tons, ,7, ,0,0,Tons, ,
30474,"Frozen fillets of hake ""Merluccius spp., Urophycis spp.""", , , ,15, , , ,,3,-62,0,0,Tons, ,7, ,0,3,Tons,"4,333",
30475,"Frozen fillets of Alaska pollack ""Theragra chalcogramma""", , , ,15, , , ,,170,-18,0,59,Tons,"2,881",1, ,0,96,Tons,"3,219",
30479,"Frozen fillets of fish of the families Bregmacerotidae, Euclichthyidae, Gadidae, Macrouridae, . . .", , , ,15, , , ,,112,-44,0,20,Tons,"5,600",111,366,0,5,Tons,"5,400",
30481,"Frozen fillets of Pacific salmon ""Oncorhynchus nerka, Oncorhynchus gorbuscha, Oncorhynchus . . .", , , ,15, , , ,,"35,292",-8,1,"5,594",No quantity,"6,309",474,7,0,499,No quantity,"13,116",
30482,"Frozen fillets of trout ""Salmo trutta, Oncorhynchus mykiss, Oncorhynchus clarki, Oncorhynchus . . .", , , ,15, , , ,,694,-19,0,115,Tons,"6,035",16,25,0,5,Tons,"8,800",
30483,"Frozen fillets of flat fish ""Pleuronectidae, Bothidae, Cynoglossidae, Soleidae, Scophthalmidae . . .", , , ,15, , , ,,706,3,0,261,Tons,"2,705",65,293,0,59,Tons,"7,780",
30484,"Frozen fillets of swordfish ""Xiphias gladius""", , , ,15, , , ,,4,-29,0,1,Tons,"4,000",5, ,0, ,Tons, ,
30485,"Frozen fillets of toothfish ""Dissostichus spp.""", , , ,15, , , ,,32,-60,0,0, , , , , ,51, ,"37,118",
30486,"Frozen fillets of herring ""Clupea harengus, Clupea pallasii""", , , ,15, , , ,,6,-35,0,0,Tons, , , , ,5,Tons,"10,800",
30487,"Frozen fillets of tuna ""of the genus Thunnus"", skipjack or stripe-bellied bonito ""Euthynnus . . .", , , ,15, , , ,,"28,717",13,1,"3,545",Tons,"8,101",97,15,0,160,Tons,"13,656",
30489,"Frozen fish fillets, n.e.s.", , , ,15, , , ,,"2,196",-31,0,239,Tons,"9,188","1,597",12,0,441,Tons,"8,422",
30491,"Frozen meat, whether or not minced, of swordfish ""Xiphias gladius"" (excl. fillets)", , , , , , , ,,529,15,2,257,Tons,"2,058", , , , ,Tons, ,
30493,"Frozen meat, whether or not minced, of tilapia ""Oreochromis spp."", catfish ""Pangasius spp., . . .", , , ,15, , , ,,40,80,0,96,Tons,417, , , ,0,Tons, ,
