560490,"Textile yarn, strip and the like of heading 5404 and 5405, impregnated, coated, covered or . . .", , , ,5, , , ,,"5,637",14,2,857,Tons,"6,578","1,146",40,0,147,Tons,"6,170",246
560500,"Metallised yarn, whether or not gimped, being textile yarn, or strip or the like of heading . . .", , , ,5, , , ,,"1,926",-9,1,97,Tons,"19,856",1,-58,0,"1,034",Tons,"6,066",12
560600,"Gimped yarn, gimped strip and the like of heading 5404 or 5405; chenille yarn, incl. flock . . .", , , ,12, , , ,,"22,128",19,4,"2,967",Tons,"7,458",880,37,0,74,Tons,"7,027",
560721,"Binder or baler twine, of sisal or other textile fibres of the genus Agave", , , ,12, , , ,,661,140,1,270,Tons,"2,448",24,-18,0,1,Tons,"6,000",
560729,"Twine, cordage, ropes and cables, of sisal or other textile fibres of the genus Agave, whether . . .", , , ,12, , , ,,"3,948",13,3,810,Tons,"4,874",189,25,0,273,Tons,"2,271",5
560741,"Binder or baler twine, of polyethylene or polypropylene", , , ,12, , , ,,"1,862",-30,1,372,Tons,"5,005",112,-35,0,212,Tons,"1,892",7
560749,"Twine, cordage, ropes and cables of polyethylene or polypropylene, whether or not plaited or . . .", , , ,12, , , ,,"19,029",-5,2,"5,626",No quantity,"3,382","5,634",3,1,"7,188",No quantity,"2,459",104
560750,"Twine, cordage, ropes and cables, of synthetic fibres, whether or not plaited or braided and . . .", , , ,12, , , ,,"63,526",13,6,"6,526",No quantity,"9,734","1,181",-6,0,"3,230",No quantity,"4,464",49
560790,"Twine, cordage, ropes and cables, whether or not plaited or braided and whether or not impregnated, . . .", , , ,12, , , ,,"24,975",11,6,"4,577",Tons,"5,457",957,-4,0,717,Tons,"4,057",54
560811,Made-up knotted fishing nets of man-made textile materials (excl. landing nets), , , ,12, , , ,,"49,566",3,6,"7,633",No quantity,"6,494","1,972",56,0,"2,373",No quantity,"6,324",11
560819,"Knotted netting of twine, cordage, ropes or cables, by the piece or metre; made-up nets, of . . .", , , ,11, , , ,,"42,237",-2,4,"18,921",No quantity,"2,232","2,484",132,0,"2,581",No quantity,"3,613",54
560890,"Knotted netting of twine, cordage, ropes or cables, by the piece or metre; made-up fishing . . .", , , ,11, , , ,,"3,799",7,2,555,Tons,"6,845",47,-7,0,153,Tons,"4,268",11
560900,"Articles of yarn, strip or the like of heading 5404 or 5405, or of twine, cordage, ropes or . . .", , , ,12, , , ,,"37,996",34,5,"3,515",No quantity,"10,810","1,298",-2,0,"1,455",No quantity,"4,517",65
570110,"Carpets and other textile floor coverings, of wool or fine animal hair, knotted, whether or . . .", , , ,12, , , ,,205,-28,0,0,No quantity, ,"1,218",-33,0,0,No quantity, ,2
570190,"Carpets and other textile floor coverings, of textile materials, knotted, whether or not made . . .", , , ,12, , , ,,"3,096",17,1,0,No quantity, ,"10,526",-24,3,0,No quantity, ,40
570210,"Kelem, Schumacks, Karamanie and similar hand-woven rugs, whether or not made up", , , ,12, , , ,,17,-22,0,0,Tons, ,561,5,0,0,Tons, ,-
570220,"Floor coverings of coconut fibres ""coir"", woven, whether or not made up", , , ,12, , , ,,56,202,0,2,No quantity,"28,000",5,-19,0,111,No quantity,"3,892",
570231,"Carpets and other floor coverings, of wool or fine animal hair, woven, not tufted or flocked, . . .", , , ,12, , , ,,639,-18,0,21,No quantity,"30,429",623,18,0,600,No quantity,"14,825",9
570232,"Carpets and other floor coverings, of man-made textile materials, woven, not tufted or flocked, . . .", , , ,12, , , ,,149,-18,0,0,No quantity, ,328,2,0,0,No quantity, ,-
570239,"Carpets and other floor coverings, of vegetable textile materials or coarse animal hair, woven, . . .", , , ,12, , , ,,129,50,0,0,No quantity, ,27,-25,0,0,No quantity, ,8
570241,"Carpets and other floor coverings, of wool or fine animal hair, woven, not tufted or flocked, . . .", , , ,12, , , ,,877,-17,0,0,No quantity, ,432,-11,0,0,No quantity, ,5
570242,"Carpets and other floor coverings, of man-made textile materials, woven, not tufted or flocked, . . .", , , ,12, , , ,,"10,299",0,0,0,No quantity, ,"3,520",45,0,0,No quantity, ,112
570249,"Carpets and other floor coverings, of vegetable textile materials or coarse animal hair, woven, . . .", , , ,12, , , ,,388,48,0,0,No quantity, ,89,-21,0,0,No quantity, ,1
570250,"Carpets and other textile floor coverings, woven, not tufted or flocked, not of pile construction, . . .", , , ,12, , , ,,161,-20,0,0,No quantity, ,46,5,0,0,No quantity, ,-
570291,"Carpets and other floor coverings, of wool or fine animal hair, woven, not tufted or flocked, . . .", , , ,12, , , ,,44,-28,0,7,No quantity,"6,286",49,-20,0,0,No quantity, ,-
570292,"Carpets and other floor coverings, of man-made textile materials, woven, not tufted or flocked, . . .", , , ,12, , , ,,"3,546",33,1,0,No quantity, ,525,1,0,0,No quantity, ,3
570299,"Carpets and other floor coverings, of vegetable textile materials or coarse animal hair, woven, . . .", , , ,12, , , ,,532,-7,0,0,No quantity, ,343,-8,0,0,No quantity, ,1
570310,"Carpets and other floor coverings, of wool or fine animal hair, tufted ""needle punched"", whether . . .", , , ,12, , , ,,"1,397",-34,0,0,No quantity, ,378,72,0,0,No quantity, ,-
570320,"Carpets and other floor coverings, of nylon or other polyamides, tufted ""needle punched"", whether . . .", , , ,12, , , ,,"13,910",16,1,0,No quantity, ,"31,280",15,1,0,No quantity, ,58
570330,"Carpets and other floor coverings, of man-made textile materials, tufted ""needle punched"", . . .", , , ,12, , , ,,"70,939",1,2,0,No quantity, ,"23,756",2,1,0,No quantity, ,523
570390,"Carpet tiles of vegetable textile materials or coarse animal hair, tufted ""needle punched"", . . .", , , ,12, , , ,,"2,040",57,0,0,No quantity, ,"8,103",43,1,0,No quantity, ,-
570410,"Floor tiles, of felt, not tufted or flocked, with an area of <= 0,3 m", , , ,12, , , ,,105,-12,0,29,No quantity,"3,621","2,733",12,12,5,No quantity,"4,600",80
570420,"Floor tiles, of felt, not tufted or flocked, with an area of > 0,3 m but <= 1 m", , , ,12, , , ,,81,-1,0,10,Tons,"8,100",202,152,2,124,Tons,"1,444",
570490,"Carpets and other floor coverings, of felt, not tufted or flocked, whether or not made up (excl. . . .", , , ,12, , , ,,890,-1,0,0,No quantity, ,249,0,0,0,No quantity, ,
570500,"Carpets and other textile floor coverings, whether or not made up (excl. knotted, woven or . . .", , , ,12, , , ,,"41,361",25,2,0,No quantity, ,"4,552",15,0,0,No quantity, ,-
580110,"Woven pile fabrics and chenille fabrics, of wool or fine animal hair (excl. terry towelling . . .", , , ,12, , , ,,337,2,0,0,Tons, ,2,-54,0,6,Tons,"107,667",
580121,"Uncut weft pile fabrics, of cotton (excl. terry towelling and similar woven terry fabrics, . . .", , , ,12, , , ,,"1,161",-35,5,137, ,"8,474", , , ,2, ,"12,500",
580122,"Cut corduroy, of cotton (excl. terry towelling and similar woven terry fabrics, tufted textile . . .", , , ,12, , , ,,"36,542",22,12,"3,643", ,"10,031", , , ,15, ,"16,467",
580123,"Cut weft pile fabrics, of cotton (excl. terry towelling and similar woven terry fabrics, tufted . . .", , , ,12, , , ,,"1,993",-26,6,0,Tons, ,66,44,0,0,Tons, ,
580126,"Chenille fabrics, of cotton (excl. terry towelling and similar woven terry fabrics, tufted . . .", , , ,12, , , ,,42,-14,0,25, ,"1,680",1,-53,0,1, ,"79,000",
580127,"Warp pile fabrics, of cotton (excl. terry towelling and similar woven terry fabrics, tufted . . .", , , ,12, , , ,,"3,888",-7,4,196,Tons,"19,837",16,-7,0,0,Tons, ,
580131,"Uncut weft pile fabrics, of man-made fibres (excl. terry towelling and similar woven terry . . .", , , ,12, , , ,,"39,152",11,50,"6,279",Tons,"6,235",105,30,0,170,Tons,"8,829",
580132,"Cut corduroy, of man-made fibres (excl. terry towelling and similar woven terry fabrics, tufted . . .", , , ,12, , , ,,"4,020",25,5,530,Tons,"7,585",2,-61,0,"1,279",Tons,"3,564",18
580133,"Cut weft pile fabrics, of man-made fibres (excl. terry towelling and similar woven terry fabrics, . . .", , , ,12, , , ,,"22,098",-2,13,0,Tons, ,49,20,0,"1,303",Tons,"11,208",35
580136,"Chenille fabrics, of man-made fibres (excl. terry towelling and similar woven terry fabrics, . . .", , , ,12, , , ,,"49,165",9,8,0,Tons, ,27,-14,0,0,Tons, ,19
580137,"Warp pile fabrics, of man-made fibres (excl. terry towelling and similar woven terry fabrics, . . .", , , ,12, , , ,,"12,543",7,3,0,Tons, ,58,-16,0,0,Tons, ,7
580190,"Woven pile fabrics and chenille fabrics (excl. those of man-made fibres, wool or fine animal . . .", , , ,12, , , ,,553,-28,1,0,Tons, ,622,13,2,0,Tons, ,7
580211,"Terry towelling and similar woven terry fabrics, of cotton, unbleached (excluding narrow woven . . .", , , ,12, , , ,,678,25,9,45,No quantity,"15,067",5,2,0,3,No quantity,"18,667",
580219,"Terry towelling and similar woven terry fabrics, of cotton (excluding unbleached, narrow woven . . .", , , ,12, , , ,,"14,454",46,15,959,No quantity,"15,072",149,27,0,74,No quantity,"16,311",
580220,"Terry towelling and similar woven terry fabrics (excl. those of cotton, narrow woven fabrics . . .", , , ,12, , , ,,"4,943",-16,11,0,No quantity, ,43,-13,0,167,No quantity,"4,222",15
580230,Tufted textile fabrics (excl. carpets and other floor coverings), , , ,12, , , ,,"2,738",38,5,0,No quantity, ,4,-52,0,0,No quantity, ,
580300,Gauze (excl. narrow woven fabrics of heading 5806), , , ,12, , , ,,"1,895",-20,2,225,Tons,"8,422",20,13,0,0,Tons, ,
580410,"Tulles and other net fabrics (excl. woven, knitted or crocheted fabrics)", , , ,12, , , ,,"147,432",-4,28,0,Tons, ,199,-31,0,0,Tons, ,97
580421,"Mechanically made lace of man-made fibres in the piece, in strips or in motifs (excl. fabrics . . .", , , ,12, , , ,,"78,157",0,14,"4,406",Tons,"17,739",110,0,0,"1,610",Tons,"11,871",11
580429,"Mechanically made lace in the piece, in strips or in motifs (excl. that of man-made fibres, . . .", , , ,12, , , ,,"5,917",-7,4,279,Tons,"21,208",75,-15,0,144,Tons,"12,049",19
580430,"Handmade lace in the piece, in strips or in motifs (excl. fabrics of heading 6002 to 6006)", , , ,12, , , ,,41,-51,0,1,Tons,"41,000",51,5,0,59,Tons,"5,542",
580500,"Hand-woven tapestries of the type Gobelin, Flanders, Aubusson, Beauvais and the like, and needle-worked . . .", , , ,12, , , ,,"1,596",-53,6,85,Tons,"18,776",5,-25,0,0,Tons, ,
580610,"Narrow woven pile fabrics, incl. terry towelling and similar terry fabrics, and chenille fabrics, . . .", , , ,12, , , ,,"27,034",16,8,"1,986",No quantity,"13,612",187,56,0,0,No quantity, ,
580620,"Narrow woven fabrics of textile materials, containing >= 5% elastomeric yarn or rubber thread . . .", , , ,12, , , ,,"165,106",10,14,"11,510",No quantity,"14,345",162,-16,0,405,No quantity,"8,770",15
580631,"Narrow woven fabrics of cotton, with a width of <= 30 cm, n.e.s.", , , ,12, , , ,,"16,231",-4,9,"1,018",Tons,"15,944",33,40,0,209,Tons,"8,560",
580632,"Narrow woven fabrics of man-made fibres, with a width of <= 30 cm, n.e.s.", , , ,12, , , ,,"189,351",8,8,0,No quantity, ,350,-32,0,"2,974",No quantity,"4,912",30
580639,"Narrow woven fabrics of textile materials other than cotton or man-made fibres, with a width . . .", , , ,12, , , ,,"10,599",-6,4,0,Tons, ,72,-29,0,0,Tons, ,32
580640,"Narrow fabrics consisting of warp without weft assembled by means of an adhesive ""bolducs"", . . .", , , ,12, , , ,,358,-16,0,55,Tons,"6,509",765,129,1,93,Tons,"4,430",
580710,"Labels, badges and similar articles, of textile materials, in the piece, in strips or cut to . . .", , , ,12, , , ,,"169,134",2,17,0,Tons, ,874,-25,0,204,Tons,"22,221",93
580790,"Labels, badges and similar articles, of textile materials, in the piece, in strips or cut to . . .", , , ,12, , , ,,"14,981",-1,6,409,Tons,"36,628",511,-6,0,16,Tons,"36,500",43
580810,Braids in the piece, , , ,12, , , ,,"26,774",7,13,"1,730",Tons,"15,476",23,35,0,224,Tons,"7,540",
580890,"Ornamental trimmings of textile materials, in the piece, not embroidered, other than knitted . . .", , , ,12, , , ,,"5,839",1,3,282,Tons,"20,706",64,-9,0,275,Tons,"10,178",14
580900,"Woven fabrics of metal thread and woven fabrics of metallised yarn of heading 5605, of a kind . . .", , , ,12, , , ,,222,-18,1,0,Tons, ,38,22,0,0,Tons, ,
581010,"Embroidery on a textile fabric ground without visible ground, in the piece, in strips or in . . .", , , ,12, , , ,,"6,738",-8,7,161,Tons,"41,851",11,-22,0,350,Tons,"19,566",1
581091,"Embroidery of cotton on a textile fabric ground, in the piece, in strips or in motifs (excl. . . .", , , ,12, , , ,,"9,005",1,6,348,Tons,"25,876",144,29,0,454,Tons,"38,053",8
581092,"Embroidery of man-made fibres on a textile fabric base, in the piece, in strips or in motifs . . .", , , ,12, , , ,,"36,666",2,4,"1,323",No quantity,"27,714",582,-6,0,"10,495",No quantity,"9,543",109
581099,"Embroidery of materials other than cotton or man-made fibres, on a textile fabric base, in . . .", , , ,12, , , ,,"10,977",-12,9,124,No quantity,"88,524",107,-3,0,405,No quantity,"8,743",80
581100,"Quilted textile products in the piece, composed of one or more layers of textile materials . . .", , , ,12, , , ,,"20,397",30,7,0,Tons, ,83,13,0,83,Tons,"5,048",8
590110,"Textile fabrics coated with gum or amylaceous substances, of a kind used for the outer covers . . .", , , ,12, , , ,,"2,647",19,4,337,No quantity,"7,855",63,-39,0,0,No quantity, ,4
590190,Tracing cloth; prepared painting canvas; buckram and similar stiffened textile fabrics of a . . ., , , ,12, , , ,,"19,204",4,4,0,No quantity, ,69,-9,0,0,No quantity, ,9
590210,"Tyre cord fabric of high-tenacity yarn of nylon or other polyamides, whether or not dipped . . .", , , ,6, , , ,,"44,270",22,3,0,Tons, , , , ,18,Tons,"8,000",7
590220,"Tyre cord fabric of high-tenacity polyester yarn, whether or not dipped or impregnated with . . .", , , ,3, , , ,,"13,062",8,1,"4,342",Tons,"3,008",35,-50,0,3,Tons,"3,000",
590290,"Tyre cord fabric of high-tenacity viscose rayon yarn, whether or not dipped in rubber or plastic", , , ,0, , , ,,187,19,0,10,Tons,"18,700",1,-33,0,0,Tons, ,
590310,"Textile fabrics impregnated, coated, covered or laminated with poly""vinyl chloride"" (excl. . . .", , , ,12, , , ,,"259,731",3,9,0,No quantity, ,361,-22,0,0,No quantity, ,104
590320,"Textile fabrics impregnated, coated, covered or laminated with polyurethane (excl. wallcoverings . . .", , , ,12, , , ,,"1,071,635",7,21,0,No quantity, ,161,39,0,0,No quantity, ,598
590390,"Textile fabrics impregnated, coated, covered or laminated with plastics other than poly""vinyl . . .", , , ,12, , , ,,"581,405",8,13,0,No quantity, ,486,14,0,0,No quantity, ,216
590410,"Linoleum, whether or not cut to shape", , , ,12, , , ,, , , , ,Tons, ,122,25,0,13,Tons,"4,538",
590490,"Floor coverings consisting of a coating or covering applied on a textile backing, whether or . . .", , , ,12, , , ,,656,211,1,65,Tons,"10,092",158,89,0,0,Tons, ,
590500,Textile wallcoverings, , , ,12, , , ,,583,49,0,0,Tons, ,59,-28,0,0,Tons, ,-
590610,"Adhesive tape of rubberised textile fabrics, of a width of <= 20 cm (excl. that impregnated . . .", , , ,12, , , ,,"9,959",4,1,0,No quantity, ,529,8,0,791,No quantity,"6,424",31
590691,"Knitted or crocheted textile fabrics, rubberised, n.e.s.", , , ,10, , , ,,"30,242",7,21,"2,352",Tons,"12,858",25,19,0,24,Tons,"8,542",
590699,"Rubberised textile fabrics (excl. knitted or crocheted textile fabrics, adhesive tape of a . . .", , , ,5, , , ,,"22,786",21,3,0,Tons, ,22,-13,0,0,Tons, ,5
590700,"Impregnated, coated or covered textile fabrics; painted canvas being theatrical scenery, studio . . .", , , ,10, , , ,,"34,246",0,4,0,No quantity, ,"8,678",53,1,"3,389",No quantity,"5,854",293
590800,"Textile wicks, woven, plaited or knitted, for lamps, stoves, lighters, candles or the like; . . .", , , ,12, , , ,,"3,003",8,5,256,Tons,"11,730",6,-16,0,28,Tons,"5,750",
590900,"Textile hosepiping and similar textile tubing, whether or not impregnated or coated, with or . . .", , , ,0, , , ,,"5,323",-5,2,0,Tons, ,406,1,0,"1,134",Tons,"5,072",44
591000,"Transmission or conveyor belts or belting, of textile material, whether or not impregnated, . . .", , , ,6, , , ,,"10,877",18,2,0,Tons, ,43,32,0,548,Tons,"9,432",6
591110,"Textile fabrics, felt and felt-lined woven fabrics, coated, covered or laminated with rubber, . . .", , , ,0, , , ,,"19,299",17,4,0,No quantity, ,104,-14,0,0,No quantity, ,54
591120,"Bolting cloth, whether or not made up", , , ,0, , , ,,"7,950",10,2,412,Tons,"19,296",37,-8,0,99,Tons,"19,232",6
591131,"Textile fabrics and felts, endless or fitted with linking devices, of a kind used in papermaking . . .", , , ,0, , , ,,"1,380",6,0,0,No quantity, ,6,-60,0,36,No quantity,"21,250",3
591132,"Textile fabrics and felts, endless or fitted with linking devices, of a kind used in papermaking . . .", , , ,0, , , ,,"11,390",2,1,0,Tons, ,3,-10,0,0,Tons, ,9
591140,"Filtering or straining cloth of a kind used in oil-presses or for similar technical purposes, . . .", , , ,0, , , ,,"8,383",32,2,848, ,"9,886",3,-26,0,269, ,"12,409",
591190,"Textile products and articles, for technical purposes, specified in Note 7 to chapter 59, n.e.s.", , , ,0, , , ,,"83,486",6,3,"5,134",No quantity,"16,261","1,251",7,0,"1,720",No quantity,"14,205",183
600110,"Long pile fabrics, knitted or crocheted", , , ,12, , , ,,"109,567",10,17,"10,428",No quantity,"10,507",100,135,0,200,No quantity,"7,790",29
600121,"Looped pile fabrics of cotton, knitted or crocheted", , , ,12, , , ,,"73,397",16,25,"9,299",No quantity,"7,893",15,-43,0,20,No quantity,"21,850",
600122,"Looped pile fabrics of man-made fibres, knitted or crocheted", , , ,12, , , ,,"79,060",8,21,"10,990",Tons,"7,194", , , ,34,Tons,"4,941",
600129,"Looped pile fabrics, knitted or crocheted (excl. of cotton or man-made fibres)", , , ,12, , , ,,"2,073",-33,2,142,No quantity,"14,599",3,-45,0,3,No quantity,"9,333",77
600191,"Pile fabrics of cotton, knitted or crocheted (excl. ""long pile"" fabrics)", , , ,12, , , ,,"266,472",29,51,"32,945",No quantity,"8,088", , , ,181,No quantity,"11,608",
600192,"Pile fabrics of man-made fibres, knitted or crocheted (excl. ""long pile"" fabrics)", , , ,12, , , ,,"568,143",9,17,0,No quantity, ,516,0,0,0,No quantity, ,160
600199,"Pile fabrics, knitted or crocheted (excl. cotton or man-made fibres and ""long pile"" fabrics)", , , ,12, , , ,,"5,386",-19,4,496,Tons,"10,859",85,6,0,67,Tons,"2,612",485
600240,"Knitted or crocheted fabrics, of a width of <= 30 cm, containing >= 5% by weight elastomeric . . .", , , ,12, , , ,,"39,096",3,10,"1,705",Tons,"22,930",163,-30,0,32,Tons,"7,625",
600290,"Knitted or crocheted fabrics, of a width of <= 30 cm, containing >= 5% by weight elastomeric . . .", , , ,12, , , ,,"15,529",8,7,"1,355",No quantity,"11,461",30,-25,0,151,No quantity,"4,821",
600310,"Knitted or crocheted fabrics of wool or fine animal hair, of a width of <= 30 cm (excl. those . . .", , , ,12, , , ,,75,-8,0,6, ,"12,500", , , ,7, ,"7,714",
600320,"Knitted or crocheted fabrics of cotton, of a width of <= 30 cm (excl. those containing by weight . . .", , , ,12, , , ,,"1,796",16,2,71,No quantity,"25,296",1,-2,0,6,No quantity,"10,667",
600330,"Knitted or crocheted fabrics of synthetic fibres, of a width of <= 30 cm (excl. those containing . . .", , , ,12, , , ,,"21,071",9,8,"1,056",Tons,"19,954", , , ,207,Tons,"12,623",
600340,"Knitted or crocheted fabrics of artificial fibres, of a width of <= 30 cm (excl. those containing . . .", , , ,12, , , ,,452,46,6,17,No quantity,"26,588", , , ,0,No quantity, ,
600390,"Knitted or crocheted fabrics of a width of <= 30 cm (excl. of cotton, man-made fibres, wool . . .", , , ,12, , , ,,374,31,2,21,Tons,"17,810",1,-11,0,51,Tons,"6,235",
600410,"Knitted or crocheted fabrics, of a width of > 30 cm, containing >= 5% by weight elastomeric . . .", , , ,12, , , ,,"1,971,174",10,27,"201,779",Tons,"9,769","5,296",27,0,"12,131",Tons,"5,161","1,391"
600490,"Knitted or crocheted fabrics, of a width of > 30 cm, containing >= 5% by weight elastomeric . . .", , , ,12, , , ,,"30,064",5,2,"2,877",Tons,"10,450",51,-39,0,105,Tons,"5,371",
600521,"Unbleached or bleached cotton warp knit fabrics ""incl. those made on galloon knitting machines"", . . .", , , ,12, , , ,,313,24,1,39,Tons,"8,026",1,-40,0,4,Tons,"15,750",
600522,"Dyed cotton warp knit fabrics ""incl. those made on galloon knitting machines"", of a width of . . .", , , ,12, , , ,,"16,706",2,18,"2,258",Tons,"7,399", , , ,5,Tons,"9,600",
600523,"Cotton warp knit fabrics of yarns of different colours ""incl. those made on galloon knitting . . .", , , ,12, , , ,,245,-14,5,25,Tons,"9,800", , , ,0,Tons, ,
600524,"Printed cotton warp knit fabrics ""incl. those made on galloon knitting machines"", of a width . . .", , , , , , , ,,218,1,1,12,Tons,"18,167", , , , ,Tons, ,
600535,"Warp knit fabrics of synthetic fibres, antimalarial, of a width of > 30 cm", , , ,12, , , ,,"23,030",-12,17,"3,162",Tons,"7,283",75,56,0,52,Tons,"6,115",
600536,"Unbleached or bleached warp knit fabrics of synthetic fibres ""incl. those made on galloon knitting . . .", , , ,12, , , ,,"60,937",17,10,"12,143",No quantity,"5,018",13,-23,0,189,No quantity,"7,862",
600537,"Dyed warp knit fabrics of synthetic fibres ""incl. those made on galloon knitting machines"", . . .", , , ,12, , , ,,"365,115",4,23,0,No quantity, ,102,-21,0,"3,500",No quantity,"4,204",
600538,"Warp knit fabrics of synthetic fibres, of yarns of different colours ""incl. those made on galloon . . .", , , ,12, , , ,,"4,821",23,3,747,Tons,"6,454",38,-28,0,692,Tons,"4,136",
600539,"Printed warp knit fabrics of synthetic fibres ""incl. those made on galloon knitting machines"", . . .", , , ,12, , , ,,"21,117",-13,10,"3,259",No quantity,"6,480",29,22,0,527,No quantity,"3,611",
600541,"Unbleached or bleached warp knit fabrics of artificial fibres ""incl. those made on galloon . . .", , , ,12, , , ,,201,-24,2,37, ,"5,432", , , ,0, , ,
600542,"Dyed warp knit fabrics of artificial fibres ""incl. those made on galloon knitting machines"", . . .", , , ,12, , , ,,"5,326",14,15,609,Tons,"8,745", , , ,11,Tons,"2,818",
600543,"Warp knit fabrics of artificial fibres, of yarns of different colours ""incl. those made on . . .", , , , , , , ,,40,-52,2,7, ,"5,714", , , , , , ,
600544,"Printed warp knit fabrics of artificial fibres ""incl. those made on galloon knitting machines"", . . .", , , ,12, , , ,,72,2,0,6,Tons,"12,000", , , ,4,Tons,"16,750",
600590,"Warp knit fabrics ""incl. those made on galloon knitting machines"", of a width of > 30 cm (excl. . . .", , , ,12, , , ,,"16,089",-18,5,"1,818",No quantity,"8,850",4,-45,0,"1,089",No quantity,"3,162",
600610,"Fabrics, knitted or crocheted, of a width of > 30 cm, of wool or fine animal hair (excl. warp . . .", , , ,12, , , ,,"11,842",-5,5,0,No quantity, ,1,-43,0,0,No quantity, ,24
600621,"Unbleached or bleached cotton fabrics, knitted or crocheted, of a width of > 30 cm (excl. warp . . .", , , ,12, , , ,,"96,740",16,12,"12,432",Tons,"7,782",207,-13,0,225,Tons,"3,982",
600622,"Dyed cotton fabrics, knitted or crocheted, of a width of > 30 cm (excl. warp knit fabrics ""incl. . . .", , , ,12, , , ,,"1,196,776",6,28,0,No quantity, ,520,56,0,"1,694",No quantity,"6,517",99
600623,"Cotton fabrics, knitted or crocheted, of yarns of different colours, of a width of > 30 cm . . .", , , ,12, , , ,,"265,336",15,57,"29,017",No quantity,"9,144",40,-52,0,29,No quantity,"11,069",
600624,"Printed cotton fabrics, knitted or crocheted, of a width of > 30 cm (excl. warp knit fabrics . . .", , , ,12, , , ,,"204,906",10,36,"21,802",No quantity,"9,398",93,44,0,185,No quantity,"12,670",12
600631,"Unbleached or bleached fabrics, knitted or crocheted, of synthetic fibres, of a width of > . . .", , , ,12, , , ,,"102,723",11,11,"17,656",No quantity,"5,818",89,98,0,646,No quantity,"4,746",48
600632,"Dyed fabrics, knitted or crocheted, of synthetic fibres, of a width of > 30 cm (excl. warp . . .", , , ,12, , , ,,"1,967,880",0,31,0,No quantity, ,"1,242",2,0,0,No quantity, ,"2,958"
600633,"Fabrics, knitted or crocheted, of synthetic fibres, of yarns of different colours, of a width . . .", , , ,12, , , ,,"75,033",8,13,0,Tons, ,39,-34,0,"1,348",Tons,"4,919",25
600634,"Printed fabrics, knitted or crocheted, of synthetic fibres, of a width of > 30 cm (excl. warp . . .", , , ,12, , , ,,"111,102",7,19,"14,528",No quantity,"7,647",152,12,0,"6,011",No quantity,"3,053",181
600641,"Unbleached or bleached fabrics, knitted or crocheted, of artificial fibres, of a width of > . . .", , , ,12, , , ,,"1,781",-16,2,192,Tons,"9,276",11,6,0,5,Tons,"3,600",
600642,"Dyed fabrics, knitted or crocheted, of artificial fibres, of a width of > 30 cm (excl. warp . . .", , , ,12, , , ,,"142,505",-5,24,0,No quantity, ,11,-70,0,"3,159",No quantity,"5,247",90
600643,"Fabrics, knitted or crocheted, of artificial fibres, of yarns of different colours, of a width . . .", , , ,12, , , ,,"5,695",-22,10,613,Tons,"9,290", , , ,15,Tons,"9,000",
600644,"Printed fabrics, knitted or crocheted, of artificial fibres, of a width of > 30 cm (excl. warp . . .", , , ,12, , , ,,"18,020",-5,19,"2,195",Tons,"8,210", , , ,157,Tons,"6,248",11
600690,"Fabrics, knitted or crocheted, of a width of > 30 cm (excl. of man-made fibres, cotton, wool . . .", , , ,12, , , ,,"99,080",-1,3,0,No quantity, ,964,30,0,0,No quantity, ,63
610120,"Overcoats, car coats, capes, cloaks, anoraks, incl. ski jackets, windcheaters, wind-jackets . . .", , , ,20, , , ,,"3,550",28,0,0,No quantity, ,222,23,0,0,No quantity, ,-
610130,"Overcoats, car coats, capes, cloaks, anoraks, incl. ski jackets, windcheaters, wind-jackets . . .", , , ,20, , , ,,"3,299",30,0,0,No quantity, ,188,-10,0,0,No quantity, ,-
610190,"Overcoats, car coats, capes, cloaks, anoraks, incl. ski jackets, windcheaters, wind-jackets . . .", , , ,20, , , ,,294,68,0,0,No quantity, ,70,-17,0,0,No quantity, ,11
610210,"Women's or girls' overcoats, car coats, capes, cloaks, anoraks, incl. ski jackets, windcheaters, . . .", , , ,20, , , ,,239,15,0,0,No quantity, ,146,50,0,0,No quantity, ,-
