760720,"Aluminium foil, backed, of a thickness (excl. any backing) of <= 0,2 mm (excl. stamping foils . . .", , , ,3, , , ,,"90,084",7,2,0,Tons, ,"22,079",16,1,"17,026",Tons,"3,844",456
760810,Tubes and pipes of non-alloy aluminium (excl. hollow profiles), , , ,3, , , ,,"10,891",20,3,"1,388",Tons,"7,847",156,-11,0,524,Tons,"5,842",53
760820,Tubes and pipes of aluminium alloys (excl. hollow profiles), , , ,3, , , ,,"38,603",12,2,"6,483",Tons,"5,954","8,239",29,0,"1,225",Tons,"6,042",31
760900,"Aluminium tube or pipe fittings ""e.g., couplings, elbows, sleeves""", , , ,3, , , ,,"5,455",19,0,517,Tons,"10,551",859,-7,0,536,Tons,"9,597",14
761010,"Doors, windows and their frames and thresholds for door, of aluminium (excl. door furniture)", , , ,15, , , ,,"21,085",-2,0,"2,506",No quantity,"8,414","17,366",-14,0,0,No quantity, ,88
761090,"Structures and parts of structures, of aluminium, n.e.s., and plates, rods, profiles, tubes . . .", , , ,11, , , ,,"249,377",29,2,"60,210",Tons,"4,142","71,788",8,1,"9,326",Tons,"6,882",859
761100,"Reservoirs, tanks, vats and similar containers, of aluminium, for any material (other than . . .", , , ,5, , , ,,"2,249",31,1,232,No quantity,"9,694",84,-9,0,0,No quantity, ,10
761210,"Collapsible tubular containers, of aluminium", , , ,20, , , ,,"1,195",-10,0,113,Tons,"10,575",74,-24,0,0,Tons, ,-
761290,"Casks, drums, cans, boxes and similar containers, incl. rigid tubular containers, of aluminium, . . .", , , ,15, , , ,,"57,029",7,1,0,No quantity, ,"107,152",48,2,0,No quantity, ,"1,355"
761300,Aluminium containers for compressed or liquefied gas, , , ,3, , , ,,"2,223",-6,0,0,No quantity, ,"1,856",45,0,0,No quantity, ,17
761410,"Stranded wire, cables, plaited bands and the like, of aluminium, with steel core (excl. such . . .", , , ,13, , , ,,"4,377",-17,0,936,Tons,"4,676","1,402",127,0,99,Tons,"5,040",16
761490,"Stranded wires, cables, ropes and similar articles, of aluminium (other than with steel core . . .", , , ,13, , , ,,"49,986",59,5,"12,331",Tons,"4,054","7,836",281,1,422,Tons,"3,429",10
761510,"Table, kitchen or other household articles and parts thereof, and pot scourers and scouring . . .", , , ,26, , , ,,"31,720",13,0,"3,756",No quantity,"8,445","14,234",8,0,"17,581",No quantity,"5,772",20
761520,"Sanitary ware and parts thereof, of aluminium (excl. cans, boxes and similar containers of . . .", , , ,30, , , ,,936,18,0,73,Tons,"12,822",233,-11,0,121,Tons,"12,860",1
761610,"Nails, tacks, staples, screws, bolts, nuts, screw hooks, rivets, cotters, cotter pins, washers . . .", , , ,20, , , ,,"12,266",18,1,"1,257",No quantity,"9,758",276,-15,0,420,No quantity,"13,160",31
761691,"Cloth, grill, netting and fencing, of aluminium wire (excl. cloth of metal fibres for clothing, . . .", , , ,20, , , ,,"2,723",27,1,0,No quantity, ,681,64,0,391,No quantity,"8,969",1
761699,"Articles of aluminium, n.e.s.", , , ,17, , , ,,"321,909",-4,2,0,No quantity, ,"9,149",-4,0,"18,129",No quantity,"5,260",742
780110,"Unwrought lead, refined", , , ,0, , , ,,"387,879",3,9,"181,354",Tons,"2,139","50,343",-11,1,"18,257",Tons,"1,886","3,968"
780191,"Unwrought lead, containing by weight antimony as the principal other element", , , ,0, , , ,,"29,113",20,3,"13,260",Tons,"2,196","11,952",-14,1,"6,357",Tons,"2,300",344
780199,Unwrought lead (excl. refined lead and lead containing by weight antimony as the principal . . ., , , ,0, , , ,,"109,308",8,5,"42,635",Tons,"2,564","74,730",16,4,"5,806",Tons,"2,483",-
780200,"Lead waste and scrap (excl. ashes and residues from lead production ""heading No 2620"", and . . .", , , ,0, , , ,,"1,430",23,0,726, ,"1,970","6,567",-13,1,"3,941", ,"1,386",
780411,"Lead sheets, strip and foil, of a thickness ""excl. any backing"" of <= 0,2 mm", , , ,0, , , ,,194,282,1,65, ,"2,985",25,292,0,378, ,"2,614",
780419,"Lead plates; lead sheets, strip and foil, of a thickness ""excl. any backing"" of > 0,2 mm", , , ,0, , , ,,"2,417",-3,1,431,Tons,"5,608","3,649",-1,1,"1,756",Tons,"1,984",78
780420,"Lead powders and flakes (excl. grains of lead, and spangles of heading 8308)", , , , , , , ,,12,-51,0,3,Tons,"4,000", , , , ,Tons, ,
780600,"Articles of lead, n.e.s.", , , ,0, , , ,,"9,552",-5,2,0,Tons, ,598,63,0,"2,411",Tons,"1,169",18
790111,"Unwrought zinc, not alloyed, containing by weight >= 99,99% of zinc", , , ,0, , , ,,"343,205",2,3,"97,420",Tons,"3,523","15,205",-11,0,"61,859",Tons,"3,708","1,824"
790112,"Unwrought zinc, not alloyed, containing by weight < 99,99% of zinc", , , ,0, , , ,,"131,998",21,3,"35,316",Tons,"3,738","108,690",25,3,"5,968",Tons,"3,824",648
790120,Unwrought zinc alloys, , , ,0, , , ,,"191,278",29,7,"50,685",Tons,"3,774",657,-14,0,"3,041",Tons,"3,839",29
790200,"Zinc waste and scrap (excl. ash and residues from zinc production ""heading 2620"", ingots and . . .", , , ,0, , , ,,771, ,0,401,Tons,"1,923","19,827",-15,2,"1,250",Tons,"1,548",129
790310,Zinc dust, , , ,0, , , ,,"7,315",7,2,"1,897", ,"3,856","3,515",40,1,959, ,"3,436",35
790390,"Zinc powders and flakes (excl. grains of zinc, and spangles of heading 8308, and zinc dust)", , , ,0, , , ,,"4,117",100,2,878,Tons,"4,689","1,497",17,1,58,Tons,"5,259",15
790400,"Zinc bars, rods, profiles and wire, n.e.s.", , , ,0, , , ,,"1,588",-10,1,335,Tons,"4,740",541,136,0,"1,055",Tons,"4,051",17
790500,"Zinc plates, sheets, strip and foil", , , ,0, , , ,,889,-12,0,210,Tons,"4,233",65,-30,0,1,Tons,"12,000",5
790700,"Articles of zinc, n.e.s.", , , ,8, , , ,,"13,859",27,1,0,Tons, ,748,2,0,0,Tons, ,865
800110,"Unwrought tin, not alloyed", , , ,3, , , ,,"22,761",29,0,837,Tons,"27,194", , , ,790,Tons,"25,222",2
800120,Unwrought tin alloys, , , ,3, , , ,,"5,308",18,1,140, ,"37,914","12,625",1,3,249, ,"15,124",81
800200,"Tin waste and scrap (excl. ash and residues from the manufacture of tin of heading 2620, and . . .", , , ,3, , , ,,6,26,0,0,Tons, ,965,84,1,187,Tons,"11,877",
800300,"Tin bars, rods, profiles and wire, n.e.s.", , , ,7, , , ,,"44,220",28,7,"1,348",Tons,"32,804",40,-32,0,138,Tons,"35,783",26
800700,"Articles of tin, n.e.s.", , , ,13, , , ,,"7,249",9,2,293,No quantity,"24,741",76,-12,0,0,No quantity, ,150
810110,Tungsten powders, , , ,0, , , ,,"2,759",18,1,59,Tons,"46,763",8,136,0,1,Tons,"121,000",
810194,"Unwrought tungsten, incl. bars and rods of tungsten obtained simply by sintering", , , ,0, , , ,,83,-24,0,1,Tons,"83,000",6,69,0,0,Tons, ,
810196,Tungsten wire, , , ,0, , , ,,"3,706",33,3,10,Tons,"370,600",7,21,0,2,Tons,"81,000",
810197,Tungsten waste and scrap (excl. ash and residues containing tungsten), , , ,0, , , ,,"1,434",-8,0,70,Tons,"20,486","1,900",160,0,3,Tons,"1,000",
810199,"Articles of tungsten, n.e.s.", , , ,0, , , ,,"4,750",-1,1,116,Tons,"40,948",28,-63,0,7,Tons,"88,571",7
810210,Molybdenum powders, , , ,0, , , ,,445,43,1,6,Tons,"74,167", , , ,0,Tons, ,
810294,"Unwrought molybdenum, incl. bars and rods obtained simply by sintering", , , , , , , ,, , , , , , ,16, ,0,5, ,"44,200",
810295,"Molybdenum bars and rods (other than those obtained simply by sintering), profiles, plates, . . .", , , ,0, , , ,,666,1,0,4, ,"166,500", , , ,6, ,"90,000",
810296,Molybdenum wire, , , ,0, , , ,,"1,263",43,2,28,Tons,"45,107",3, ,0,0,Tons, ,
810297,Molybdenum waste and scrap (excl. ash and residues containing molybdenum), , , ,0, , , ,, , , , ,Tons, ,14, ,0,43,Tons,"43,837",
810299,"Articles of molybdenum, n.e.s.", , , ,0, , , ,,441,12,0,3, ,"147,000",203, ,0,2, ,"143,000",
810320,"Unwrought tantalum, incl. bars and rods of tantalum obtained simply by sintering; tantalum . . .", , , ,0, , , ,,804, ,0,2, ,"402,000", , , ,7, ,"431,571",
810390,"Articles of tantalum, n.e.s.", , , ,0, , , ,,10,6,0,0, , , , , ,1, ,"162,000",
810411,"Unwrought magnesium, containing >= 99,8% by weight of magnesium", , , ,0, , , ,,"14,017",30,1,"2,744", ,"5,108", , , ,"14,031", ,"5,586",
810419,"Unwrought magnesium, containing < 99,8% by weight of magnesium", , , ,0, , , ,,"10,297",35,1,"1,968",Tons,"5,232", , , ,840,Tons,"2,364",
810420,"Magnesium waste and scrap (excl. ash and residues containing magnesium, and raspings, turnings . . .", , , ,0, , , ,,50,-70,0,324,Tons,154,"2,991",156,1,"8,061",Tons,495,
810430,"Magnesium raspings, turnings and granules, graded according to size; magnesium powders", , , ,0, , , ,,"5,254",29,1,803, ,"6,543", , , ,87, ,"6,402",
810490,"Articles of magnesium, n.e.s.", , , ,0, , , ,,"2,354",-5,1,452,Tons,"5,208",288,22,0,21,Tons,"17,952",21
810520,Cobalt mattes and other intermediate products of cobalt metallurgy; unwrought cobalt; cobalt . . ., , , ,0, , , ,,"2,128",-4,0,31,Tons,"68,645","3,846",247,0,209,Tons,"33,062",
810530,Cobalt waste and scrap (excl. ash and residues containing cobalt), , , , , , , ,, , , , , , ,270,2,0,2, ,"10,500",
810590,"Articles of cobalt, n.e.s.", , , ,0, , , ,,589,-29,0,0,Tons, ,67,-17,0,"2,914",Tons,"8,743",5
810600,"Bismuth and articles thereof, n.e.s.; bismuth waste and scrap (excluding ash and residues containing . . .", , , ,0, , , ,,931,-7,1,102, ,"9,127",2, ,0,0, , ,
810720,Unwrought cadmium; cadmium powders, , , ,0, , , ,,10, ,0,0, , ,"2,208",63,4,1, ,"10,000",
810790,"Articles of cadmium, n.e.s.", , , , , , , ,,1, ,0,0, , , , , , , , ,
810820,Unwrought titanium; titanium powders, , , ,0, , , ,,669,9,0,88,Tons,"7,602",133,126,0,4,Tons,"66,000",
810830,Titanium waste and scrap (excl. ash and residues containing titanium), , , ,0, , , ,, , , , ,Tons, ,708,3,0, ,Tons, ,
810890,"Articles of titanium, n.e.s.", , , ,0, , , ,,"16,865",16,0,0,No quantity, ,"1,658",32,0,0,No quantity, ,8
810920,Unwrought zirconium; zirconium powders, , , ,0, , , ,,152,-28,0,51, ,"2,980",11, ,0, , , ,
810990,"Articles of zirconium, n.e.s.", , , ,0, , , ,,189,-13,0,0,Tons, ,14, ,0,1,Tons,"103,000",
811010,Unwrought antimony; antimony powders, , , ,0, , , ,,466,7,0,54,Tons,"8,630", , , ,11,Tons,"11,909",1
811020,Antimony waste and scrap (excl. ash and residues containing antimony), , , , , , , ,,96, ,14,42, ,"2,286", , , , , , ,
811090,"Articles of antimony, n.e.s.", , , , , , , ,,329,206,1,55,Tons,"5,982", , , , ,Tons, ,
811100,"Manganese and articles thereof, n.e.s.; manganese waste and scrap (excl. ash and residues containing . . .", , , ,0, , , ,,"3,234",-5,0,"4,695",Tons,689,455,43,0,498,Tons,"4,669",
811219,"Articles of beryllium, n.e.s.", , , ,0, , , ,,4,-11,0,0, , ,1,-41,0,0, , ,
811221,Unwrought chromium; chromium powders, , , ,0, , , ,,"1,970",113,0,183, ,"10,765", , , ,43, ,"11,837",1
811222,Chromium waste and scrap (excl. ash and residues containing chromium and chromium alloys containing . . ., , , , , , , ,,19, ,0,1, ,"19,000", , , , , , ,
811229,"Articles of chromium, n.e.s.", , , ,0, , , ,,222,34,0,2,Tons,"111,000",46, ,0,1,Tons,"277,000",
811292,"Unwrought niobium ""columbium"", gallium, indium, vanadium and germanium; powders and waste and . . .", , , ,0, , , ,,25,-2,0,0,Tons, , , , ,0,Tons, ,
811299,"Articles of niobium ""columbium"", gallium, indium, vanadium and germanium, n.e.s.", , , ,0, , , ,,"12,313",140,3,65,Tons,"189,431",436, ,0,3,Tons,"20,667",
811300,"Cermets and articles thereof, n.e.s.; waste and scrap of cermets (excl. ash and residues containing . . .", , , ,0, , , ,,"2,357",0,0,43,Tons,"54,814",200,50,0,38,Tons,"81,158",
820110,"Spades and shovels, with working parts of base metal", , , ,20, , , ,,"17,561",44,3,"3,193",No quantity,"5,500",168,-38,0,0,No quantity, ,3
820130,"Mattocks, picks, hoes and rakes, with working parts of base metal (excl. ice axes)", , , ,20, , , ,,"5,295",26,1,0,No quantity, ,"1,883",5,0,0,No quantity, ,1
820140,"Axes, billhooks and similar hewing tools, with working parts of base metal (excl. ice axes)", , , ,20, , , ,,"2,273",167,1,0,No quantity, ,84,-51,0,0,No quantity, ,1
820150,"Secateurs and similar one-handed pruners and shears, incl. poultry shears, with working parts . . .", , , ,20, , , ,,"9,778",24,3,0,No quantity, ,5,-63,0,0,No quantity, ,2
820160,"Hedge shears, two-handed pruning shears and similar two-handed shears, with working parts of . . .", , , ,20, , , ,,"2,394",54,1,0,No quantity, ,13,-14,0,0,No quantity, ,-
820190,"Scythes, sickles, hay knives, timber wedges and other hand tools of a kind used in agriculture, . . .", , , ,20, , , ,,"2,692",55,0,0,No quantity, ,311,-40,0,0,No quantity, ,-
820210,"Handsaws, with working parts of base metal (excl. power-operated saws)", , , ,20, , , ,,"10,186",15,2,0,No quantity, ,474,17,0,0,No quantity, ,3
820220,Bandsaw blades of base metal, , , ,10, , , ,,"7,265",18,1,0,No quantity, ,218,-5,0,0,No quantity, ,-
820231,"Circular saw blades, incl. slitting or slotting saw blades, of base metal, with working parts . . .", , , ,2, , , ,,"9,603",0,1,0,No quantity, ,108,-26,0,0,No quantity, ,11
820239,"Circular saw blades, incl. slitting or slotting saw blades, and parts thereof, of base metal, . . .", , , ,2, , , ,,"36,380",2,3,"4,318",No quantity,"8,425","11,778",234,1,0,No quantity, ,35
820240,Chainsaw blades of base metal, , , ,0, , , ,,"5,397",20,1,0,Tons, ,10,27,0,43,Tons,"19,930",14
820291,"Straight saw blades, of base metal, for working metal", , , ,2, , , ,,"1,331",24,1,0,No quantity, ,9,-31,0,0,No quantity, ,15
820299,"Saw blades, incl. toothless saw blades, of base metal (excl. bandsaw blades, circular saw blades, . . .", , , ,2, , , ,,"37,825",34,4,0,No quantity, ,263,2,0,0,No quantity, ,38
820310,"Files, rasps and similar hand tools of base metal", , , ,20, , , ,,"3,494",-6,1,0,No quantity, ,60,9,0,0,No quantity, ,10
820320,"Pliers, incl. cutting pliers, pincers and tweezers for non-medical use and similar hand tools, . . .", , , ,20, , , ,,"29,078",11,1,0,No quantity, ,532,21,0,0,No quantity, ,14
820330,"Metal-cutting shears and similar hand tools, of base metal", , , ,5, , , ,,"2,195",6,1,0,No quantity, ,55,-19,0,0,No quantity, ,6
820340,"Pipe-cutters, bolt croppers, perforating punches and similar hand tools, of base metal", , , ,10, , , ,,"2,438",22,1,0,No quantity, ,130,-10,0,0,No quantity, ,4
820411,"Hand-operated spanners and wrenches, incl. torque meter wrenches, of base metal, non-adjustable", , , ,15, , , ,,"22,124",10,1,0,No quantity, ,413,-2,0,0,No quantity, ,22
820412,"Hand-operated spanners and wrenches, incl. torque meter wrenches, of base metal, adjustable . . .", , , ,20, , , ,,"17,629",17,3,0,No quantity, ,282,3,0,0,No quantity, ,11
820420,"Interchangeable spanner sockets, with or without handles, of base metal", , , ,20, , , ,,"10,694",24,1,0,No quantity, ,260,11,0,0,No quantity, ,5
820510,"Hand-operated drilling, threading or tapping hand tools", , , ,5, , , ,,"3,861",2,2,0,No quantity, ,"1,599",38,1,0,No quantity, ,19
820520,Hammers and sledge hammers with working parts of base metal, , , ,20, , , ,,"6,889",-2,1,0,No quantity, ,167,4,0,0,No quantity, ,14
820530,"Planes, chisels, gouges and similar cutting tools for working wood", , , ,20, , , ,,"2,368",-5,1,0,No quantity, ,100,-4,0,0,No quantity, ,3
820540,Hand-operated screwdrivers, , , ,20, , , ,,"17,914",11,2,0,No quantity, ,77,-22,0,0,No quantity, ,17
820551,"Household hand tools, non-mechanical, with working parts of base metal, n.e.s.", , , ,20, , , ,,"25,207",50,2,0,No quantity, ,171,2,0,0,No quantity, ,3
820559,"Hand tools, incl. glaziers' diamonds, of base metal, n.e.s.", , , ,20, , , ,,"49,048",6,1,0,No quantity, ,"1,905",15,0,0,No quantity, ,52
820560,Blowlamps and the like (excl. gas-powered blowlamps), , , ,20, , , ,,303,34,0,25,No quantity,"12,120",4,-34,0,0,No quantity, ,
820570,"Vices, clamps and the like (excl. accessories for and parts of machine tools or water-jet cutting . . .", , , ,20, , , ,,"7,593",3,1,0,No quantity, ,476,3,0,0,No quantity, ,4
820590,Anvils; portable forges; hand- or pedal-operated grinding wheels with frameworks; sets of articles . . ., , , ,20, , , ,,"19,390",29,5,0,No quantity, ,626,-3,0,0,No quantity, ,39
820600,"Sets of two or more tools of heading 8202 to 8205, put up in sets for retail sale", , , ,20, , , ,,"12,030",0,1,0,No quantity, ,641,-26,0,0,No quantity, ,18
820713,"Rock-drilling or earth-boring tools, interchangeable, with working parts of sintered metal . . .", , , ,0, , , ,,"2,176",-1,0,0,No quantity, ,592,-1,0,0,No quantity, ,6
820719,"Rock-drilling or earth-boring tools, interchangeable, and parts therefor, with working parts . . .", , , ,0, , , ,,"22,130",3,1,0,No quantity, ,"18,720",9,1,0,No quantity, ,261
820720,Interchangeable dies for drawing or extruding metal, , , ,0, , , ,,"25,992",-9,3,0,No quantity, ,"1,128",-15,0,0,No quantity, ,62
820730,"Interchangeable tools for pressing, stamping or punching", , , ,0, , , ,,"163,155",11,3,0,No quantity, ,338,1,0,0,No quantity, ,13
820740,"Tools for tapping or threading, interchangeable", , , ,0, , , ,,"11,445",7,1,0,No quantity, ,312,16,0,0,No quantity, ,9
820750,"Tools for drilling, interchangeable (excl. rock-drilling or earth-boring tools and tools for . . .", , , ,0, , , ,,"58,194",5,1,0,No quantity, ,908,-2,0,0,No quantity, ,149
820760,Interchangeable tools for boring or broaching, , , ,0, , , ,,"6,291",5,1,0,No quantity, ,133,-8,0,0,No quantity, ,16
820770,Interchangeable tools for milling, , , ,0, , , ,,"62,290",-2,2,0,No quantity, ,"2,022",31,0,0,No quantity, ,3
820780,Interchangeable tools for turning, , , ,0, , , ,,"8,565",6,2,0,No quantity, ,133,3,0,0,No quantity, ,6
820790,"Interchangeable tools for hand tools, whether or not power-operated, or for machine tools, . . .", , , ,0, , , ,,"48,544",3,1,0,No quantity, ,"5,892",1,0,0,No quantity, ,64
820810,"Knives and cutting blades, of base metal, for machines or for mechanical appliances, for m . . .", , , ,0, , , ,,"15,341",17,1,0,No quantity, ,144,-26,0,0,No quantity, ,77
820820,"Knives and cutting blades, of base metal, for machines or for mechanical appliances, for w . . .", , , ,0, , , ,,"9,338",20,2,0,No quantity, ,23,-12,0,0,No quantity, ,
820830,"Knives and cutting blades, of base metal, for kitchen appliances or for machines used by the . . .", , , ,20, , , ,,"1,924",22,1,0,No quantity, ,53,-35,0,0,No quantity, ,9
820840,"Knives and cutting blades, of base metal, for agricultural, horticultural or forestry machines . . .", , , ,0, , , ,,"4,325",41,1,0,No quantity, ,85,213,0,0,No quantity, ,
820890,"Knives and cutting blades, of base metal, for machines or for mechanical appliances (excl. . . .", , , ,0, , , ,,"31,203",9,2,0,No quantity, ,744,-2,0,0,No quantity, ,76
820900,"Plates, sticks, tips and the like for tools, unmounted, of sintered metal carbides or cermets", , , ,0, , , ,,"43,859",10,1,0,No quantity, ,397,2,0,0,No quantity, ,3
821000,"Hand-operated mechanical devices, of base metal, weighing <= 10 kg, used in the preparation, . . .", , , ,20, , , ,,"4,363",15,1,0,No quantity, ,126,-2,0,0,No quantity, ,-
821110,Sets of assorted articles of knives of heading 8211; sets in which there is a higher number . . ., , , ,5, , , ,,"5,425",21,1,0,No quantity, ,38,6,0,0,No quantity, ,2
821191,"Table knives having fixed blades of base metal, incl. handles (excl. butter knives and fish . . .", , , ,5, , , ,,"1,342",-4,0,0,No quantity, ,604,33,0,0,No quantity, ,1
821192,"Knives with fixed blades of base metal (excl. straw knives, machetes, knives and cutting blades . . .", , , ,5, , , ,,"13,241",3,1,0,No quantity, ,407,55,0,0,No quantity, ,4
821193,"Knives having other than fixed blades, incl. pruning knives, of base metal (excl. razors)", , , ,5, , , ,,"2,601",21,0,0,No quantity, ,117,-14,0,0,No quantity, ,1
821194,"Blades of base metal for table knives, pocket knives and other knives of heading 8211", , , ,5, , , ,,"3,876",14,2,0,No quantity, ,71,-9,0,0,No quantity, ,1
821195,"Handles of base metal for table knives, pocket knives and other knives of heading 8211", , , ,5, , , ,,282,-13,1,31,No quantity,"9,097",22,-9,0,0,No quantity, ,
821210,Non-electric razors of base metal, , , ,20, , , ,,"10,484",-23,0,0,No quantity, ,"5,469",18,0,0,No quantity, ,587
821220,"Safety razor blades of base metal, incl. razor blade blanks in strips", , , ,20, , , ,,"38,810",16,2,0,No quantity, ,"2,496",7,0,0,No quantity, ,"1,248"
821290,Parts of non-electric razors of base metal (excl. safety razor blades and razor blade blanks . . ., , , ,17, , , ,,"26,319",35,8,998,No quantity,"26,372",118,35,0,0,No quantity, ,77
821300,"Scissors, tailors' shears and similar shears, and blades therefor, of base metal (excl. hedge . . .", , , ,25, , , ,,"39,734",4,4,0,No quantity, ,388,25,0,0,No quantity, ,4
821410,"Paperknives, letter openers, erasing knives, pencil sharpeners and blades therefor, of base . . .", , , ,25, , , ,,"9,194",5,4,0,No quantity, ,15,-24,0,0,No quantity, ,3
821420,"Manicure or pedicure sets and instruments, incl. nail files, of base metal (excl. ordinary . . .", , , ,25, , , ,,"13,266",15,2,0,No quantity, ,117,-4,0,0,No quantity, ,3
821490,"Hair clippers, butchers' or kitchen cleavers and other articles of cutlery of base metal, n.e.s.", , , ,25, , , ,,"12,005",1,6,0,No quantity, ,56,-28,0,0,No quantity, ,4
821510,"Sets of spoons, forks or other articles of heading 8215, which may also contain up to an equivalent . . .", , , ,25, , , ,,60,-11,0,0,No quantity, ,33,1,0,0,No quantity, ,3
821520,"Sets consisting of one or more knives of heading 8211 and at least an equal number of spoons, . . .", , , ,25, , , ,,"4,918",15,0,0,No quantity, ,205,-1,0,0,No quantity, ,2
821591,"Spoons, forks, ladles, skimmers, cake-servers, fish-knives, butter-knives, sugar tongs and . . .", , , ,25, , , ,,105,12,0,0,No quantity, ,9,21,0,0,No quantity, ,1
821599,"Spoons, forks, ladles, skimmers, cake-servers, fish-knives, butter-knives, sugar tongs and . . .", , , ,25, , , ,,"40,510",-4,3,0,No quantity, ,512,0,0,0,No quantity, ,8
830110,Padlocks of base metal, , , ,25, , , ,,"15,599",2,1,0,No quantity, ,241,11,0,0,No quantity, ,6
830120,"Locks used for motor vehicles, of base metal", , , ,25, , , ,,"23,426",15,1,0,No quantity, ,480,-6,0,0,No quantity, ,10
830130,"Locks used for furniture, of base metal", , , ,25, , , ,,"16,660",2,4,0,No quantity, ,319,15,0,"1,461",No quantity,"7,283",29
830140,Locks of base metal (excl. padlocks and locks for motor vehicles or furniture), , , ,17, , , ,,"121,670",2,2,0,No quantity, ,"2,441",14,0,0,No quantity, ,50
830150,"Clasps and frames with clasps, incorporating locks, of base metal", , , ,25, , , ,,"3,323",8,3,252,Tons,"13,187",53,-36,0,206,Tons,"7,345",10
830160,"Parts of padlocks, locks, clasps and frames with clasps, incorporating locks, of base metal, . . .", , , ,25, , , ,,"86,488",29,2,"5,652",Tons,"15,302",789,30,0,"4,403",Tons,"7,662",23
830170,"Keys presented separately for padlocks, locks, clasps and frames with clasps incorporating . . .", , , ,25, , , ,,"2,196",8,0,0,No quantity, ,335,16,0,133,No quantity,"12,541",3
830210,"Hinges of all kinds, of base metal", , , ,20, , , ,,"204,932",22,3,0,No quantity, ,"1,372",7,0,0,No quantity, ,92
830220,Castors with mountings of base metal, , , ,18, , , ,,"50,883",13,5,0,No quantity, ,102,-16,0,0,No quantity, ,8
830230,"Base metal mountings, fittings and similar articles suitable for motor vehicles (excl. hinges . . .", , , ,20, , , ,,"33,211",7,0,"4,363",Tons,"7,612","1,141",13,0,"3,552",Tons,"25,302",33
830241,Base metal mountings and fittings suitable for buildings (excl. locks with keys and hinges), , , ,20, , , ,,"163,748",14,2,"23,405",No quantity,"6,996","3,578",6,0,"15,671",No quantity,"7,629",102
830242,"Base metal mountings, fittings and similar articles suitable for furniture (excl. locks with . . .", , , ,20, , , ,,"416,686",29,4,"91,302",No quantity,"4,564","1,541",34,0,"14,642",No quantity,"5,914",99
830249,"Base metal mountings, fittings and similar articles (excl. locks with keys, clasps and frames . . .", , , ,20, , , ,,"62,837",18,2,"12,217",No quantity,"5,143","2,212",-9,0,"2,273",No quantity,"20,993",176
830250,"Hat-racks, hat-pegs, brackets and similar fixtures of base metal", , , ,25, , , ,,"26,809",11,1,0,No quantity, ,"1,343",8,0,0,No quantity, ,19
830260,Automatic door closers of base metal, , , ,17, , , ,,"16,494",2,1,"1,917",Tons,"8,604",474,8,0,0,Tons, ,7
830300,"Armoured or reinforced safes, strongboxes and doors and safe deposit lockers for strongrooms, . . .", , , ,25, , , ,,"8,623",14,1,"1,441",No quantity,"5,984",394,-12,0,0,No quantity, ,6
830400,"Filing cabinets, card-index cabinets, paper trays, paper rests, pen trays, office-stamp stands . . .", , , ,25, , , ,,"2,986",16,1,485,Tons,"6,157",631,-5,0,0,Tons, ,5
830510,"Fittings for loose-leaf binders or files, of base metal (excl. drawing pins and clasps for . . .", , , ,25, , , ,,"18,463",5,9,"2,920",Tons,"6,323",9,-4,0,196,Tons,"6,122",
830520,"Staples in strips, of base metal", , , ,22, , , ,,"5,073",30,1,"2,347",Tons,"2,161",45,-10,0,"1,370",Tons,"2,763",2
830590,"Office articles such as letter clips, letter corners, paper clips and indexing tags, of base . . .", , , ,25, , , ,,"14,763",22,6,"2,987",No quantity,"4,942",23,-24,0,624,No quantity,"7,006",3
830610,"Bells, gongs and the like, non-electric, of base metal (excl. musical instruments)", , , ,25, , , ,,"1,438",7,1,107,No quantity,"13,439",23,23,0,110,No quantity,"7,091",
830621,"Statuettes and other ornaments, of base metal, plated with precious metal (excl. works of art, . . .", , , ,25, , , ,,513,-5,1,0,Tons, ,141,12,0,50,Tons,"42,000",1
830629,"Statuettes and other ornaments, of base metal, not plated with precious metal (excl. works . . .", , , ,25, , , ,,"33,657",36,1,"2,302",No quantity,"14,621",458,13,0,0,No quantity, ,-
830630,"Photograph, picture or similar frames, of base metal; mirrors of base metal (excl. optical . . .", , , ,25, , , ,,"6,880",71,2,428,No quantity,"16,075",191,32,0,0,No quantity, ,1
830710,"Flexible tubing of iron or steel, with or without fittings", , , ,10, , , ,,"32,568",10,1,"4,138",No quantity,"7,870",731,6,0,"3,093",No quantity,"7,568",74
